url;house_id;city;house_type;building_type;price;price_m2;room;bedroom;bathroom;living_area;energy_label;zip;address;year_built;house_age;descrip;photo;m3_gasverbruik_per_jaar;kwh_stroomvebruik_per_jaar
https://www.funda.nl/koop/maarheeze/huis-42129174-de-waterbrink-t2-19-hoekwoning-0-ong/;42129174;maarheeze;huis;Nieuwbouw;423500;3650.9;5;3;1;116;na;6026;De Waterbrink | T2 | 19 | Hoekwoning (Bouwnr. 19);2024;0;GOED NIEUWS: DE  VERKOOPPRIJZEN  ZIJN NU  IN PRIJS  VERLAAGD.  Maarheeze -  De  Waterbrink  De Waterbrink is voor iedereen -  Nu in de  verkoop!  De  nieuwe wijk  de Waterbrink  aan  de dorpsrand van het landelijke Maarheeze is dé plek waar je wil wonen. Met een knipoog naar het verleden, het comfort van nu en de techniek van de toekomst. Duurzaam, natuurinclusief en zichtbaar circulair geeft de Waterbrink een unieke invulling aan het Nieuwe Wonen in de Brainportregio Eindhoven. Op een klein half uurtje afstand van het centrum van de stad, de High Tech Campus en ASML.  In de Waterbrink vind je duurzame woningen die gasloos zijn, voldoen aan de allerhoogste energienorm ENG en deels nul-op-de-meter zijn. Dat wil zeggen dat jouw woning net zoveel elektriciteit opwekt als jij bijvoorbeeld gebruikt aan verlichting, wassen, tv kijken en het opladen van je mobiele telefoon.  Rij- en hoekwoningen De verschillende rij- en hoekwoningen in de Waterbrink hebben hun eigen expressie. Door een afwisseling in kapvorm, topgevels, raampartijen en veranda’s, die de dorpse setting van de wijk versterken. Met hun verfijnde metselwerk in aardse tinten en groene en houten gevelelementen passen deze woningen perfect bij het groene karakter van de Waterbrink.   Hoekwoning T1 De lichte en ruime woonkamers in deze mooie hoekwoningen lenen zich uitstekend voor zowel een zithoek als eethoek. Hoge plafonds en ramen versterken het gevoel van ruimte. Optioneel biedt een uitbouw je zelfs nog enkele woonmeters meer. Op de eerste verdieping is het prima wakker worden in een van de twee grote slaapkamers en onder de stralen van de inloopdouche in je badkamer. Klaar voor een frisse start van de dag. Bovenaan de vaste trap naar de tweede verdieping tref je een verrassend grote zolder aan. In de vrij indeelbare ruimte creëer je met gemak bijvoorbeeld een extra slaapkamer  Hoekwoning T2 Opvallende accenten met hout en groen maken de gevel van deze ruime hoekwoning op een speelse manier bijzonder. Ook bijzonder is de zee aan ruimte binnenin. De grote woonkamer met keuken biedt je de gelegenheid voor een indeling naar jouw eigen wens. Met een zithoek, eethoek en dankzij een uitbreidingsoptie ook bijvoorbeeld met een apart leeshoekje. Heerlijk slapen doe je in de masterbedroom of grote slaapkamer op de eerste verdieping. Hier heb je ook een luxe badkamer en is er bovendien gelegenheid voor een studeerkamer. Nog meer ruimte vind je op de zolder, een verdieping hoger. Laat hier je fantasie maar de vrije loop. Wordt het een slaapkamer, extra werkkamer of hobbyruimte? Zeg jij het maar.  Hoekwoning T3 De indrukwekkend hoge hoekwoning heeft grote ramen aan verschillende zijden, eventueel met een erker. Deze laten je benedenverdieping baden in een zee van licht. Stippel hier gerust jouw eigen woonplannen uit: de woonruimte en eventueel extra uitbouwmogelijkheid lenen zich ervoor. Er is in deze woning voor elk gezinslid wel een privéplek in een van de drie ruime slaapkamers op de eerste verdieping. Je hebt hier bovendien de luxe van een badkamer met toilet, wastafel en douche. Op de zolderverdieping is een speciaal gedeelte voor wasmachine en droger en een fantastische ruimte die je helemaal naar eigen inzicht kunt indelen.   Hoekwoning T4 Laat je verrassen door de ruime benedenverdieping van deze hoekwoning. Hier combineer je met gemak een knus zitgedeelte en een eethoek met grote eettafel bij de keuken. Heel gezellig als je staat te koken voor gezinsleden of gasten. Aan de achterzijde kun je er bovendien ook nog voor kiezen om je woning uit te bouwen. En dankzij de grote achtertuin lever je daarmee aan buitenleven niets in. Zowel de eerste verdieping als de royale zolder krijgen veel licht door de enorme raampartij aan de voorzijde. Een masterbedroom, twee grote slaapkamers en luxe badkamer maken maken deze fijne hoekwoning compleet. Hier kun je wonen zoals jij dat wenst  Neem een kijkje op de projectwebsite  voor meer informatie en schrijf je in voor jouw droomwoning.  Vragen? Neem dan contact met ons op via 040 269 2530 of stuur een mailtje naar;https://cloud.funda.nl/valentina_media/175/485/798_1440x960.jpg 1440w, https://cloud.funda.nl/valentina_media/175/485/798_180x120.jpg 180w, https://cloud.funda.nl/valentina_media/175/485/798_360x240.jpg 360w, https://cloud.funda.nl/valentina_media/175/485/798_720x480.jpg 720w, https://cloud.funda.nl/valentina_media/175/485/798_1080x720.jpg 1080w, https://cloud.funda.nl/valentina_media/175/485/798_2160x1440.jpg 2160w, https://cloud.funda.nl/valentina_media/175/485/812_1440x960.jpg 1440w, https://cloud.funda.nl/valentina_media/175/485/812_180x120.jpg 180w, https://cloud.funda.nl/valentina_media/175/485/812_360x240.jpg 360w, https://cloud.funda.nl/valentina_media/175/485/812_720x480.jpg 720w, https://cloud.funda.nl/valentina_media/175/485/812_1080x720.jpg 1080w, https://cloud.funda.nl/valentina_media/175/485/812_2160x1440.jpg 2160w;1032;
https://www.funda.nl/koop/maarheeze/huis-42129057-de-waterbrink-t2-42-rijwoning-0-ong/;42129057;maarheeze;huis;Nieuwbouw;403500;3478.4;5;3;1;116;na;6026;De Waterbrink | T2 | 42 | Rijwoning (Bouwnr. 42);2024;0;Maarheeze - De  Waterbrink   De  Waterbrink is  voor iedereen - Nu  in  de verkoop!  De nieuwe wijk de  Waterbrink  aan de dorpsrand  van  het  landelijke  Maarheeze  is  dé  plek waar  je wil wonen. Met een knipoog naar het verleden, het comfort van nu en de techniek van de toekomst. Duurzaam, natuurinclusief en zichtbaar circulair geeft de Waterbrink een unieke invulling aan het Nieuwe Wonen in de Brainportregio Eindhoven. Op een klein half uurtje afstand van het centrum van de stad, de High Tech Campus en ASML.  In de Waterbrink vind je duurzame woningen die gasloos zijn, voldoen aan de allerhoogste energienorm ENG en deels nul-op-de-meter zijn. Dat wil zeggen dat jouw woning net zoveel elektriciteit opwekt als jij bijvoorbeeld gebruikt aan verlichting, wassen, tv kijken en het opladen van je mobiele telefoon.  Rij- en hoekwoningen De verschillende rij- en hoekwoningen in de Waterbrink hebben hun eigen expressie. Door een afwisseling in kapvorm, topgevels, raampartijen en veranda’s, die de dorpse setting van de wijk versterken. Met hun verfijnde metselwerk in aardse tinten en groene en houten gevelelementen passen deze woningen perfect bij het groene karakter van de Waterbrink.   Genieten met een grote G In de gezellige rij- of hoekwoning in de Waterbrink vindt iedereen zijn plek. Heerlijk met zijn allen op de grote bank in de zithoek een film kijken of samen in de eethoek, aan de grote eettafel vol met de lekkerste gerechten. Op de eerste verdieping vind je een ruime masterbedroom, een grote slaap- annex studeerkamer en douch je heerlijk in je luxe badkamer. Een trap hoger op de tweede verdieping beschik je over een grote zolder, waar je met gemak een extra slaapkamer kunt maken. Deze rijwoning is Genieten met een grote G.  Rijwoning T1 Deze fijne gezinswoning heeft genoeg ruimte om tegemoet te komen aan de indeling zoals jij die voor ogen hebt. De grote woonkamer deel je naar eigen inzicht in met zithoek en eethoek. Kies je de optie voor een extra uitbouw, dan heb je zelfs nog meer ruimte. Voor bijvoorbeeld een studeerhoek. Op de eerste verdieping zorgen de ramen voor een heerlijk lichte masterbedroom en slaapkamer. Geniet hier van het luxe sanitair in je fijne badkamer met inloopdouche en wastafel. Kom je met twee slaapkamers niet uit? Gebruik dan gerust de ruime zolder op de tweede verdieping voor een derde.  Rijwoning T2 De schaduwrijke veranda en mooie houten delen geven de gevel van deze prachtige gezinswoning extra cachet. Stap je door de voordeur, dan kom je via de hal in een grote woonkamer. Die biedt ruimte aan zowel een zithoek als gezellige eethoek. Ook boven heb je volop de ruimte. Op de eerste verdieping in de grote slaapkamers en de badkamer met luxe sanitair. Op de tweede verdieping vind je een royale zolder. Die je prima kunt benutten voor een extra slaapkamer, studeerkamer of hobbyruimte. Maar wellicht heb je zelf nog een ander idee?  Rijwoning T3 Wat een heerlijke plek om te wonen is deze prachtige tussenwoning met puntige topgevel! De grote raampartijen zorgen voor veel fijne lichtinval en de verbinding met buiten. Ontspannen doe je in je ruime zithoek met zicht op je tuin. Er is bovendien een uitbouw optie voor nog meer ruimte. Bijvoorbeeld voor een extra hoekje om ongestoord thuis te kunnen werken. Deze tussenwoning zal je verrassen, met maar liefst drie slaapkamers op de eerste verdieping en een luxe badkamer met douche, wastafel en toilet. Met al zoveel ruimte rest er nog maar één vraag: waarvoor ga je de grote zolder op de tweede verdieping gebruiken?  Neem een kijkje op de projectwebsite  voor meer informatie en schrijf je in voor jouw droomwoning.  Vragen? Neem dan contact met ons op via 040 269 2530 of stuur een mailtje naar;https://cloud.funda.nl/valentina_media/175/485/741_1440x960.jpg 1440w, https://cloud.funda.nl/valentina_media/175/485/741_180x120.jpg 180w, https://cloud.funda.nl/valentina_media/175/485/741_360x240.jpg 360w, https://cloud.funda.nl/valentina_media/175/485/741_720x480.jpg 720w, https://cloud.funda.nl/valentina_media/175/485/741_1080x720.jpg 1080w, https://cloud.funda.nl/valentina_media/175/485/741_2160x1440.jpg 2160w, https://cloud.funda.nl/valentina_media/175/485/756_1440x960.jpg 1440w, https://cloud.funda.nl/valentina_media/175/485/756_180x120.jpg 180w, https://cloud.funda.nl/valentina_media/175/485/756_360x240.jpg 360w, https://cloud.funda.nl/valentina_media/175/485/756_720x480.jpg 720w, https://cloud.funda.nl/valentina_media/175/485/756_1080x720.jpg 1080w, https://cloud.funda.nl/valentina_media/175/485/756_2160x1440.jpg 2160w, https://cloud.funda.nl/valentina_media/175/485/779_1440x960.jpg 1440w, https://cloud.funda.nl/valentina_media/175/485/779_180x120.jpg 180w, https://cloud.funda.nl/valentina_media/175/485/779_360x240.jpg 360w, https://cloud.funda.nl/valentina_media/175/485/779_720x480.jpg 720w, https://cloud.funda.nl/valentina_media/175/485/779_1080x720.jpg 1080w, https://cloud.funda.nl/valentina_media/175/485/779_2160x1440.jpg 2160w;1123;
https://www.funda.nl/koop/maarheeze/huis-42129169-de-waterbrink-56-twee-onder-een-kap-0-ong/;42129169;maarheeze;huis;Nieuwbouw;512500;3510.3;5;3;1;146;na;6026;De Waterbrink | 56 | Twee-onder-een kap (Bouwnr. 56);2024;0;GOED NIEUWS: DE  VERKOOPPRIJZEN  ZIJN NU  IN PRIJS  VERLAAGD.  Maarheeze -  De  Waterbrink  De Waterbrink is  voor  iedereen -  Nu in de  verkoop!  De  nieuwe wijk de  Waterbrink  aan  de dorpsrand van het landelijke Maarheeze is dé plek waar je wil wonen. Met een knipoog naar het verleden, het comfort van nu en de techniek van de toekomst. Duurzaam, natuurinclusief en zichtbaar circulair geeft de Waterbrink een unieke invulling aan het Nieuwe Wonen in de Brainportregio Eindhoven. Op een klein half uurtje afstand van het centrum van de stad, de High Tech Campus en ASML.  In de Waterbrink vind je duurzame woningen die gasloos zijn, voldoen aan de allerhoogste energienorm ENG en deels nul-op-de-meter zijn. Dat wil zeggen dat jouw woning net zoveel elektriciteit opwekt als jij bijvoorbeeld gebruikt aan verlichting, wassen, tv kijken en het opladen van je mobiele telefoon.  Twee-onder-een-kapwoning De in het oog springende twee-onder-een-kapwoningen met garage in de Waterbrink hebben absoluut één ding gemeen: het zijn stuk voor stuk zeer ruim bemeten gezinswoningen met een warme uitstraling. Houten lamellen zorgen voor een eigentijdse toevoeging aan het ambachtelijke metselwerk in rustige aardetinten.  Zonnestralen door de metershoge ramen zetten je sfeervolle woonkamer in lichterlaaie. Via de keuken wandel je door de openslaande tuindeuren zo je grote achtertuin in, voor verkoelende beschutting onder de blaadjes van de bomen in de Waterbrink. En wil je even een moment voor jezelf? Ontspan je dan maar eens lekker in je luxueuze badkamer of een van drie ruime slaapkamers op de eerste verdieping. Als klap op de vuurpijl heb je in deze twee-onder-een-kapwoning ook nog eens een royale zolderverdieping. Ideaal voor bijvoorbeeld een gastenverblijf. Of gebruik de ruimte als werkkamer of hobbyruimte of.... Kies jij maar!  Neem een kijkje op de projectwebsite  voor meer informatie en schrijf je in voor jouw droomwoning.  Vragen? Neem dan contact met ons op via 040 269 2530 of stuur een mailtje naar;https://cloud.funda.nl/valentina_media/175/485/864_1440x960.jpg 1440w, https://cloud.funda.nl/valentina_media/175/485/864_180x120.jpg 180w, https://cloud.funda.nl/valentina_media/175/485/864_360x240.jpg 360w, https://cloud.funda.nl/valentina_media/175/485/864_720x480.jpg 720w, https://cloud.funda.nl/valentina_media/175/485/864_1080x720.jpg 1080w, https://cloud.funda.nl/valentina_media/175/485/864_2160x1440.jpg 2160w, https://cloud.funda.nl/valentina_media/175/485/859_1440x960.jpg 1440w, https://cloud.funda.nl/valentina_media/175/485/859_180x120.jpg 180w, https://cloud.funda.nl/valentina_media/175/485/859_360x240.jpg 360w, https://cloud.funda.nl/valentina_media/175/485/859_720x480.jpg 720w, https://cloud.funda.nl/valentina_media/175/485/859_1080x720.jpg 1080w, https://cloud.funda.nl/valentina_media/175/485/859_2160x1440.jpg 2160w;1602;
