url;house_id;city;house_type;building_type;price;price_m2;room;bedroom;bathroom;living_area;energy_label;zip;address;year_built;house_age;descrip;photo;m3_gasverbruik_per_jaar;kwh_stroomvebruik_per_jaar
https://www.funda.nl/huur/helmond/appartement-43580018-waardstraat-53/;43580018;helmond;appartement;Nieuwbouw;1175;17.3;3;2;1;68;na;5701;Waardstraat 53;2024;0;De verhuur van  de  laatste 3  gebouwen in  het project Huren in  Oranjekade,  Gebouw L, M en N is gestart! Het  huuraanbod van alle  64  prachtige appartementen  in de  gebouwen  L,  M  en N wordt staan live op hureninoranjekade.nl. Wil jij ook huren op deze mooie plek? Schrijf je in op deze website!   Woon uniek in de Oranjekade 64 nieuwe diverse type appartementen op een fantastische locatie in het centrum van Helmond!   Gebouw L – Beschikt over studio’s, driekamer-/ en vierkamerappartementen, in totaal 23 appartementen Gebouw M – In totaal 18 driekamerappartementen Gebouw N – Beschikt ook over een stadswoning en 22 driekamerappartementen. In totaal 23 appartementen  Verwachte oplevering is in het 3e of 4e kwartaal van 2024.   Het betreft hier 64 nieuwbouwappartementen allerlei soorten, vormen en maten. Denk aan een stijlvolle stadswoning met meerdere woonlagen, studio’s en gelijkvloerse appartementen met 1, 2 of 3 slaapkamers.  - Met prachtige PVC vloer in alle appartementen - Alle appartementen hebben een zonnig balkon of terras - Energiezuinig en Gasloos - Luxe en moderne keuken met inbouwappartament - Compleet afgewerkte badkamer met inloopdouche  - Een eigen berging en parkeerplaats in de garage - Wonen in het centrum van Helmond met de natuur op een paar minuten   loopafstand - Pal aan het prachtige kanaal  In Oranjekade woon je straks pal aan het water dat zo kenmerkend is voor Helmond: het kanaal, ook wel bekend als de Zuid-Willemsvaart. Oranjekade wisselt stijlvolle pakhuisarchitectuur af met eigentijdse woongebouwen. Het plan heeft een allure die je in wereldsteden als Amsterdam en Berlijn ziet. In Oranjekade woon je in de natuur en ben je toch binnen een paar minuten in het hart van de bruisende stad. Veel beter kun je het niet treffen.  Helmond is een levendige, middelgrote stad waar ontzettend veel te beleven is. De stad beschikt over een ruim voorzieningenaanbod zoals winkels, openbaar vervoer, vier treinstations, bioscoop, scholen en voortreffelijke horeca, waaronder een sterrenrestaurant.  Op enkele minuten fietsen vanaf het centrum van Helmond ligt Oranjekade. Het plan ligt ten oosten van de Kanaaldijk en ten westen van de Albert Heijn XL en de watertoren. De doorgaande weg Oostende ontsluit het plangebied aan de noordzijde en de Waardstraat maakt Oranjekade aan de zuidzijde toegankelijk.  Qua bereikbaarheid is Oranjekade geweldig gelegen! De belangrijkste verkeersader van Helmond (de N270/Kasteel-Traverse) ligt op een paar autominuten afstand.  Ga je toch liever met het openbaar vervoer dan kun je voor het plan opstappen op de bus of ben je in enkele fietsminuten op het treinstation.  Interesse? Neem contact op met het verhuurteam of ga naar de website hureninoranjekade.nl;https://cloud.funda.nl/valentina_media/190/048/556_1440x960.jpg 1440w, https://cloud.funda.nl/valentina_media/190/048/556_180x120.jpg 180w, https://cloud.funda.nl/valentina_media/190/048/556_360x240.jpg 360w, https://cloud.funda.nl/valentina_media/190/048/556_720x480.jpg 720w, https://cloud.funda.nl/valentina_media/190/048/556_1080x720.jpg 1080w, https://cloud.funda.nl/valentina_media/190/048/556_2160x1440.jpg 2160w, https://cloud.funda.nl/valentina_media/190/048/560_1440x960.jpg 1440w, https://cloud.funda.nl/valentina_media/190/048/560_180x120.jpg 180w, https://cloud.funda.nl/valentina_media/190/048/560_360x240.jpg 360w, https://cloud.funda.nl/valentina_media/190/048/560_720x480.jpg 720w, https://cloud.funda.nl/valentina_media/190/048/560_1080x720.jpg 1080w, https://cloud.funda.nl/valentina_media/190/048/560_2160x1440.jpg 2160w, https://cloud.funda.nl/valentina_media/190/048/551_1440x960.jpg 1440w, https://cloud.funda.nl/valentina_media/190/048/551_180x120.jpg 180w, https://cloud.funda.nl/valentina_media/190/048/551_360x240.jpg 360w, https://cloud.funda.nl/valentina_media/190/048/551_720x480.jpg 720w, https://cloud.funda.nl/valentina_media/190/048/551_1080x720.jpg 1080w, https://cloud.funda.nl/valentina_media/190/048/551_2160x1440.jpg 2160w, https://cloud.funda.nl/valentina_media/190/048/552_1440x960.jpg 1440w, https://cloud.funda.nl/valentina_media/190/048/552_180x120.jpg 180w, https://cloud.funda.nl/valentina_media/190/048/552_360x240.jpg 360w, https://cloud.funda.nl/valentina_media/190/048/552_720x480.jpg 720w, https://cloud.funda.nl/valentina_media/190/048/552_1080x720.jpg 1080w, https://cloud.funda.nl/valentina_media/190/048/552_2160x1440.jpg 2160w, https://cloud.funda.nl/valentina_media/190/048/553_1440x960.jpg 1440w, https://cloud.funda.nl/valentina_media/190/048/553_180x120.jpg 180w, https://cloud.funda.nl/valentina_media/190/048/553_360x240.jpg 360w, https://cloud.funda.nl/valentina_media/190/048/553_720x480.jpg 720w, https://cloud.funda.nl/valentina_media/190/048/553_1080x720.jpg 1080w, https://cloud.funda.nl/valentina_media/190/048/553_2160x1440.jpg 2160w, https://cloud.funda.nl/valentina_media/190/048/554_1440x960.jpg 1440w, https://cloud.funda.nl/valentina_media/190/048/554_180x120.jpg 180w, https://cloud.funda.nl/valentina_media/190/048/554_360x240.jpg 360w, https://cloud.funda.nl/valentina_media/190/048/554_720x480.jpg 720w, https://cloud.funda.nl/valentina_media/190/048/554_1080x720.jpg 1080w, https://cloud.funda.nl/valentina_media/190/048/554_2160x1440.jpg 2160w, https://cloud.funda.nl/valentina_media/190/048/555_1440x960.jpg 1440w, https://cloud.funda.nl/valentina_media/190/048/555_180x120.jpg 180w, https://cloud.funda.nl/valentina_media/190/048/555_360x240.jpg 360w, https://cloud.funda.nl/valentina_media/190/048/555_720x480.jpg 720w, https://cloud.funda.nl/valentina_media/190/048/555_1080x720.jpg 1080w, https://cloud.funda.nl/valentina_media/190/048/555_2160x1440.jpg 2160w;1264.0;
https://www.funda.nl/huur/helmond/appartement-43445812-mierloseweg-317/;43445812;helmond;appartement;Bestaande bouw;1395;15.7;3;2;1;89;>A+;5707;Mierloseweg 317;1925;99;"Gestoffeerd nieuw 3-kamer  appartement  nabij centrum  en station.  Met zijn woonoppervlakte van  89m2,  zonnepanelen en airco is dit  een  uniek appartement.  Het is modern  ingericht en  bevat  een prachtige PVC-vloer.  Deze  woning  is voorzien van een luxe keuken met stenen blad, magnetron, oven en vaatwasser. Dit hoogwaardig afgewerkte appartement is nu direct beschikbaar voor verhuur.  Door de zonnepanelen wekt u uw eigen energie op. Warm water komt van een warmtepompboiler en de binnentemperatuur regelt u met de airco.  Dit complex is zeer gunstig gelegen t.o.v. het station ( 2 min) en het winkelcentrum  ( 5 min). Voor de deur is voldoende parkeergelegenheid.  Globale omschrijving:  Entree van het gebouw middels een lobby. Vanuit de hal komt u in de riante woonkamer met nieuwe keuken. Daar tegenover een multifunctioneel te gebruiken ruimte; slaapkamer, maar ook ideaal om in te richten als werkplek. Vanuit de keuken toegang naar de buitenpatio. Aan de achterzijde ligt een grote slaapkamer. De modern ingerichte badkamer bezit een mooie tegelafwerking, inloopdouche en een dubbele wastafel met ombouw. Onder de trap is een extra opbergruimte. Er is ook een extra grote kast aanwezig. Naast de badkamer is de technische ruimte waar de wasmachine en de droger staan.  Deze informatie is door ons met de nodige zorgvuldigheid samengesteld. Geen aansprakelijkheid wordt aanvaard voor enige onvolledigheid, onjuistheid of anderszins, of de consequenties daarvan. Alle maten en afmetingen zijn indicatief en niet exact volgens de NEN-2580 norm.  Upholstered new 3-room apartment near the center and station. With its living area of ??89m2, solar panels and air conditioning, this is a unique apartment. It is modernly furnished and contains a beautiful PVC floor. This house is equipped with a luxury kitchen with stone top, microwave, oven and dishwasher. This high-quality finished apartment is now immediately available for rental.  You generate your own energy through the solar panels. Hot water comes from a heat pump boiler and you can regulate the indoor temperature with the air conditioning.  This complex is very conveniently located for the station (2 minutes) and the shopping center  (5 mins). There is ample parking space in front of the door.  global description:  Entrance of the building through a lobby. From the hall you enter the spacious living room with a new kitchen. Opposite a multifunctional space; bedroom, but also ideal to set up as a workplace. From the kitchen access to the outside patio. At the rear is a large bedroom. The modern bathroom has a beautiful tile finish, walk-in shower and a double sink with cabinet. There is an extra storage space under the stairs. There is also an extra large closet. Next to the bathroom is the technical room where the washing machine and dryer are located.  This information has been carefully compiled by us. No liability is accepted for any incompleteness, inaccuracy or otherwise, or the consequences thereof. All measurements and dimensions are indicative and not exact according to the NEN-2580 standard.";https://cloud.funda.nl/valentina_media/189/630/357_1440x960.jpg 1440w, https://cloud.funda.nl/valentina_media/189/630/357_180x120.jpg 180w, https://cloud.funda.nl/valentina_media/189/630/357_360x240.jpg 360w, https://cloud.funda.nl/valentina_media/189/630/357_720x480.jpg 720w, https://cloud.funda.nl/valentina_media/189/630/357_1080x720.jpg 1080w, https://cloud.funda.nl/valentina_media/189/630/357_2160x1440.jpg 2160w, https://cloud.funda.nl/valentina_media/189/630/348_1440x960.jpg 1440w, https://cloud.funda.nl/valentina_media/189/630/348_180x120.jpg 180w, https://cloud.funda.nl/valentina_media/189/630/348_360x240.jpg 360w, https://cloud.funda.nl/valentina_media/189/630/348_720x480.jpg 720w, https://cloud.funda.nl/valentina_media/189/630/348_1080x720.jpg 1080w, https://cloud.funda.nl/valentina_media/189/630/348_2160x1440.jpg 2160w, https://cloud.funda.nl/valentina_media/189/630/339_1440x960.jpg 1440w, https://cloud.funda.nl/valentina_media/189/630/339_180x120.jpg 180w, https://cloud.funda.nl/valentina_media/189/630/339_360x240.jpg 360w, https://cloud.funda.nl/valentina_media/189/630/339_720x480.jpg 720w, https://cloud.funda.nl/valentina_media/189/630/339_1080x720.jpg 1080w, https://cloud.funda.nl/valentina_media/189/630/339_2160x1440.jpg 2160w, https://cloud.funda.nl/valentina_media/189/630/343_1440x960.jpg 1440w, https://cloud.funda.nl/valentina_media/189/630/343_180x120.jpg 180w, https://cloud.funda.nl/valentina_media/189/630/343_360x240.jpg 360w, https://cloud.funda.nl/valentina_media/189/630/343_720x480.jpg 720w, https://cloud.funda.nl/valentina_media/189/630/343_1080x720.jpg 1080w, https://cloud.funda.nl/valentina_media/189/630/343_2160x1440.jpg 2160w, https://cloud.funda.nl/valentina_media/189/630/349_1440x960.jpg 1440w, https://cloud.funda.nl/valentina_media/189/630/349_180x120.jpg 180w, https://cloud.funda.nl/valentina_media/189/630/349_360x240.jpg 360w, https://cloud.funda.nl/valentina_media/189/630/349_720x480.jpg 720w, https://cloud.funda.nl/valentina_media/189/630/349_1080x720.jpg 1080w, https://cloud.funda.nl/valentina_media/189/630/349_2160x1440.jpg 2160w, https://cloud.funda.nl/valentina_media/189/630/338_1440x960.jpg 1440w, https://cloud.funda.nl/valentina_media/189/630/338_180x120.jpg 180w, https://cloud.funda.nl/valentina_media/189/630/338_360x240.jpg 360w, https://cloud.funda.nl/valentina_media/189/630/338_720x480.jpg 720w, https://cloud.funda.nl/valentina_media/189/630/338_1080x720.jpg 1080w, https://cloud.funda.nl/valentina_media/189/630/338_2160x1440.jpg 2160w, https://cloud.funda.nl/valentina_media/189/630/341_1440x960.jpg 1440w, https://cloud.funda.nl/valentina_media/189/630/341_180x120.jpg 180w, https://cloud.funda.nl/valentina_media/189/630/341_360x240.jpg 360w, https://cloud.funda.nl/valentina_media/189/630/341_720x480.jpg 720w, https://cloud.funda.nl/valentina_media/189/630/341_1080x720.jpg 1080w, https://cloud.funda.nl/valentina_media/189/630/341_2160x1440.jpg 2160w, https://cloud.funda.nl/valentina_media/189/630/340_1440x960.jpg 1440w, https://cloud.funda.nl/valentina_media/189/630/340_180x120.jpg 180w, https://cloud.funda.nl/valentina_media/189/630/340_360x240.jpg 360w, https://cloud.funda.nl/valentina_media/189/630/340_720x480.jpg 720w, https://cloud.funda.nl/valentina_media/189/630/340_1080x720.jpg 1080w, https://cloud.funda.nl/valentina_media/189/630/340_2160x1440.jpg 2160w, https://cloud.funda.nl/valentina_media/189/630/345_1440x960.jpg 1440w, https://cloud.funda.nl/valentina_media/189/630/345_180x120.jpg 180w, https://cloud.funda.nl/valentina_media/189/630/345_360x240.jpg 360w, https://cloud.funda.nl/valentina_media/189/630/345_720x480.jpg 720w, https://cloud.funda.nl/valentina_media/189/630/345_1080x720.jpg 1080w, https://cloud.funda.nl/valentina_media/189/630/345_2160x1440.jpg 2160w, https://cloud.funda.nl/valentina_media/189/630/344_1440x960.jpg 1440w, https://cloud.funda.nl/valentina_media/189/630/344_180x120.jpg 180w, https://cloud.funda.nl/valentina_media/189/630/344_360x240.jpg 360w, https://cloud.funda.nl/valentina_media/189/630/344_720x480.jpg 720w, https://cloud.funda.nl/valentina_media/189/630/344_1080x720.jpg 1080w, https://cloud.funda.nl/valentina_media/189/630/344_2160x1440.jpg 2160w, https://cloud.funda.nl/valentina_media/189/630/356_1440x960.jpg 1440w, https://cloud.funda.nl/valentina_media/189/630/356_180x120.jpg 180w, https://cloud.funda.nl/valentina_media/189/630/356_360x240.jpg 360w, https://cloud.funda.nl/valentina_media/189/630/356_720x480.jpg 720w, https://cloud.funda.nl/valentina_media/189/630/356_1080x720.jpg 1080w, https://cloud.funda.nl/valentina_media/189/630/356_2160x1440.jpg 2160w, https://cloud.funda.nl/valentina_media/189/630/358_1440x960.jpg 1440w, https://cloud.funda.nl/valentina_media/189/630/358_180x120.jpg 180w, https://cloud.funda.nl/valentina_media/189/630/358_360x240.jpg 360w, https://cloud.funda.nl/valentina_media/189/630/358_720x480.jpg 720w, https://cloud.funda.nl/valentina_media/189/630/358_1080x720.jpg 1080w, https://cloud.funda.nl/valentina_media/189/630/358_2160x1440.jpg 2160w, https://cloud.funda.nl/valentina_media/189/630/352_1440x960.jpg 1440w, https://cloud.funda.nl/valentina_media/189/630/352_180x120.jpg 180w, https://cloud.funda.nl/valentina_media/189/630/352_360x240.jpg 360w, https://cloud.funda.nl/valentina_media/189/630/352_720x480.jpg 720w, https://cloud.funda.nl/valentina_media/189/630/352_1080x720.jpg 1080w, https://cloud.funda.nl/valentina_media/189/630/352_2160x1440.jpg 2160w, https://cloud.funda.nl/valentina_media/189/630/347_1440x960.jpg 1440w, https://cloud.funda.nl/valentina_media/189/630/347_180x120.jpg 180w, https://cloud.funda.nl/valentina_media/189/630/347_360x240.jpg 360w, https://cloud.funda.nl/valentina_media/189/630/347_720x480.jpg 720w, https://cloud.funda.nl/valentina_media/189/630/347_1080x720.jpg 1080w, https://cloud.funda.nl/valentina_media/189/630/347_2160x1440.jpg 2160w, https://cloud.funda.nl/valentina_media/189/630/355_1440x960.jpg 1440w, https://cloud.funda.nl/valentina_media/189/630/355_180x120.jpg 180w, https://cloud.funda.nl/valentina_media/189/630/355_360x240.jpg 360w, https://cloud.funda.nl/valentina_media/189/630/355_720x480.jpg 720w, https://cloud.funda.nl/valentina_media/189/630/355_1080x720.jpg 1080w, https://cloud.funda.nl/valentina_media/189/630/355_2160x1440.jpg 2160w, https://cloud.funda.nl/valentina_media/189/630/346_1440x960.jpg 1440w, https://cloud.funda.nl/valentina_media/189/630/346_180x120.jpg 180w, https://cloud.funda.nl/valentina_media/189/630/346_360x240.jpg 360w, https://cloud.funda.nl/valentina_media/189/630/346_720x480.jpg 720w, https://cloud.funda.nl/valentina_media/189/630/346_1080x720.jpg 1080w, https://cloud.funda.nl/valentina_media/189/630/346_2160x1440.jpg 2160w, https://cloud.funda.nl/valentina_media/189/630/350_1440x960.jpg 1440w, https://cloud.funda.nl/valentina_media/189/630/350_180x120.jpg 180w, https://cloud.funda.nl/valentina_media/189/630/350_360x240.jpg 360w, https://cloud.funda.nl/valentina_media/189/630/350_720x480.jpg 720w, https://cloud.funda.nl/valentina_media/189/630/350_1080x720.jpg 1080w, https://cloud.funda.nl/valentina_media/189/630/350_2160x1440.jpg 2160w, https://cloud.funda.nl/valentina_media/189/630/342_1440x960.jpg 1440w, https://cloud.funda.nl/valentina_media/189/630/342_180x120.jpg 180w, https://cloud.funda.nl/valentina_media/189/630/342_360x240.jpg 360w, https://cloud.funda.nl/valentina_media/189/630/342_720x480.jpg 720w, https://cloud.funda.nl/valentina_media/189/630/342_1080x720.jpg 1080w, https://cloud.funda.nl/valentina_media/189/630/342_2160x1440.jpg 2160w, https://cloud.funda.nl/valentina_media/189/630/359_1440x960.jpg 1440w, https://cloud.funda.nl/valentina_media/189/630/359_180x120.jpg 180w, https://cloud.funda.nl/valentina_media/189/630/359_360x240.jpg 360w, https://cloud.funda.nl/valentina_media/189/630/359_720x480.jpg 720w, https://cloud.funda.nl/valentina_media/189/630/359_1080x720.jpg 1080w, https://cloud.funda.nl/valentina_media/189/630/359_2160x1440.jpg 2160w, https://cloud.funda.nl/valentina_media/189/630/353_1440x960.jpg 1440w, https://cloud.funda.nl/valentina_media/189/630/353_180x120.jpg 180w, https://cloud.funda.nl/valentina_media/189/630/353_360x240.jpg 360w, https://cloud.funda.nl/valentina_media/189/630/353_720x480.jpg 720w, https://cloud.funda.nl/valentina_media/189/630/353_1080x720.jpg 1080w, https://cloud.funda.nl/valentina_media/189/630/353_2160x1440.jpg 2160w, https://cloud.funda.nl/valentina_media/189/630/354_1440x960.jpg 1440w, https://cloud.funda.nl/valentina_media/189/630/354_180x120.jpg 180w, https://cloud.funda.nl/valentina_media/189/630/354_360x240.jpg 360w, https://cloud.funda.nl/valentina_media/189/630/354_720x480.jpg 720w, https://cloud.funda.nl/valentina_media/189/630/354_1080x720.jpg 1080w, https://cloud.funda.nl/valentina_media/189/630/354_2160x1440.jpg 2160w, https://cloud.funda.nl/valentina_media/189/630/351_1440x960.jpg 1440w, https://cloud.funda.nl/valentina_media/189/630/351_180x120.jpg 180w, https://cloud.funda.nl/valentina_media/189/630/351_360x240.jpg 360w, https://cloud.funda.nl/valentina_media/189/630/351_720x480.jpg 720w, https://cloud.funda.nl/valentina_media/189/630/351_1080x720.jpg 1080w, https://cloud.funda.nl/valentina_media/189/630/351_2160x1440.jpg 2160w;1087.0;694.0
https://www.funda.nl/huur/helmond/appartement-43580056-waardstraat-75/;43580056;helmond;appartement;Nieuwbouw;1295;16.0;3;2;1;81;na;5701;Waardstraat 75;2024;0;De verhuur van  de  laatste 3  gebouwen in  het project Huren in  Oranjekade,  Gebouw L, M en  N  is  gestart! Het  huuraanbod van alle  64 prachtige appartementen in  de gebouwen  L, M  en N wordt staan live op hureninoranjekade.nl. Wil jij ook huren op deze mooie plek? Schrijf je in op deze website!   Woon uniek in de Oranjekade 64 nieuwe diverse type appartementen op een fantastische locatie in het centrum van Helmond!   Gebouw L – Beschikt over studio’s, driekamer-/ en vierkamerappartementen, in totaal 23 appartementen Gebouw M – In totaal 18 driekamerappartementen Gebouw N – Beschikt ook over een stadswoning en 22 driekamerappartementen. In totaal 23 appartementen  Verwachte oplevering is in het 3e of 4e kwartaal van 2024.   Het betreft hier 64 nieuwbouwappartementen allerlei soorten, vormen en maten. Denk aan een stijlvolle stadswoning met meerdere woonlagen, studio’s en gelijkvloerse appartementen met 1, 2 of 3 slaapkamers.  - Met prachtige PVC vloer in alle appartementen - Alle appartementen hebben een zonnig balkon of terras - Energiezuinig en Gasloos - Luxe en moderne keuken met inbouwappartament - Compleet afgewerkte badkamer met inloopdouche  - Een eigen berging en parkeerplaats in de garage - Wonen in het centrum van Helmond met de natuur op een paar minuten   loopafstand - Pal aan het prachtige kanaal  In Oranjekade woon je straks pal aan het water dat zo kenmerkend is voor Helmond: het kanaal, ook wel bekend als de Zuid-Willemsvaart. Oranjekade wisselt stijlvolle pakhuisarchitectuur af met eigentijdse woongebouwen. Het plan heeft een allure die je in wereldsteden als Amsterdam en Berlijn ziet. In Oranjekade woon je in de natuur en ben je toch binnen een paar minuten in het hart van de bruisende stad. Veel beter kun je het niet treffen.  Helmond is een levendige, middelgrote stad waar ontzettend veel te beleven is. De stad beschikt over een ruim voorzieningenaanbod zoals winkels, openbaar vervoer, vier treinstations, bioscoop, scholen en voortreffelijke horeca, waaronder een sterrenrestaurant.  Op enkele minuten fietsen vanaf het centrum van Helmond ligt Oranjekade. Het plan ligt ten oosten van de Kanaaldijk en ten westen van de Albert Heijn XL en de watertoren. De doorgaande weg Oostende ontsluit het plangebied aan de noordzijde en de Waardstraat maakt Oranjekade aan de zuidzijde toegankelijk.  Qua bereikbaarheid is Oranjekade geweldig gelegen! De belangrijkste verkeersader van Helmond (de N270/Kasteel-Traverse) ligt op een paar autominuten afstand.  Ga je toch liever met het openbaar vervoer dan kun je voor het plan opstappen op de bus of ben je in enkele fietsminuten op het treinstation.  Interesse? Neem contact op met het verhuurteam of ga naar de website hureninoranjekade.nl;https://cloud.funda.nl/valentina_media/190/050/877_1440x960.jpg 1440w, https://cloud.funda.nl/valentina_media/190/050/877_180x120.jpg 180w, https://cloud.funda.nl/valentina_media/190/050/877_360x240.jpg 360w, https://cloud.funda.nl/valentina_media/190/050/877_720x480.jpg 720w, https://cloud.funda.nl/valentina_media/190/050/877_1080x720.jpg 1080w, https://cloud.funda.nl/valentina_media/190/050/877_2160x1440.jpg 2160w, https://cloud.funda.nl/valentina_media/190/050/871_1440x960.jpg 1440w, https://cloud.funda.nl/valentina_media/190/050/871_180x120.jpg 180w, https://cloud.funda.nl/valentina_media/190/050/871_360x240.jpg 360w, https://cloud.funda.nl/valentina_media/190/050/871_720x480.jpg 720w, https://cloud.funda.nl/valentina_media/190/050/871_1080x720.jpg 1080w, https://cloud.funda.nl/valentina_media/190/050/871_2160x1440.jpg 2160w, https://cloud.funda.nl/valentina_media/190/050/872_1440x960.jpg 1440w, https://cloud.funda.nl/valentina_media/190/050/872_180x120.jpg 180w, https://cloud.funda.nl/valentina_media/190/050/872_360x240.jpg 360w, https://cloud.funda.nl/valentina_media/190/050/872_720x480.jpg 720w, https://cloud.funda.nl/valentina_media/190/050/872_1080x720.jpg 1080w, https://cloud.funda.nl/valentina_media/190/050/872_2160x1440.jpg 2160w, https://cloud.funda.nl/valentina_media/190/050/873_1440x960.jpg 1440w, https://cloud.funda.nl/valentina_media/190/050/873_180x120.jpg 180w, https://cloud.funda.nl/valentina_media/190/050/873_360x240.jpg 360w, https://cloud.funda.nl/valentina_media/190/050/873_720x480.jpg 720w, https://cloud.funda.nl/valentina_media/190/050/873_1080x720.jpg 1080w, https://cloud.funda.nl/valentina_media/190/050/873_2160x1440.jpg 2160w, https://cloud.funda.nl/valentina_media/190/050/874_1440x960.jpg 1440w, https://cloud.funda.nl/valentina_media/190/050/874_180x120.jpg 180w, https://cloud.funda.nl/valentina_media/190/050/874_360x240.jpg 360w, https://cloud.funda.nl/valentina_media/190/050/874_720x480.jpg 720w, https://cloud.funda.nl/valentina_media/190/050/874_1080x720.jpg 1080w, https://cloud.funda.nl/valentina_media/190/050/874_2160x1440.jpg 2160w, https://cloud.funda.nl/valentina_media/190/050/875_1440x960.jpg 1440w, https://cloud.funda.nl/valentina_media/190/050/875_180x120.jpg 180w, https://cloud.funda.nl/valentina_media/190/050/875_360x240.jpg 360w, https://cloud.funda.nl/valentina_media/190/050/875_720x480.jpg 720w, https://cloud.funda.nl/valentina_media/190/050/875_1080x720.jpg 1080w, https://cloud.funda.nl/valentina_media/190/050/875_2160x1440.jpg 2160w, https://cloud.funda.nl/valentina_media/190/050/876_1440x960.jpg 1440w, https://cloud.funda.nl/valentina_media/190/050/876_180x120.jpg 180w, https://cloud.funda.nl/valentina_media/190/050/876_360x240.jpg 360w, https://cloud.funda.nl/valentina_media/190/050/876_720x480.jpg 720w, https://cloud.funda.nl/valentina_media/190/050/876_1080x720.jpg 1080w, https://cloud.funda.nl/valentina_media/190/050/876_2160x1440.jpg 2160w;1130.0;
