url;house_id;city;house_type;building_type;price;price_m2;room;bedroom;bathroom;living_area;energy_label;zip;address;year_built;house_age;descrip;photo;m3_gasverbruik_per_jaar;kwh_stroomvebruik_per_jaar
https://www.funda.nl/huur/helmond/appartement-43431490-timpaanstraat-26/;43431490;helmond;appartement;Bestaande bouw;1170;13.6;3;2;1;86;na;5705;Timpaanstraat 26;2001;23;Wonen in het  centrum  van Helmond!   Omgeving:  Timpaanstraat en het centrum  van  Helmond zijn beide kenmerkend voor  de  stad Helmond  in Nederland.  De Timpaanstraat  is  een straat gelegen  in  het  centrum van Helmond. Het is een levendige straat met diverse winkels, restaurants en andere voorzieningen. De straat staat bekend om zijn gezellige sfeer en is een populaire bestemming voor zowel bewoners als bezoekers van de stad. Je kunt er verschillende winkels vinden, variërend van boetiekjes en speciaalzaken tot grote ketens. Ook zijn er diverse eetgelegenheden waar je kunt genieten van een hapje en een drankje.  Het centrum van Helmond staat ook bekend om zijn levendige evenementenkalender. Gedurende het jaar worden er verschillende festivals, markten en andere activiteiten georganiseerd die mensen uit de hele regio aantrekken.  Indeling: Welkom in dit prettige appartement gelegen aan de Timpaanstraat 26 te Helmond. Het appartement is gesitueerd op de tweede etage met een oppervlakte van circa 86 m². Middels de gezamenlijke lift of trap is het appartement perfect te bereiken! Dit eigentijdse appartement biedt het beste van twee werelden met een ruim interieur. Bij binnenkomst is in de hal een separaat toilet aanwezig en twee ruim opgezette slaapkamers. De badkamer beschikt over voldoende ruimte en is voorzien van een douche, wastafel met spiegel en een wasmachineaansluiting.  Eenmaal in de woonkamer beschikt u over een prachtig uitzicht op het groen! Aan de achterzijde van het appartement bevindt zich de keuken welke recent volledig gerenoveerd is Ideaal om uw favoriete gerechten te kunnen bereiden. Vanuit de keuken kijkt u uit over de gehele woonkamer. De woonkamer is goed in te delen en zal een plek worden waar dat u ideaal kunt vertoeven.  Huurdetails: - Aanvaarding per 11 april 2024. - Huurprijs € 1.030, - per maand. - Servicekosten € 45, - per maand. - Waarborgsom ter grote van één maand huur (minimaal). - Huurperiode bedraagt minimaal 12 maanden.  Vragen over deze woning?  Voor vragen over deze woning kunt u contact opnemen met ons kantoor in Eindhoven.  Interesse in deze woning?  Schrijft u zich kosteloos en vrijblijvend in op onze website NMGwonen.nl/huur. Zoek vervolgens de woning op en klik in het paarse vlak op de knop [INLOGGEN]: u geeft hiermee aan dat u interesse hebt in de woning.   Om in aanmerking te komen voor deze woning dient het bruto maandinkomen minimaal 3x de huurprijs per maand te bedragen. Het inkomen van een eventuele partner mag voor de helft meegerekend worden. Zelfstandigen dienen minimaal 2 jaarcijfers te kunnen aanleveren. Er zal een inkomenstoets plaatsvinden. Tevens voeren wij een creditcheck uit. Voor alle toewijzingscriteria en het selectiebeleid verwijzen wij u naar onze website.  Indien u zich inschrijft via onze website NMGwonen, zullen wij u op basis van de verstrekte informatie automatisch per e-mail informeren over de woningen die beschikbaar komen en voldoen aan uw woonwensen.  Alle informatie is met de grootst mogelijke zorg samengesteld. Helaas kunnen wij niet altijd voorkomen dat de informatie enigszins afwijkt van de werkelijkheid. In sommige gevallen worden foto’s gebruikt van een soortgelijke woning of appartement en dienen als impressie. Aan de teksten, plattegronden, foto’s en maatvoeringen kunnen geen rechten worden ontleend.;https://cloud.funda.nl/valentina_media/188/376/545_1440x960.jpg 1440w, https://cloud.funda.nl/valentina_media/188/376/545_180x120.jpg 180w, https://cloud.funda.nl/valentina_media/188/376/545_360x240.jpg 360w, https://cloud.funda.nl/valentina_media/188/376/545_720x480.jpg 720w, https://cloud.funda.nl/valentina_media/188/376/545_1080x720.jpg 1080w, https://cloud.funda.nl/valentina_media/188/376/545_2160x1440.jpg 2160w, https://cloud.funda.nl/valentina_media/188/376/537_1440x960.jpg 1440w, https://cloud.funda.nl/valentina_media/188/376/537_180x120.jpg 180w, https://cloud.funda.nl/valentina_media/188/376/537_360x240.jpg 360w, https://cloud.funda.nl/valentina_media/188/376/537_720x480.jpg 720w, https://cloud.funda.nl/valentina_media/188/376/537_1080x720.jpg 1080w, https://cloud.funda.nl/valentina_media/188/376/537_2160x1440.jpg 2160w, https://cloud.funda.nl/valentina_media/188/376/483_1440x960.jpg 1440w, https://cloud.funda.nl/valentina_media/188/376/483_180x120.jpg 180w, https://cloud.funda.nl/valentina_media/188/376/483_360x240.jpg 360w, https://cloud.funda.nl/valentina_media/188/376/483_720x480.jpg 720w, https://cloud.funda.nl/valentina_media/188/376/483_1080x720.jpg 1080w, https://cloud.funda.nl/valentina_media/188/376/483_2160x1440.jpg 2160w, https://cloud.funda.nl/valentina_media/188/376/488_1440x960.jpg 1440w, https://cloud.funda.nl/valentina_media/188/376/488_180x120.jpg 180w, https://cloud.funda.nl/valentina_media/188/376/488_360x240.jpg 360w, https://cloud.funda.nl/valentina_media/188/376/488_720x480.jpg 720w, https://cloud.funda.nl/valentina_media/188/376/488_1080x720.jpg 1080w, https://cloud.funda.nl/valentina_media/188/376/488_2160x1440.jpg 2160w, https://cloud.funda.nl/valentina_media/188/376/492_1440x960.jpg 1440w, https://cloud.funda.nl/valentina_media/188/376/492_180x120.jpg 180w, https://cloud.funda.nl/valentina_media/188/376/492_360x240.jpg 360w, https://cloud.funda.nl/valentina_media/188/376/492_720x480.jpg 720w, https://cloud.funda.nl/valentina_media/188/376/492_1080x720.jpg 1080w, https://cloud.funda.nl/valentina_media/188/376/492_2160x1440.jpg 2160w, https://cloud.funda.nl/valentina_media/188/376/498_1440x960.jpg 1440w, https://cloud.funda.nl/valentina_media/188/376/498_180x120.jpg 180w, https://cloud.funda.nl/valentina_media/188/376/498_360x240.jpg 360w, https://cloud.funda.nl/valentina_media/188/376/498_720x480.jpg 720w, https://cloud.funda.nl/valentina_media/188/376/498_1080x720.jpg 1080w, https://cloud.funda.nl/valentina_media/188/376/498_2160x1440.jpg 2160w, https://cloud.funda.nl/valentina_media/188/376/511_1440x960.jpg 1440w, https://cloud.funda.nl/valentina_media/188/376/511_180x120.jpg 180w, https://cloud.funda.nl/valentina_media/188/376/511_360x240.jpg 360w, https://cloud.funda.nl/valentina_media/188/376/511_720x480.jpg 720w, https://cloud.funda.nl/valentina_media/188/376/511_1080x720.jpg 1080w, https://cloud.funda.nl/valentina_media/188/376/511_2160x1440.jpg 2160w, https://cloud.funda.nl/valentina_media/188/376/522_1440x960.jpg 1440w, https://cloud.funda.nl/valentina_media/188/376/522_180x120.jpg 180w, https://cloud.funda.nl/valentina_media/188/376/522_360x240.jpg 360w, https://cloud.funda.nl/valentina_media/188/376/522_720x480.jpg 720w, https://cloud.funda.nl/valentina_media/188/376/522_1080x720.jpg 1080w, https://cloud.funda.nl/valentina_media/188/376/522_2160x1440.jpg 2160w, https://cloud.funda.nl/valentina_media/188/376/532_1440x960.jpg 1440w, https://cloud.funda.nl/valentina_media/188/376/532_180x120.jpg 180w, https://cloud.funda.nl/valentina_media/188/376/532_360x240.jpg 360w, https://cloud.funda.nl/valentina_media/188/376/532_720x480.jpg 720w, https://cloud.funda.nl/valentina_media/188/376/532_1080x720.jpg 1080w, https://cloud.funda.nl/valentina_media/188/376/532_2160x1440.jpg 2160w, https://cloud.funda.nl/valentina_media/188/376/479_1440x960.jpg 1440w, https://cloud.funda.nl/valentina_media/188/376/479_180x120.jpg 180w, https://cloud.funda.nl/valentina_media/188/376/479_360x240.jpg 360w, https://cloud.funda.nl/valentina_media/188/376/479_720x480.jpg 720w, https://cloud.funda.nl/valentina_media/188/376/479_1080x720.jpg 1080w, https://cloud.funda.nl/valentina_media/188/376/479_2160x1440.jpg 2160w;1306.0;
https://www.funda.nl/huur/helmond/appartement-43446842-oostende-221/;43446842;helmond;appartement;Bestaande bouw;1265;17.1;3;2;0;74;>A+;5701;Oostende 221;2023;1;"Omschrijving ORANJEKADE -  HELMOND  - HUURAPPARTEMENTEN  In Oranjekade  woont u straks pal  aan  het water dat zo kenmerkend is voor  Helmond;  het kanaal, ook  wel bekend als de  Zuid-Willemsvaart. Oranjekade  wisselt  stijlvolle  pakhuisarchitectuur af met eigentijdse woongebouwen. Het plan heeft een allure die u in wereldsteden als Amsterdam en Berlijn ziet. In Oranjekade woont u in de natuur en bent u toch binnen een paar minuten in het hart van de bruisende stad. Veel beter kunt u het haast niet treffen. Verdeeld over 7 woongebouwen omvat het plan in totaal 143 huurwoningen in allerlei soorten, vormen en maten. Alle appartementen beschikken in ieder geval over een eigen berging en eigen parkeerplaats in de stallingsgarage.  INDELING APPARTEMENT: Algemeen: - Bellentableau; - Toegang tot appartement via trappenhuis of lift.  Appartement: - Entree; - Hal; - (Deels) betegelde toiletruimte voorzien van hangend toilet en fonteintje; - Betegelde badkamer voorzien van inloopdouche, wastafel en hangend toilet; - Inpandige berging voorzien van warmte installatie en aansluitingen wasmachine en droger; - Slaapkamer 1; - Slaapkamer 2; - Woonkamer met open keuken voorzien van diverse inbouwapparatuur waaronder koelkast, inductiekookplaat, combimagnetron, vaatwasser en recirculatieafzuigkap; - Buitenruimte.  Extern: - Externe berging; - Parkeerplaats in de parkeerkelder.  AFWERKING: - De wanden in het appartement zijn, met uitzondering van de wanden in de meterkast en sanitaire ruimten, sausklaar; - De vloeren in het appartement zijn, met uitzondering van de vloeren in de meterkast en sanitaire ruimten, voorzien van een hoogwaardige PVC vloerafwerking (in houtlook motief).  OPMERKINGEN: - De appartementen worden verwarmd door middel van vloerverwarming. In de badkamer is één elektrische radiator aanwezig; - De appartementen in Oranjekade zijn gebouwd met aandacht voor duurzaamheid. De woningen zijn geheel gasloos en uitstekend geïsoleerd.  HUURVOORWAARDEN: Om in aanmerking te komen voor deze huurwoning, stelt de verhuurder enkele inkomensvereisten. Deze zijn als volgt: - In geval van 1 inkomen dient uw bruto maandinkomen minimaal 3.5x de huursom te bedragen. Eventuele vaste opslagen zoals vakantietoeslag, eindejaarsuitekering e.d. mogen worden meegerekend; - In geval van 2 inkomens (van u en uw partner) geldt dat het laagste inkomen voor 100% mag worden meegerekend; - Wanneer u in loondienst bent, dient u minimaal te beschikken over een arbeidscontract voor bepaalde tijd (jaarcontract met intentieverklaring) of onbepaalde tijdscontract. Oproep-, uitzend- of flexcontracten worden niet meegenomen; - Wanneer u gepensioneerd bent, dient de optelsom van AOW en eventueel netto pensioen minimaal 3,5x de huurprijs te zijn; - Wanneer u zzp'er, zelfstandig ondernemer of DGA bent, dient u een nettowinst voor belasting aantoonbaar van minimaal 3,5x de huurprijs te hebben. Tevens dient u minimaal één volledig boekjaar ondernemer te zijn; - Wanneer u een uitkering heeft en dit een gegarandeerd/vast inkomen betreft, mag dit worden opgeteld bij het gezamenlijke bruto-inkomen.  Naast de inkomensvereisten gelden onderstaande huurvoorwaarden: - De minimale huurperiode bedraagt 12 maanden. Daarna kan de huurovereenkomst per de eerste van de volgende maand +1 maand beëindigd worden; - Standaard wordt er een waarborgsom van 2x de huurprijs gehanteerd.";https://cloud.funda.nl/valentina_media/188/598/700_1440x960.jpg 1440w, https://cloud.funda.nl/valentina_media/188/598/700_180x120.jpg 180w, https://cloud.funda.nl/valentina_media/188/598/700_360x240.jpg 360w, https://cloud.funda.nl/valentina_media/188/598/700_720x480.jpg 720w, https://cloud.funda.nl/valentina_media/188/598/700_1080x720.jpg 1080w, https://cloud.funda.nl/valentina_media/188/598/700_2160x1440.jpg 2160w, https://cloud.funda.nl/valentina_media/188/598/702_1440x960.jpg 1440w, https://cloud.funda.nl/valentina_media/188/598/702_180x120.jpg 180w, https://cloud.funda.nl/valentina_media/188/598/702_360x240.jpg 360w, https://cloud.funda.nl/valentina_media/188/598/702_720x480.jpg 720w, https://cloud.funda.nl/valentina_media/188/598/702_1080x720.jpg 1080w, https://cloud.funda.nl/valentina_media/188/598/702_2160x1440.jpg 2160w, https://cloud.funda.nl/valentina_media/188/598/706_1440x960.jpg 1440w, https://cloud.funda.nl/valentina_media/188/598/706_180x120.jpg 180w, https://cloud.funda.nl/valentina_media/188/598/706_360x240.jpg 360w, https://cloud.funda.nl/valentina_media/188/598/706_720x480.jpg 720w, https://cloud.funda.nl/valentina_media/188/598/706_1080x720.jpg 1080w, https://cloud.funda.nl/valentina_media/188/598/706_2160x1440.jpg 2160w, https://cloud.funda.nl/valentina_media/188/598/711_1440x960.jpg 1440w, https://cloud.funda.nl/valentina_media/188/598/711_180x120.jpg 180w, https://cloud.funda.nl/valentina_media/188/598/711_360x240.jpg 360w, https://cloud.funda.nl/valentina_media/188/598/711_720x480.jpg 720w, https://cloud.funda.nl/valentina_media/188/598/711_1080x720.jpg 1080w, https://cloud.funda.nl/valentina_media/188/598/711_2160x1440.jpg 2160w, https://cloud.funda.nl/valentina_media/188/598/713_1440x960.jpg 1440w, https://cloud.funda.nl/valentina_media/188/598/713_180x120.jpg 180w, https://cloud.funda.nl/valentina_media/188/598/713_360x240.jpg 360w, https://cloud.funda.nl/valentina_media/188/598/713_720x480.jpg 720w, https://cloud.funda.nl/valentina_media/188/598/713_1080x720.jpg 1080w, https://cloud.funda.nl/valentina_media/188/598/713_2160x1440.jpg 2160w, https://cloud.funda.nl/valentina_media/188/598/718_1440x960.jpg 1440w, https://cloud.funda.nl/valentina_media/188/598/718_180x120.jpg 180w, https://cloud.funda.nl/valentina_media/188/598/718_360x240.jpg 360w, https://cloud.funda.nl/valentina_media/188/598/718_720x480.jpg 720w, https://cloud.funda.nl/valentina_media/188/598/718_1080x720.jpg 1080w, https://cloud.funda.nl/valentina_media/188/598/718_2160x1440.jpg 2160w, https://cloud.funda.nl/valentina_media/188/598/752_1440x960.jpg 1440w, https://cloud.funda.nl/valentina_media/188/598/752_180x120.jpg 180w, https://cloud.funda.nl/valentina_media/188/598/752_360x240.jpg 360w, https://cloud.funda.nl/valentina_media/188/598/752_720x480.jpg 720w, https://cloud.funda.nl/valentina_media/188/598/752_1080x720.jpg 1080w, https://cloud.funda.nl/valentina_media/188/598/752_2160x1440.jpg 2160w, https://cloud.funda.nl/valentina_media/188/598/754_1440x960.jpg 1440w, https://cloud.funda.nl/valentina_media/188/598/754_180x120.jpg 180w, https://cloud.funda.nl/valentina_media/188/598/754_360x240.jpg 360w, https://cloud.funda.nl/valentina_media/188/598/754_720x480.jpg 720w, https://cloud.funda.nl/valentina_media/188/598/754_1080x720.jpg 1080w, https://cloud.funda.nl/valentina_media/188/598/754_2160x1440.jpg 2160w, https://cloud.funda.nl/valentina_media/188/598/753_1440x960.jpg 1440w, https://cloud.funda.nl/valentina_media/188/598/753_180x120.jpg 180w, https://cloud.funda.nl/valentina_media/188/598/753_360x240.jpg 360w, https://cloud.funda.nl/valentina_media/188/598/753_720x480.jpg 720w, https://cloud.funda.nl/valentina_media/188/598/753_1080x720.jpg 1080w, https://cloud.funda.nl/valentina_media/188/598/753_2160x1440.jpg 2160w, https://cloud.funda.nl/valentina_media/188/598/755_1440x960.jpg 1440w, https://cloud.funda.nl/valentina_media/188/598/755_180x120.jpg 180w, https://cloud.funda.nl/valentina_media/188/598/755_360x240.jpg 360w, https://cloud.funda.nl/valentina_media/188/598/755_720x480.jpg 720w, https://cloud.funda.nl/valentina_media/188/598/755_1080x720.jpg 1080w, https://cloud.funda.nl/valentina_media/188/598/755_2160x1440.jpg 2160w, https://cloud.funda.nl/valentina_media/188/598/762_1440x960.jpg 1440w, https://cloud.funda.nl/valentina_media/188/598/762_180x120.jpg 180w, https://cloud.funda.nl/valentina_media/188/598/762_360x240.jpg 360w, https://cloud.funda.nl/valentina_media/188/598/762_720x480.jpg 720w, https://cloud.funda.nl/valentina_media/188/598/762_1080x720.jpg 1080w, https://cloud.funda.nl/valentina_media/188/598/762_2160x1440.jpg 2160w;1029.0;651.0
https://www.funda.nl/huur/helmond/appartement-43580182-waardstraat-91/;43580182;helmond;appartement;Nieuwbouw;1625;10.0;4;2;1;162;na;5701;Waardstraat 91;2024;0;De verhuur van  de  laatste 3  gebouwen in  het project Huren in  Oranjekade,  Gebouw L, M en N is gestart!  Het  huuraanbod van alle  64  prachtige  appartementen  in  de  gebouwen  L, M  en N wordt staan live op hureninoranjekade.nl. Wil jij ook huren op deze mooie plek? Schrijf je in op deze website!   Woon uniek in de Oranjekade 64 nieuwe diverse type appartementen op een fantastische locatie in het centrum van Helmond!   Gebouw L – Beschikt over studio’s, driekamer-/ en vierkamerappartementen, in totaal 23 appartementen Gebouw M – In totaal 18 driekamerappartementen Gebouw N – Beschikt ook over een stadswoning en 22 driekamerappartementen. In totaal 23 appartementen  Verwachte oplevering is in het 3e of 4e kwartaal van 2024.   Het betreft hier 64 nieuwbouwappartementen allerlei soorten, vormen en maten. Denk aan een stijlvolle stadswoning met meerdere woonlagen, studio’s en gelijkvloerse appartementen met 1, 2 of 3 slaapkamers.  - Met prachtige PVC vloer in alle appartementen - Alle appartementen hebben een zonnig balkon of terras - Energiezuinig en Gasloos - Luxe en moderne keuken met inbouwappartament - Compleet afgewerkte badkamer met inloopdouche  - Een eigen berging en parkeerplaats in de garage - Wonen in het centrum van Helmond met de natuur op een paar minuten   loopafstand - Pal aan het prachtige kanaal  In Oranjekade woon je straks pal aan het water dat zo kenmerkend is voor Helmond: het kanaal, ook wel bekend als de Zuid-Willemsvaart. Oranjekade wisselt stijlvolle pakhuisarchitectuur af met eigentijdse woongebouwen. Het plan heeft een allure die je in wereldsteden als Amsterdam en Berlijn ziet. In Oranjekade woon je in de natuur en ben je toch binnen een paar minuten in het hart van de bruisende stad. Veel beter kun je het niet treffen.  Helmond is een levendige, middelgrote stad waar ontzettend veel te beleven is. De stad beschikt over een ruim voorzieningenaanbod zoals winkels, openbaar vervoer, vier treinstations, bioscoop, scholen en voortreffelijke horeca, waaronder een sterrenrestaurant.  Op enkele minuten fietsen vanaf het centrum van Helmond ligt Oranjekade. Het plan ligt ten oosten van de Kanaaldijk en ten westen van de Albert Heijn XL en de watertoren. De doorgaande weg Oostende ontsluit het plangebied aan de noordzijde en de Waardstraat maakt Oranjekade aan de zuidzijde toegankelijk.  Qua bereikbaarheid is Oranjekade geweldig gelegen! De belangrijkste verkeersader van Helmond (de N270/Kasteel-Traverse) ligt op een paar autominuten afstand.  Ga je toch liever met het openbaar vervoer dan kun je voor het plan opstappen op de bus of ben je in enkele fietsminuten op het treinstation.  Interesse? Neem contact op met het verhuurteam of ga naar de website hureninoranjekade.nl;https://cloud.funda.nl/valentina_media/190/052/206_1440x960.jpg 1440w, https://cloud.funda.nl/valentina_media/190/052/206_180x120.jpg 180w, https://cloud.funda.nl/valentina_media/190/052/206_360x240.jpg 360w, https://cloud.funda.nl/valentina_media/190/052/206_720x480.jpg 720w, https://cloud.funda.nl/valentina_media/190/052/206_1080x720.jpg 1080w, https://cloud.funda.nl/valentina_media/190/052/206_2160x1440.jpg 2160w, https://cloud.funda.nl/valentina_media/190/052/182_1440x960.jpg 1440w, https://cloud.funda.nl/valentina_media/190/052/182_180x120.jpg 180w, https://cloud.funda.nl/valentina_media/190/052/182_360x240.jpg 360w, https://cloud.funda.nl/valentina_media/190/052/182_720x480.jpg 720w, https://cloud.funda.nl/valentina_media/190/052/182_1080x720.jpg 1080w, https://cloud.funda.nl/valentina_media/190/052/182_2160x1440.jpg 2160w, https://cloud.funda.nl/valentina_media/190/052/183_1440x960.jpg 1440w, https://cloud.funda.nl/valentina_media/190/052/183_180x120.jpg 180w, https://cloud.funda.nl/valentina_media/190/052/183_360x240.jpg 360w, https://cloud.funda.nl/valentina_media/190/052/183_720x480.jpg 720w, https://cloud.funda.nl/valentina_media/190/052/183_1080x720.jpg 1080w, https://cloud.funda.nl/valentina_media/190/052/183_2160x1440.jpg 2160w, https://cloud.funda.nl/valentina_media/190/052/201_1440x960.jpg 1440w, https://cloud.funda.nl/valentina_media/190/052/201_180x120.jpg 180w, https://cloud.funda.nl/valentina_media/190/052/201_360x240.jpg 360w, https://cloud.funda.nl/valentina_media/190/052/201_720x480.jpg 720w, https://cloud.funda.nl/valentina_media/190/052/201_1080x720.jpg 1080w, https://cloud.funda.nl/valentina_media/190/052/201_2160x1440.jpg 2160w, https://cloud.funda.nl/valentina_media/190/052/202_1440x960.jpg 1440w, https://cloud.funda.nl/valentina_media/190/052/202_180x120.jpg 180w, https://cloud.funda.nl/valentina_media/190/052/202_360x240.jpg 360w, https://cloud.funda.nl/valentina_media/190/052/202_720x480.jpg 720w, https://cloud.funda.nl/valentina_media/190/052/202_1080x720.jpg 1080w, https://cloud.funda.nl/valentina_media/190/052/202_2160x1440.jpg 2160w, https://cloud.funda.nl/valentina_media/190/052/204_1440x960.jpg 1440w, https://cloud.funda.nl/valentina_media/190/052/204_180x120.jpg 180w, https://cloud.funda.nl/valentina_media/190/052/204_360x240.jpg 360w, https://cloud.funda.nl/valentina_media/190/052/204_720x480.jpg 720w, https://cloud.funda.nl/valentina_media/190/052/204_1080x720.jpg 1080w, https://cloud.funda.nl/valentina_media/190/052/204_2160x1440.jpg 2160w, https://cloud.funda.nl/valentina_media/190/052/205_1440x960.jpg 1440w, https://cloud.funda.nl/valentina_media/190/052/205_180x120.jpg 180w, https://cloud.funda.nl/valentina_media/190/052/205_360x240.jpg 360w, https://cloud.funda.nl/valentina_media/190/052/205_720x480.jpg 720w, https://cloud.funda.nl/valentina_media/190/052/205_1080x720.jpg 1080w, https://cloud.funda.nl/valentina_media/190/052/205_2160x1440.jpg 2160w;911.0;
