url;house_id;city;house_type;building_type;price;price_m2;room;bedroom;bathroom;living_area;energy_label;zip;address;year_built;house_age;descrip;photo;m3_gasverbruik_per_jaar;kwh_stroomvebruik_per_jaar
https://www.funda.nl/koop/wesepe/huis-43485421-brouwerskamp-20/;43485421;wesepe;huis;Bestaande bouw;455000;3500.0;5;3;0;130;na;8124;Brouwerskamp 20;2023;1;"Aan de rand  van  het dorp  Wesepe, ten  hoogte van Brouwerskamp is  deze  nieuwbouwwoning aan de Weidebeek  gerealiseerd.  Deze  locatie is  omgetoverd tot een  prachtige nieuwbouwwijk  met maar  liefst  13  royale  woonhuizen, waaronder deze 2-onder-1-kap woning. Een fraai nieuwbouwproject waarbij de woningen beschikken over aanzienlijke woonoppervlaktes en volledig zijn verduurzaamd.   Wij bieden deze 2-onder-1 kapwoning aan met een woonoppervlakte van circa 130 m². Deze woning is volledig verduurzaamd, voorzien van sanitair en beschikt over een garage met eigen oprit. Beschikbaar per 1 april 2024.  De locatie is bereikbaar via de Scholtensweg en Brouwerskamp. De ontsluitingsweg is openbaar toegankelijk.   Bijzonderheden: -	Deze woning is volledig geïsoleerd; -	Deze woning is voorzien van een luchtwarmtepompinstallatie;  -	Deze woning is voorzien van vloerverwarming; -	Deze woning is voorzien van zonnepanelen; -       Deze woning is voorzien van een garage; -	Deze woning is opgeleverd met sanitaire voorzieningen; -	Deze woning is zonder keuken inrichting opgeleverd.  Deze woningen zijn klaar voor de toekomst!  Bij interesse kan u contact opnemen met met ons kantoor.  Maatvoeringen zijn bij benadering.";https://cloud.funda.nl/valentina_media/186/067/223_1440x960.jpg 1440w, https://cloud.funda.nl/valentina_media/186/067/223_180x120.jpg 180w, https://cloud.funda.nl/valentina_media/186/067/223_360x240.jpg 360w, https://cloud.funda.nl/valentina_media/186/067/223_720x480.jpg 720w, https://cloud.funda.nl/valentina_media/186/067/223_1080x720.jpg 1080w, https://cloud.funda.nl/valentina_media/186/067/223_2160x1440.jpg 2160w, https://cloud.funda.nl/valentina_media/186/067/221_1440x960.jpg 1440w, https://cloud.funda.nl/valentina_media/186/067/221_180x120.jpg 180w, https://cloud.funda.nl/valentina_media/186/067/221_360x240.jpg 360w, https://cloud.funda.nl/valentina_media/186/067/221_720x480.jpg 720w, https://cloud.funda.nl/valentina_media/186/067/221_1080x720.jpg 1080w, https://cloud.funda.nl/valentina_media/186/067/221_2160x1440.jpg 2160w, https://cloud.funda.nl/valentina_media/186/067/226_1440x960.jpg 1440w, https://cloud.funda.nl/valentina_media/186/067/226_180x120.jpg 180w, https://cloud.funda.nl/valentina_media/186/067/226_360x240.jpg 360w, https://cloud.funda.nl/valentina_media/186/067/226_720x480.jpg 720w, https://cloud.funda.nl/valentina_media/186/067/226_1080x720.jpg 1080w, https://cloud.funda.nl/valentina_media/186/067/226_2160x1440.jpg 2160w, https://cloud.funda.nl/valentina_media/186/067/224_1440x960.jpg 1440w, https://cloud.funda.nl/valentina_media/186/067/224_180x120.jpg 180w, https://cloud.funda.nl/valentina_media/186/067/224_360x240.jpg 360w, https://cloud.funda.nl/valentina_media/186/067/224_720x480.jpg 720w, https://cloud.funda.nl/valentina_media/186/067/224_1080x720.jpg 1080w, https://cloud.funda.nl/valentina_media/186/067/224_2160x1440.jpg 2160w, https://cloud.funda.nl/valentina_media/186/067/220_1440x960.jpg 1440w, https://cloud.funda.nl/valentina_media/186/067/220_180x120.jpg 180w, https://cloud.funda.nl/valentina_media/186/067/220_360x240.jpg 360w, https://cloud.funda.nl/valentina_media/186/067/220_720x480.jpg 720w, https://cloud.funda.nl/valentina_media/186/067/220_1080x720.jpg 1080w, https://cloud.funda.nl/valentina_media/186/067/220_2160x1440.jpg 2160w;1013;
https://www.funda.nl/koop/wesepe/huis-42333135-gj-kappertweg-2-a/;42333135;wesepe;huis;Nieuwbouw;975000;6210.2;5;4;2;157;na;8124;G.J. Kappertweg 2 A;2024;0;"Bent u op  zoek  naar een  nieuwbouwwoning met  een slaap- en badkamer  op  de begane grond, weinig onderhoud  en wilt  u  wonen in een  landelijke  omgeving? Dan is deze  prachtige  nieuwe  vrijstaande woning met rieten kap wellicht iets voor u.  Op een unieke locatie in het mooie dorp Wesepe gaat deze woning gebouwd worden op een royale kavel van maar liefst circa 11.366 m2!  De woning heeft een natuurlijke uitstraling door de rieten kap en antracietkleurige gevelstenen. Daarnaast is het woonhuis energiezuinig doordat de woning volledig is geïsoleerd, v.v. zonnepanelen, gasloos en voorzien van een lucht-water warmtepomp. De woning is geschikt voor gezinnen of echtparen, is voorzien van alle comfort en wordt aangeboden in twee varianten, zodat de woning voor een brede doelgroep interessant is.   Het dorp Wesepe ligt in de gemeente Olst-Wijhe in een landelijke omgeving en kent diverse voorzieningen zoals een basisschool, bakker en een restaurant. Voor de overige voorzieningen kunt u terecht in de stad Deventer (ca. 10 kilometer afstand), het dorp Raalte en Heeten. Op circa 20 km afstand is Nationaal Park de Sallandse Heuvelrug gelegen. Een prachtig natuurpark met eindeloze fiets-, mountainbike en wandelmogelijkheden, eindeloze vergezichten en diverse activiteiten voor jong en oud.   Het bouwplan ligt naast een karakteristieke boerderij uit 1924. De bestaande boerderij is een gemeentelijk monument en inmiddels geheel gerestaureerd. Het bouwplan maakt onderdeel uit van het erfinrichtingsplan van deze boerderij. Omdat bestaande schuren gesloopt zijn is het mogelijk een nieuwe woning te bouwen.   Indeling: Vanuit de lichte en ruime entree met trapopgang, toilet, meterkast, is de toegang naar de ruime woonkeuken. De keuken heeft ruimte voor een kookeiland en een eettafel om met een groot gezelschap te kunnen tafelen. Doorloop naar de bijkeuken met achteringang en met aansluiting voor de wasapparatuur en opstelling warmtepomp. De woonkamer is tuingericht en beschikt over een grote glazen pui en openslaande deuren naar de tuin. Door de vele raampartijen heeft u een fraai en weids uitzicht heeft over de weilanden.   Levensloopbestendige variant: De slaap- en badkamer liggen aan de voorzijde van de woning, maar zijn ook te gebruiken als werk- of speelruimte. De hoofdslaapkamer beschikt over een badkamer en suite. Tevens is in de badkamer op de begane grond ruimte voor de wasapparatuur gecreëerd.   Eerste verdieping: Overloop met vide, badkamer, vier ruime kamers waarvan drie slaapkamers en een werkkamer. De hoofdslaapkamer beschikt over een inloopkast.  Bij de levensloopbestendige variant zijn op de verdieping drie slaapkamers aanwezig, een tweede badkamer en een technische ruimte.   Tweede verdieping: Middels een vlizotrap is er toegang naar de bergzolder.  Info: -	Perceelgrootte van ca 11.366 m²! Aan de opgegeven perceelgrootte kunnen geen rechten worden ontleend. Definitieve kavelgrootte zal blijken na inmeting door het Kadaster; -	De woning wordt behangklaar opgeleverd; -	De woning is exclusief sanitair en tegelwerk;  -	Er worden zonnepanelen toegepast als veldopstelling; -	Er worden hardhouten gevelkozijnen geplaatst met HR++ beglazing.  Koopsom: € 975.000,- v.o.n.  Aanvaarding in overleg";https://cloud.funda.nl/valentina_media/184/398/274_1440x960.jpg 1440w, https://cloud.funda.nl/valentina_media/184/398/274_180x120.jpg 180w, https://cloud.funda.nl/valentina_media/184/398/274_360x240.jpg 360w, https://cloud.funda.nl/valentina_media/184/398/274_720x480.jpg 720w, https://cloud.funda.nl/valentina_media/184/398/274_1080x720.jpg 1080w, https://cloud.funda.nl/valentina_media/184/398/274_2160x1440.jpg 2160w, https://cloud.funda.nl/valentina_media/184/398/263_1440x960.jpg 1440w, https://cloud.funda.nl/valentina_media/184/398/263_180x120.jpg 180w, https://cloud.funda.nl/valentina_media/184/398/263_360x240.jpg 360w, https://cloud.funda.nl/valentina_media/184/398/263_720x480.jpg 720w, https://cloud.funda.nl/valentina_media/184/398/263_1080x720.jpg 1080w, https://cloud.funda.nl/valentina_media/184/398/263_2160x1440.jpg 2160w, https://cloud.funda.nl/valentina_media/184/398/266_1440x960.jpg 1440w, https://cloud.funda.nl/valentina_media/184/398/266_180x120.jpg 180w, https://cloud.funda.nl/valentina_media/184/398/266_360x240.jpg 360w, https://cloud.funda.nl/valentina_media/184/398/266_720x480.jpg 720w, https://cloud.funda.nl/valentina_media/184/398/266_1080x720.jpg 1080w, https://cloud.funda.nl/valentina_media/184/398/266_2160x1440.jpg 2160w, https://cloud.funda.nl/valentina_media/184/398/276_1440x960.jpg 1440w, https://cloud.funda.nl/valentina_media/184/398/276_180x120.jpg 180w, https://cloud.funda.nl/valentina_media/184/398/276_360x240.jpg 360w, https://cloud.funda.nl/valentina_media/184/398/276_720x480.jpg 720w, https://cloud.funda.nl/valentina_media/184/398/276_1080x720.jpg 1080w, https://cloud.funda.nl/valentina_media/184/398/276_2160x1440.jpg 2160w, https://cloud.funda.nl/valentina_media/184/398/242_1440x960.jpg 1440w, https://cloud.funda.nl/valentina_media/184/398/242_180x120.jpg 180w, https://cloud.funda.nl/valentina_media/184/398/242_360x240.jpg 360w, https://cloud.funda.nl/valentina_media/184/398/242_720x480.jpg 720w, https://cloud.funda.nl/valentina_media/184/398/242_1080x720.jpg 1080w, https://cloud.funda.nl/valentina_media/184/398/242_2160x1440.jpg 2160w, https://cloud.funda.nl/valentina_media/184/398/275_1440x960.jpg 1440w, https://cloud.funda.nl/valentina_media/184/398/275_180x120.jpg 180w, https://cloud.funda.nl/valentina_media/184/398/275_360x240.jpg 360w, https://cloud.funda.nl/valentina_media/184/398/275_720x480.jpg 720w, https://cloud.funda.nl/valentina_media/184/398/275_1080x720.jpg 1080w, https://cloud.funda.nl/valentina_media/184/398/275_2160x1440.jpg 2160w, https://cloud.funda.nl/valentina_media/184/398/253_1440x960.jpg 1440w, https://cloud.funda.nl/valentina_media/184/398/253_180x120.jpg 180w, https://cloud.funda.nl/valentina_media/184/398/253_360x240.jpg 360w, https://cloud.funda.nl/valentina_media/184/398/253_720x480.jpg 720w, https://cloud.funda.nl/valentina_media/184/398/253_1080x720.jpg 1080w, https://cloud.funda.nl/valentina_media/184/398/253_2160x1440.jpg 2160w, https://cloud.funda.nl/valentina_media/184/398/272_1440x960.jpg 1440w, https://cloud.funda.nl/valentina_media/184/398/272_180x120.jpg 180w, https://cloud.funda.nl/valentina_media/184/398/272_360x240.jpg 360w, https://cloud.funda.nl/valentina_media/184/398/272_720x480.jpg 720w, https://cloud.funda.nl/valentina_media/184/398/272_1080x720.jpg 1080w, https://cloud.funda.nl/valentina_media/184/398/272_2160x1440.jpg 2160w, https://cloud.funda.nl/valentina_media/184/398/265_1440x960.jpg 1440w, https://cloud.funda.nl/valentina_media/184/398/265_180x120.jpg 180w, https://cloud.funda.nl/valentina_media/184/398/265_360x240.jpg 360w, https://cloud.funda.nl/valentina_media/184/398/265_720x480.jpg 720w, https://cloud.funda.nl/valentina_media/184/398/265_1080x720.jpg 1080w, https://cloud.funda.nl/valentina_media/184/398/265_2160x1440.jpg 2160w, https://cloud.funda.nl/valentina_media/184/398/255_1440x960.jpg 1440w, https://cloud.funda.nl/valentina_media/184/398/255_180x120.jpg 180w, https://cloud.funda.nl/valentina_media/184/398/255_360x240.jpg 360w, https://cloud.funda.nl/valentina_media/184/398/255_720x480.jpg 720w, https://cloud.funda.nl/valentina_media/184/398/255_1080x720.jpg 1080w, https://cloud.funda.nl/valentina_media/184/398/255_2160x1440.jpg 2160w, https://cloud.funda.nl/valentina_media/184/398/252_1440x960.jpg 1440w, https://cloud.funda.nl/valentina_media/184/398/252_180x120.jpg 180w, https://cloud.funda.nl/valentina_media/184/398/252_360x240.jpg 360w, https://cloud.funda.nl/valentina_media/184/398/252_720x480.jpg 720w, https://cloud.funda.nl/valentina_media/184/398/252_1080x720.jpg 1080w, https://cloud.funda.nl/valentina_media/184/398/252_2160x1440.jpg 2160w, https://cloud.funda.nl/valentina_media/184/398/278_1440x960.jpg 1440w, https://cloud.funda.nl/valentina_media/184/398/278_180x120.jpg 180w, https://cloud.funda.nl/valentina_media/184/398/278_360x240.jpg 360w, https://cloud.funda.nl/valentina_media/184/398/278_720x480.jpg 720w, https://cloud.funda.nl/valentina_media/184/398/278_1080x720.jpg 1080w, https://cloud.funda.nl/valentina_media/184/398/278_2160x1440.jpg 2160w, https://cloud.funda.nl/valentina_media/184/398/251_1440x960.jpg 1440w, https://cloud.funda.nl/valentina_media/184/398/251_180x120.jpg 180w, https://cloud.funda.nl/valentina_media/184/398/251_360x240.jpg 360w, https://cloud.funda.nl/valentina_media/184/398/251_720x480.jpg 720w, https://cloud.funda.nl/valentina_media/184/398/251_1080x720.jpg 1080w, https://cloud.funda.nl/valentina_media/184/398/251_2160x1440.jpg 2160w, https://cloud.funda.nl/valentina_media/184/398/280_1440x960.jpg 1440w, https://cloud.funda.nl/valentina_media/184/398/280_180x120.jpg 180w, https://cloud.funda.nl/valentina_media/184/398/280_360x240.jpg 360w, https://cloud.funda.nl/valentina_media/184/398/280_720x480.jpg 720w, https://cloud.funda.nl/valentina_media/184/398/280_1080x720.jpg 1080w, https://cloud.funda.nl/valentina_media/184/398/280_2160x1440.jpg 2160w, https://cloud.funda.nl/valentina_media/184/398/281_1440x960.jpg 1440w, https://cloud.funda.nl/valentina_media/184/398/281_180x120.jpg 180w, https://cloud.funda.nl/valentina_media/184/398/281_360x240.jpg 360w, https://cloud.funda.nl/valentina_media/184/398/281_720x480.jpg 720w, https://cloud.funda.nl/valentina_media/184/398/281_1080x720.jpg 1080w, https://cloud.funda.nl/valentina_media/184/398/281_2160x1440.jpg 2160w, https://cloud.funda.nl/valentina_media/184/398/271_1440x960.jpg 1440w, https://cloud.funda.nl/valentina_media/184/398/271_180x120.jpg 180w, https://cloud.funda.nl/valentina_media/184/398/271_360x240.jpg 360w, https://cloud.funda.nl/valentina_media/184/398/271_720x480.jpg 720w, https://cloud.funda.nl/valentina_media/184/398/271_1080x720.jpg 1080w, https://cloud.funda.nl/valentina_media/184/398/271_2160x1440.jpg 2160w, https://cloud.funda.nl/valentina_media/184/398/256_1440x960.jpg 1440w, https://cloud.funda.nl/valentina_media/184/398/256_180x120.jpg 180w, https://cloud.funda.nl/valentina_media/184/398/256_360x240.jpg 360w, https://cloud.funda.nl/valentina_media/184/398/256_720x480.jpg 720w, https://cloud.funda.nl/valentina_media/184/398/256_1080x720.jpg 1080w, https://cloud.funda.nl/valentina_media/184/398/256_2160x1440.jpg 2160w, https://cloud.funda.nl/valentina_media/184/398/277_1440x960.jpg 1440w, https://cloud.funda.nl/valentina_media/184/398/277_180x120.jpg 180w, https://cloud.funda.nl/valentina_media/184/398/277_360x240.jpg 360w, https://cloud.funda.nl/valentina_media/184/398/277_720x480.jpg 720w, https://cloud.funda.nl/valentina_media/184/398/277_1080x720.jpg 1080w, https://cloud.funda.nl/valentina_media/184/398/277_2160x1440.jpg 2160w;1640;
