url;house_id;city;house_type;building_type;price;price_m2;room;bedroom;bathroom;living_area;energy_label;zip;address;year_built;house_age;descrip;photo;m3_gasverbruik_per_jaar;kwh_stroomvebruik_per_jaar
https://www.funda.nl/koop/moerkapelle/huis-42387973-tweekappers-xl-0-ong/;42387973;moerkapelle;huis;Nieuwbouw;809500;4027.4;6;5;0;201;na;2750;Tweekappers XL (Bouwnr. 111);2024;0;DE TWEEKAPPERS XL,  ZELDZAAM  GROOT Met  een gebruiksoppervlak  van meer dan 200  vierkante  meter doen deze tweekappers XL hun naam eer  aan. Hier heeft  u echt de  ruimte. En  zelfs een  extra  hoog plafond. Ze zijn bovendien prachtig gelegen aan het park en aan of bij het polderlaantje waar ook de vrijstaande woningen worden gerealiseerd. Ze hebben een extra brede beukmaat en in plaats van een garage hebben ze een grote zij-uitbouw van twee lagen. Dat zorgt allereerst voor een zeer royale entreehal met een fraaie open trap naar de eerste verdieping waar de uitbouw ook extra ruimte biedt. Zo vindt u op de eerste en tweede etage maar liefst vijf royale kamers. Type E is net iets groter dan type EP door de vier meter brede uitbouw aan de voorzijde die ook op de eerste etage extra ruimte geeft.  TYPE EP Een heerlijke woning met alle ruimte voor uw woonwensen. Standaard is de keuken aan de voorzijde en de royale living aan de achterzijde. Optioneel is er nog een uitbouw mogelijk voor slapen en badderen op de begane grond. Bijzonder zijn de openslaande deuren aan de voorzijde, met een diepe voortuin zodat het hier ook aantrekkelijk vertoeven is met uitzicht op het park en avondzon.;https://cloud.funda.nl/valentina_media/182/113/740_1440x960.jpg 1440w, https://cloud.funda.nl/valentina_media/182/113/740_180x120.jpg 180w, https://cloud.funda.nl/valentina_media/182/113/740_360x240.jpg 360w, https://cloud.funda.nl/valentina_media/182/113/740_720x480.jpg 720w, https://cloud.funda.nl/valentina_media/182/113/740_1080x720.jpg 1080w, https://cloud.funda.nl/valentina_media/182/113/740_2160x1440.jpg 2160w, https://cloud.funda.nl/valentina_media/182/113/687_1440x960.jpg 1440w, https://cloud.funda.nl/valentina_media/182/113/687_180x120.jpg 180w, https://cloud.funda.nl/valentina_media/182/113/687_360x240.jpg 360w, https://cloud.funda.nl/valentina_media/182/113/687_720x480.jpg 720w, https://cloud.funda.nl/valentina_media/182/113/687_1080x720.jpg 1080w, https://cloud.funda.nl/valentina_media/182/113/687_2160x1440.jpg 2160w, https://cloud.funda.nl/valentina_media/182/113/756_1440x960.jpg 1440w, https://cloud.funda.nl/valentina_media/182/113/756_180x120.jpg 180w, https://cloud.funda.nl/valentina_media/182/113/756_360x240.jpg 360w, https://cloud.funda.nl/valentina_media/182/113/756_720x480.jpg 720w, https://cloud.funda.nl/valentina_media/182/113/756_1080x720.jpg 1080w, https://cloud.funda.nl/valentina_media/182/113/756_2160x1440.jpg 2160w, https://cloud.funda.nl/valentina_media/182/113/783_1440x960.jpg 1440w, https://cloud.funda.nl/valentina_media/182/113/783_180x120.jpg 180w, https://cloud.funda.nl/valentina_media/182/113/783_360x240.jpg 360w, https://cloud.funda.nl/valentina_media/182/113/783_720x480.jpg 720w, https://cloud.funda.nl/valentina_media/182/113/783_1080x720.jpg 1080w, https://cloud.funda.nl/valentina_media/182/113/783_2160x1440.jpg 2160w, https://cloud.funda.nl/valentina_media/182/113/751_1440x960.jpg 1440w, https://cloud.funda.nl/valentina_media/182/113/751_180x120.jpg 180w, https://cloud.funda.nl/valentina_media/182/113/751_360x240.jpg 360w, https://cloud.funda.nl/valentina_media/182/113/751_720x480.jpg 720w, https://cloud.funda.nl/valentina_media/182/113/751_1080x720.jpg 1080w, https://cloud.funda.nl/valentina_media/182/113/751_2160x1440.jpg 2160w, https://cloud.funda.nl/valentina_media/182/113/734_1440x960.jpg 1440w, https://cloud.funda.nl/valentina_media/182/113/734_180x120.jpg 180w, https://cloud.funda.nl/valentina_media/182/113/734_360x240.jpg 360w, https://cloud.funda.nl/valentina_media/182/113/734_720x480.jpg 720w, https://cloud.funda.nl/valentina_media/182/113/734_1080x720.jpg 1080w, https://cloud.funda.nl/valentina_media/182/113/734_2160x1440.jpg 2160w, https://cloud.funda.nl/valentina_media/182/113/813_1440x960.jpg 1440w, https://cloud.funda.nl/valentina_media/182/113/813_180x120.jpg 180w, https://cloud.funda.nl/valentina_media/182/113/813_360x240.jpg 360w, https://cloud.funda.nl/valentina_media/182/113/813_720x480.jpg 720w, https://cloud.funda.nl/valentina_media/182/113/813_1080x720.jpg 1080w, https://cloud.funda.nl/valentina_media/182/113/813_2160x1440.jpg 2160w, https://cloud.funda.nl/valentina_media/182/113/768_1440x960.jpg 1440w, https://cloud.funda.nl/valentina_media/182/113/768_180x120.jpg 180w, https://cloud.funda.nl/valentina_media/182/113/768_360x240.jpg 360w, https://cloud.funda.nl/valentina_media/182/113/768_720x480.jpg 720w, https://cloud.funda.nl/valentina_media/182/113/768_1080x720.jpg 1080w, https://cloud.funda.nl/valentina_media/182/113/768_2160x1440.jpg 2160w, https://cloud.funda.nl/valentina_media/182/113/782_1440x960.jpg 1440w, https://cloud.funda.nl/valentina_media/182/113/782_180x120.jpg 180w, https://cloud.funda.nl/valentina_media/182/113/782_360x240.jpg 360w, https://cloud.funda.nl/valentina_media/182/113/782_720x480.jpg 720w, https://cloud.funda.nl/valentina_media/182/113/782_1080x720.jpg 1080w, https://cloud.funda.nl/valentina_media/182/113/782_2160x1440.jpg 2160w, https://cloud.funda.nl/valentina_media/182/113/769_1440x960.jpg 1440w, https://cloud.funda.nl/valentina_media/182/113/769_180x120.jpg 180w, https://cloud.funda.nl/valentina_media/182/113/769_360x240.jpg 360w, https://cloud.funda.nl/valentina_media/182/113/769_720x480.jpg 720w, https://cloud.funda.nl/valentina_media/182/113/769_1080x720.jpg 1080w, https://cloud.funda.nl/valentina_media/182/113/769_2160x1440.jpg 2160w, https://cloud.funda.nl/valentina_media/182/113/765_1440x960.jpg 1440w, https://cloud.funda.nl/valentina_media/182/113/765_180x120.jpg 180w, https://cloud.funda.nl/valentina_media/182/113/765_360x240.jpg 360w, https://cloud.funda.nl/valentina_media/182/113/765_720x480.jpg 720w, https://cloud.funda.nl/valentina_media/182/113/765_1080x720.jpg 1080w, https://cloud.funda.nl/valentina_media/182/113/765_2160x1440.jpg 2160w;1550.0;
https://www.funda.nl/koop/moerkapelle/huis-42387579-gezinswoningen-0-ong/;42387579;moerkapelle;huis;Nieuwbouw;419500;3920.6;4;2;0;107;na;2750;Gezinswoningen (Bouwnr. 27);2024;0;HEERLIJKE GEZINSWONINGEN Van  deze  woningen zijn  er elf  waaronder twee extra grote  hoekwoningen  en twee speciale tussenwoningen met aan de  voorzijde  een tuitgevel. Ze  liggen tegenover het voetbalveld  zodat ze  allemaal  een  vrij uitzicht hebben. En voor de liefhebbers, in de zonnige voortuin zit je op de eretribune.  TYPE A  De meest betaalbare woning, type A, heeft standaard een dakkapel op de tweede verdieping, waardoor een fijne zolderkamer ontstaat.;https://cloud.funda.nl/valentina_media/182/096/955_1440x960.jpg 1440w, https://cloud.funda.nl/valentina_media/182/096/955_180x120.jpg 180w, https://cloud.funda.nl/valentina_media/182/096/955_360x240.jpg 360w, https://cloud.funda.nl/valentina_media/182/096/955_720x480.jpg 720w, https://cloud.funda.nl/valentina_media/182/096/955_1080x720.jpg 1080w, https://cloud.funda.nl/valentina_media/182/096/955_2160x1440.jpg 2160w, https://cloud.funda.nl/valentina_media/182/096/953_1440x960.jpg 1440w, https://cloud.funda.nl/valentina_media/182/096/953_180x120.jpg 180w, https://cloud.funda.nl/valentina_media/182/096/953_360x240.jpg 360w, https://cloud.funda.nl/valentina_media/182/096/953_720x480.jpg 720w, https://cloud.funda.nl/valentina_media/182/096/953_1080x720.jpg 1080w, https://cloud.funda.nl/valentina_media/182/096/953_2160x1440.jpg 2160w, https://cloud.funda.nl/valentina_media/182/096/956_1440x960.jpg 1440w, https://cloud.funda.nl/valentina_media/182/096/956_180x120.jpg 180w, https://cloud.funda.nl/valentina_media/182/096/956_360x240.jpg 360w, https://cloud.funda.nl/valentina_media/182/096/956_720x480.jpg 720w, https://cloud.funda.nl/valentina_media/182/096/956_1080x720.jpg 1080w, https://cloud.funda.nl/valentina_media/182/096/956_2160x1440.jpg 2160w, https://cloud.funda.nl/valentina_media/182/096/957_1440x960.jpg 1440w, https://cloud.funda.nl/valentina_media/182/096/957_180x120.jpg 180w, https://cloud.funda.nl/valentina_media/182/096/957_360x240.jpg 360w, https://cloud.funda.nl/valentina_media/182/096/957_720x480.jpg 720w, https://cloud.funda.nl/valentina_media/182/096/957_1080x720.jpg 1080w, https://cloud.funda.nl/valentina_media/182/096/957_2160x1440.jpg 2160w;923.0;
https://www.funda.nl/koop/moerkapelle/huis-42370824-tweekappers-xl-0-ong/;42370824;moerkapelle;huis;Nieuwbouw;799500;3997.5;6;5;0;200;na;2750;Tweekappers XL (Bouwnr. 112);2024;0;DE TWEEKAPPERS XL,  ZELDZAAM  GROOT Met  een gebruiksoppervlak  van meer dan 200  vierkante  meter doen deze tweekappers XL  hun naam  eer  aan. Hier heeft  u  echt  de  ruimte.  En zelfs een extra  hoog plafond. Ze zijn bovendien prachtig gelegen aan het park en aan of bij het polderlaantje waar ook de vrijstaande woningen worden gerealiseerd. Ze hebben een extra brede beukmaat en in plaats van een garage hebben ze een grote zij-uitbouw van twee lagen. Dat zorgt allereerst voor een zeer royale entreehal met een fraaie open trap naar de eerste verdieping waar de uitbouw ook extra ruimte biedt. Zo vindt u op de eerste en tweede etage maar liefst vijf royale kamers. Type E is net iets groter dan type EP door de vier meter brede uitbouw aan de voorzijde die ook op de eerste etage extra ruimte geeft.;https://cloud.funda.nl/valentina_media/181/807/180_1440x960.jpg 1440w, https://cloud.funda.nl/valentina_media/181/807/180_180x120.jpg 180w, https://cloud.funda.nl/valentina_media/181/807/180_360x240.jpg 360w, https://cloud.funda.nl/valentina_media/181/807/180_720x480.jpg 720w, https://cloud.funda.nl/valentina_media/181/807/180_1080x720.jpg 1080w, https://cloud.funda.nl/valentina_media/181/807/180_2160x1440.jpg 2160w, https://cloud.funda.nl/valentina_media/181/807/179_1440x960.jpg 1440w, https://cloud.funda.nl/valentina_media/181/807/179_180x120.jpg 180w, https://cloud.funda.nl/valentina_media/181/807/179_360x240.jpg 360w, https://cloud.funda.nl/valentina_media/181/807/179_720x480.jpg 720w, https://cloud.funda.nl/valentina_media/181/807/179_1080x720.jpg 1080w, https://cloud.funda.nl/valentina_media/181/807/179_2160x1440.jpg 2160w, https://cloud.funda.nl/valentina_media/182/113/376_1440x960.jpg 1440w, https://cloud.funda.nl/valentina_media/182/113/376_180x120.jpg 180w, https://cloud.funda.nl/valentina_media/182/113/376_360x240.jpg 360w, https://cloud.funda.nl/valentina_media/182/113/376_720x480.jpg 720w, https://cloud.funda.nl/valentina_media/182/113/376_1080x720.jpg 1080w, https://cloud.funda.nl/valentina_media/182/113/376_2160x1440.jpg 2160w, https://cloud.funda.nl/valentina_media/182/113/375_1440x960.jpg 1440w, https://cloud.funda.nl/valentina_media/182/113/375_180x120.jpg 180w, https://cloud.funda.nl/valentina_media/182/113/375_360x240.jpg 360w, https://cloud.funda.nl/valentina_media/182/113/375_720x480.jpg 720w, https://cloud.funda.nl/valentina_media/182/113/375_1080x720.jpg 1080w, https://cloud.funda.nl/valentina_media/182/113/375_2160x1440.jpg 2160w, https://cloud.funda.nl/valentina_media/182/113/378_1440x960.jpg 1440w, https://cloud.funda.nl/valentina_media/182/113/378_180x120.jpg 180w, https://cloud.funda.nl/valentina_media/182/113/378_360x240.jpg 360w, https://cloud.funda.nl/valentina_media/182/113/378_720x480.jpg 720w, https://cloud.funda.nl/valentina_media/182/113/378_1080x720.jpg 1080w, https://cloud.funda.nl/valentina_media/182/113/378_2160x1440.jpg 2160w, https://cloud.funda.nl/valentina_media/182/113/374_1440x960.jpg 1440w, https://cloud.funda.nl/valentina_media/182/113/374_180x120.jpg 180w, https://cloud.funda.nl/valentina_media/182/113/374_360x240.jpg 360w, https://cloud.funda.nl/valentina_media/182/113/374_720x480.jpg 720w, https://cloud.funda.nl/valentina_media/182/113/374_1080x720.jpg 1080w, https://cloud.funda.nl/valentina_media/182/113/374_2160x1440.jpg 2160w, https://cloud.funda.nl/valentina_media/182/113/373_1440x960.jpg 1440w, https://cloud.funda.nl/valentina_media/182/113/373_180x120.jpg 180w, https://cloud.funda.nl/valentina_media/182/113/373_360x240.jpg 360w, https://cloud.funda.nl/valentina_media/182/113/373_720x480.jpg 720w, https://cloud.funda.nl/valentina_media/182/113/373_1080x720.jpg 1080w, https://cloud.funda.nl/valentina_media/182/113/373_2160x1440.jpg 2160w, https://cloud.funda.nl/valentina_media/181/807/198_1440x960.jpg 1440w, https://cloud.funda.nl/valentina_media/181/807/198_180x120.jpg 180w, https://cloud.funda.nl/valentina_media/181/807/198_360x240.jpg 360w, https://cloud.funda.nl/valentina_media/181/807/198_720x480.jpg 720w, https://cloud.funda.nl/valentina_media/181/807/198_1080x720.jpg 1080w, https://cloud.funda.nl/valentina_media/181/807/198_2160x1440.jpg 2160w;1592.0;
https://www.funda.nl/koop/moerkapelle/huis-42387584-gezinswoningen-0-ong/;42387584;moerkapelle;huis;Nieuwbouw;419500;3920.6;4;2;0;107;na;2750;Gezinswoningen (Bouwnr. 29);2024;0;HEERLIJKE GEZINSWONINGEN Van  deze  woningen zijn  er elf  waaronder twee extra grote  hoekwoningen  en twee speciale tussenwoningen met  aan de  voorzijde  een tuitgevel. Ze  liggen  tegenover  het  voetbalveld  zodat ze allemaal een  vrij uitzicht hebben. En voor de liefhebbers, in de zonnige voortuin zit je op de eretribune.  TYPE A  De meest betaalbare woning, type A, heeft standaard een dakkapel op de tweede verdieping, waardoor een fijne zolderkamer ontstaat.;https://cloud.funda.nl/valentina_media/182/096/962_1440x960.jpg 1440w, https://cloud.funda.nl/valentina_media/182/096/962_180x120.jpg 180w, https://cloud.funda.nl/valentina_media/182/096/962_360x240.jpg 360w, https://cloud.funda.nl/valentina_media/182/096/962_720x480.jpg 720w, https://cloud.funda.nl/valentina_media/182/096/962_1080x720.jpg 1080w, https://cloud.funda.nl/valentina_media/182/096/962_2160x1440.jpg 2160w, https://cloud.funda.nl/valentina_media/182/096/963_1440x960.jpg 1440w, https://cloud.funda.nl/valentina_media/182/096/963_180x120.jpg 180w, https://cloud.funda.nl/valentina_media/182/096/963_360x240.jpg 360w, https://cloud.funda.nl/valentina_media/182/096/963_720x480.jpg 720w, https://cloud.funda.nl/valentina_media/182/096/963_1080x720.jpg 1080w, https://cloud.funda.nl/valentina_media/182/096/963_2160x1440.jpg 2160w, https://cloud.funda.nl/valentina_media/182/096/967_1440x960.jpg 1440w, https://cloud.funda.nl/valentina_media/182/096/967_180x120.jpg 180w, https://cloud.funda.nl/valentina_media/182/096/967_360x240.jpg 360w, https://cloud.funda.nl/valentina_media/182/096/967_720x480.jpg 720w, https://cloud.funda.nl/valentina_media/182/096/967_1080x720.jpg 1080w, https://cloud.funda.nl/valentina_media/182/096/967_2160x1440.jpg 2160w, https://cloud.funda.nl/valentina_media/182/096/971_1440x960.jpg 1440w, https://cloud.funda.nl/valentina_media/182/096/971_180x120.jpg 180w, https://cloud.funda.nl/valentina_media/182/096/971_360x240.jpg 360w, https://cloud.funda.nl/valentina_media/182/096/971_720x480.jpg 720w, https://cloud.funda.nl/valentina_media/182/096/971_1080x720.jpg 1080w, https://cloud.funda.nl/valentina_media/182/096/971_2160x1440.jpg 2160w;834.0;
https://www.funda.nl/koop/moerkapelle/huis-42387789-herenhuizen-0-ong/;42387789;moerkapelle;huis;Nieuwbouw;470500;3537.6;6;5;0;133;na;2750;Herenhuizen (Bouwnr. 12);2024;0;AANTREKKELIJKE WONINGEN MET  VEEL  RUIMTE Verspreid  door het  hele plan vindt u  deze  royale woningen. Door de brede  beukmaat  heeft u  heerlijk de ruimte.  De woningen  aan  het hofje hebben  standaard  een  veranda. Net als bij de andere types is ook deze woning in allerlei uitvoeringen beschikbaar. De impressies op de volgende pagina’s laten de verschillen goed zien.  TYPE B1 De woning telt maar liefst vijf kamers. Op de begane grond een lichte woonkamer met een open keuken. Bij de woningen met een voortuin op het zuiden is deze extra diep en heeft de woning ook aan de voorzijde openslaande deuren naar de tuin. Op de eerste etage twee grote slaapkamers en een kleinere zijkamer. Op de zolder heeft u standaard een slaapkamer en naast de technische ruimte nog een berging met opstelplaats voor de wasmachine. Dit kan een extra kamer worden met de optie dakkapel en de optie wasruimte op de eerste etage in de kleine kamer aan de achterzijde.;https://cloud.funda.nl/valentina_media/182/106/159_1440x960.jpg 1440w, https://cloud.funda.nl/valentina_media/182/106/159_180x120.jpg 180w, https://cloud.funda.nl/valentina_media/182/106/159_360x240.jpg 360w, https://cloud.funda.nl/valentina_media/182/106/159_720x480.jpg 720w, https://cloud.funda.nl/valentina_media/182/106/159_1080x720.jpg 1080w, https://cloud.funda.nl/valentina_media/182/106/159_2160x1440.jpg 2160w, https://cloud.funda.nl/valentina_media/182/106/154_1440x960.jpg 1440w, https://cloud.funda.nl/valentina_media/182/106/154_180x120.jpg 180w, https://cloud.funda.nl/valentina_media/182/106/154_360x240.jpg 360w, https://cloud.funda.nl/valentina_media/182/106/154_720x480.jpg 720w, https://cloud.funda.nl/valentina_media/182/106/154_1080x720.jpg 1080w, https://cloud.funda.nl/valentina_media/182/106/154_2160x1440.jpg 2160w, https://cloud.funda.nl/valentina_media/182/106/178_1440x960.jpg 1440w, https://cloud.funda.nl/valentina_media/182/106/178_180x120.jpg 180w, https://cloud.funda.nl/valentina_media/182/106/178_360x240.jpg 360w, https://cloud.funda.nl/valentina_media/182/106/178_720x480.jpg 720w, https://cloud.funda.nl/valentina_media/182/106/178_1080x720.jpg 1080w, https://cloud.funda.nl/valentina_media/182/106/178_2160x1440.jpg 2160w, https://cloud.funda.nl/valentina_media/182/106/153_1440x960.jpg 1440w, https://cloud.funda.nl/valentina_media/182/106/153_180x120.jpg 180w, https://cloud.funda.nl/valentina_media/182/106/153_360x240.jpg 360w, https://cloud.funda.nl/valentina_media/182/106/153_720x480.jpg 720w, https://cloud.funda.nl/valentina_media/182/106/153_1080x720.jpg 1080w, https://cloud.funda.nl/valentina_media/182/106/153_2160x1440.jpg 2160w;2227.0;
