url;house_id;city;house_type;building_type;price;price_m2;room;bedroom;bathroom;living_area;energy_label;zip;address;year_built;house_age;descrip;photo;m3_gasverbruik_per_jaar;kwh_stroomvebruik_per_jaar
https://www.funda.nl/koop/melissant/huis-42188979-voorstraat-2-a/;42188979;melissant;huis;Nieuwbouw;625000;3676.5;4;3;2;170;na;3248;Voorstraat 2 A;2023;1;In de Voorstraat  in  Melissant wordt  u een  ruim kavel van circa  1070  m2 aangeboden inclusief een te  bouwen woning.  De  luxe woning zal  gebouwd  worden door aannemings- en  bouwbedrijf  Bloemfontein.  Een goede bouwkwaliteit en hoog afwerkingsniveau.   De koopprijs is voor het kavel inclusief het woningtype Nederhorst. Tevens is het mogelijk om in overleg met Bloemfontein deze woning levensloopbestendig te laten bouwen of een ander soort woning te kiezen. De bijkomende kosten daarvoor komen boven op de koopprijs.  De vermelde koopprijs is inclusief: - Bouw woning Nederhorst - Ruime schuur van circa 120 m2, voor het kavel gelegen  De woning is standaard voorzien van: - Lucht-water warmtepomp met vloerverwarming op begane grond en 1e verdieping (gasloos), temperatuurregelaar per   ruimte - PV panelen - Stucwerk op alle wanden - Complete badkamer en toilet - Schilderwerk binnen en buiten (geheel afgelakt) - Afgewerkte plafonds incl. naden dichtzetten - Houten binnen kozijnen met stompe deuren - Keramische dakpannen - Hardsteen waterslagen  Interesse? Neem dan contact met ons op!;https://cloud.funda.nl/valentina_media/173/725/005_1440x960.jpg 1440w, https://cloud.funda.nl/valentina_media/173/725/005_180x120.jpg 180w, https://cloud.funda.nl/valentina_media/173/725/005_360x240.jpg 360w, https://cloud.funda.nl/valentina_media/173/725/005_720x480.jpg 720w, https://cloud.funda.nl/valentina_media/173/725/005_1080x720.jpg 1080w, https://cloud.funda.nl/valentina_media/173/725/005_2160x1440.jpg 2160w, https://cloud.funda.nl/valentina_media/173/725/004_1440x960.jpg 1440w, https://cloud.funda.nl/valentina_media/173/725/004_180x120.jpg 180w, https://cloud.funda.nl/valentina_media/173/725/004_360x240.jpg 360w, https://cloud.funda.nl/valentina_media/173/725/004_720x480.jpg 720w, https://cloud.funda.nl/valentina_media/173/725/004_1080x720.jpg 1080w, https://cloud.funda.nl/valentina_media/173/725/004_2160x1440.jpg 2160w, https://cloud.funda.nl/valentina_media/173/725/002_1440x960.jpg 1440w, https://cloud.funda.nl/valentina_media/173/725/002_180x120.jpg 180w, https://cloud.funda.nl/valentina_media/173/725/002_360x240.jpg 360w, https://cloud.funda.nl/valentina_media/173/725/002_720x480.jpg 720w, https://cloud.funda.nl/valentina_media/173/725/002_1080x720.jpg 1080w, https://cloud.funda.nl/valentina_media/173/725/002_2160x1440.jpg 2160w, https://cloud.funda.nl/valentina_media/173/725/003_1440x960.jpg 1440w, https://cloud.funda.nl/valentina_media/173/725/003_180x120.jpg 180w, https://cloud.funda.nl/valentina_media/173/725/003_360x240.jpg 360w, https://cloud.funda.nl/valentina_media/173/725/003_720x480.jpg 720w, https://cloud.funda.nl/valentina_media/173/725/003_1080x720.jpg 1080w, https://cloud.funda.nl/valentina_media/173/725/003_2160x1440.jpg 2160w, https://cloud.funda.nl/valentina_media/173/725/008_1440x960.jpg 1440w, https://cloud.funda.nl/valentina_media/173/725/008_180x120.jpg 180w, https://cloud.funda.nl/valentina_media/173/725/008_360x240.jpg 360w, https://cloud.funda.nl/valentina_media/173/725/008_720x480.jpg 720w, https://cloud.funda.nl/valentina_media/173/725/008_1080x720.jpg 1080w, https://cloud.funda.nl/valentina_media/173/725/008_2160x1440.jpg 2160w, https://cloud.funda.nl/valentina_media/173/725/006_1440x960.jpg 1440w, https://cloud.funda.nl/valentina_media/173/725/006_180x120.jpg 180w, https://cloud.funda.nl/valentina_media/173/725/006_360x240.jpg 360w, https://cloud.funda.nl/valentina_media/173/725/006_720x480.jpg 720w, https://cloud.funda.nl/valentina_media/173/725/006_1080x720.jpg 1080w, https://cloud.funda.nl/valentina_media/173/725/006_2160x1440.jpg 2160w, https://cloud.funda.nl/valentina_media/173/725/007_1440x960.jpg 1440w, https://cloud.funda.nl/valentina_media/173/725/007_180x120.jpg 180w, https://cloud.funda.nl/valentina_media/173/725/007_360x240.jpg 360w, https://cloud.funda.nl/valentina_media/173/725/007_720x480.jpg 720w, https://cloud.funda.nl/valentina_media/173/725/007_1080x720.jpg 1080w, https://cloud.funda.nl/valentina_media/173/725/007_2160x1440.jpg 2160w, https://cloud.funda.nl/valentina_media/173/725/009_1440x960.jpg 1440w, https://cloud.funda.nl/valentina_media/173/725/009_180x120.jpg 180w, https://cloud.funda.nl/valentina_media/173/725/009_360x240.jpg 360w, https://cloud.funda.nl/valentina_media/173/725/009_720x480.jpg 720w, https://cloud.funda.nl/valentina_media/173/725/009_1080x720.jpg 1080w, https://cloud.funda.nl/valentina_media/173/725/009_2160x1440.jpg 2160w, https://cloud.funda.nl/valentina_media/173/725/010_1440x960.jpg 1440w, https://cloud.funda.nl/valentina_media/173/725/010_180x120.jpg 180w, https://cloud.funda.nl/valentina_media/173/725/010_360x240.jpg 360w, https://cloud.funda.nl/valentina_media/173/725/010_720x480.jpg 720w, https://cloud.funda.nl/valentina_media/173/725/010_1080x720.jpg 1080w, https://cloud.funda.nl/valentina_media/173/725/010_2160x1440.jpg 2160w;1479;
https://www.funda.nl/koop/melissant/huis-43557602-royale-eengezinswoning-0-ong/;43557602;melissant;huis;Nieuwbouw;350000;2916.7;5;4;0;120;na;3248;Royale eengezinswoning (Bouwnr. 26);2024;0;Ben jij op  zoek  naar een  royale hoekwoning?  Deze woningen hebben drie  slaapkamers  op de 1e verdieping en een 2e  verdieping  waar nog slaapkamers  gecreëerd kunnen worden. Tevens  is er  een  ruime  berging in de tuin.  * Genoemde prijzen zijn Vrij Op Naam dat wil zeggen inclusief 21% B.T.W. Inclusief grond-, notaris- makelaars-, en adviseurskosten, echter exclusief financieringskosten. Aan de getoonde beelden kunnen geen rechten worden ontleend.;https://cloud.funda.nl/valentina_media/189/039/400_1440x960.jpg 1440w, https://cloud.funda.nl/valentina_media/189/039/400_180x120.jpg 180w, https://cloud.funda.nl/valentina_media/189/039/400_360x240.jpg 360w, https://cloud.funda.nl/valentina_media/189/039/400_720x480.jpg 720w, https://cloud.funda.nl/valentina_media/189/039/400_1080x720.jpg 1080w, https://cloud.funda.nl/valentina_media/189/039/400_2160x1440.jpg 2160w, https://cloud.funda.nl/valentina_media/189/039/407_1440x960.jpg 1440w, https://cloud.funda.nl/valentina_media/189/039/407_180x120.jpg 180w, https://cloud.funda.nl/valentina_media/189/039/407_360x240.jpg 360w, https://cloud.funda.nl/valentina_media/189/039/407_720x480.jpg 720w, https://cloud.funda.nl/valentina_media/189/039/407_1080x720.jpg 1080w, https://cloud.funda.nl/valentina_media/189/039/407_2160x1440.jpg 2160w, https://cloud.funda.nl/valentina_media/189/039/403_1440x960.jpg 1440w, https://cloud.funda.nl/valentina_media/189/039/403_180x120.jpg 180w, https://cloud.funda.nl/valentina_media/189/039/403_360x240.jpg 360w, https://cloud.funda.nl/valentina_media/189/039/403_720x480.jpg 720w, https://cloud.funda.nl/valentina_media/189/039/403_1080x720.jpg 1080w, https://cloud.funda.nl/valentina_media/189/039/403_2160x1440.jpg 2160w, https://cloud.funda.nl/valentina_media/189/039/405_1440x960.jpg 1440w, https://cloud.funda.nl/valentina_media/189/039/405_180x120.jpg 180w, https://cloud.funda.nl/valentina_media/189/039/405_360x240.jpg 360w, https://cloud.funda.nl/valentina_media/189/039/405_720x480.jpg 720w, https://cloud.funda.nl/valentina_media/189/039/405_1080x720.jpg 1080w, https://cloud.funda.nl/valentina_media/189/039/405_2160x1440.jpg 2160w;1790;
https://www.funda.nl/koop/melissant/huis-43557893-levensloopbestendige-woning-0-ong/;43557893;melissant;huis;Nieuwbouw;340000;3207.5;3;2;0;106;>A+;3248;Levensloopbestendige woning (Bouwnr. 2);2024;0;Voor wie op  zoek  is naar  een tussenwoning  die meegroeit met de  veranderende  levensfasen, is deze optie ideaal. Deze woning is  speciaal ontworpen met  een bad- en  slaapkamer op  de begane  grond,  waardoor ze helemaal van deze tijd en compleet levensloopbestendig zijn. Met alle belangrijke voorzieningen gelijkvloers bieden deze woningen gemak en toegankelijkheid voor iedereen.  De woning heeft een ruime verdieping waar nog twee slaapkamers gecreëerd kunnen worden.  Voor nadere informatie omtrent de kavels in project Nollepolder kunt u contact met ons opnemen via 0187-684868 of   * Genoemde prijzen zijn Vrij Op Naam dat wil zeggen inclusief 21% B.T.W. Inclusief grond-, notaris- makelaars-, en adviseurskosten, echter exclusief financieringskosten. Aan de getoonde beelden kunnen geen rechten worden ontleend.;https://cloud.funda.nl/valentina_media/189/045/776_1440x960.jpg 1440w, https://cloud.funda.nl/valentina_media/189/045/776_180x120.jpg 180w, https://cloud.funda.nl/valentina_media/189/045/776_360x240.jpg 360w, https://cloud.funda.nl/valentina_media/189/045/776_720x480.jpg 720w, https://cloud.funda.nl/valentina_media/189/045/776_1080x720.jpg 1080w, https://cloud.funda.nl/valentina_media/189/045/776_2160x1440.jpg 2160w, https://cloud.funda.nl/valentina_media/189/045/778_1440x960.jpg 1440w, https://cloud.funda.nl/valentina_media/189/045/778_180x120.jpg 180w, https://cloud.funda.nl/valentina_media/189/045/778_360x240.jpg 360w, https://cloud.funda.nl/valentina_media/189/045/778_720x480.jpg 720w, https://cloud.funda.nl/valentina_media/189/045/778_1080x720.jpg 1080w, https://cloud.funda.nl/valentina_media/189/045/778_2160x1440.jpg 2160w;967;614.0
