url;house_id;city;house_type;building_type;price;price_m2;room;bedroom;bathroom;living_area;energy_label;zip;address;year_built;house_age;descrip;photo;m3_gasverbruik_per_jaar;kwh_stroomvebruik_per_jaar
https://www.funda.nl/koop/melissant/huis-42188985-voorstraat-2-b/;42188985;melissant;huis;Nieuwbouw;625000;3472.2;4;3;1;180;na;3248;Voorstraat 2 B;2023;1;In de Voorstraat  in  Melissant wordt  u een  ruim kavel van circa  985  m2 aangeboden inclusief een te  bouwen woning.  De  luxe woning zal  gebouwd  worden  door  aannemings-  en bouwbedrijf Bloemfontein. Een  goede bouwkwaliteit en hoog afwerkingsniveau.   De koopprijs is voor het kavel inclusief het woningtype Nederhorst. Tevens is het mogelijk om in overleg met Bloemfonteindeze woning levensloopbestendig te laten bouwen of een ander soort woning te kiezen. De bijkomende kosten daarvoor komen boven op de koopprijs.  De vermelde koopprijs is inclusief: - Bouw woning Nederhorst - Ruime schuur van circa 120 m2, voor het kavel gelegen  De woning is standaard voorzien van: - Lucht-water warmtepomp met vloerverwarming op begane grond en 1e verdieping (gasloos), temperatuurregelaar per   ruimte - PV panelen - Stucwerk op alle wanden - Complete badkamer en toilet - Schilderwerk binnen en buiten (geheel afgelakt) - Afgewerkte plafonds incl. naden dichtzetten - Houten binnen kozijnen met stompe deuren - Keramische dakpannen - Hardsteen waterslagen  Interesse? Neem dan contact met ons op!;https://cloud.funda.nl/valentina_media/173/725/235_1440x960.jpg 1440w, https://cloud.funda.nl/valentina_media/173/725/235_180x120.jpg 180w, https://cloud.funda.nl/valentina_media/173/725/235_360x240.jpg 360w, https://cloud.funda.nl/valentina_media/173/725/235_720x480.jpg 720w, https://cloud.funda.nl/valentina_media/173/725/235_1080x720.jpg 1080w, https://cloud.funda.nl/valentina_media/173/725/235_2160x1440.jpg 2160w, https://cloud.funda.nl/valentina_media/173/725/234_1440x960.jpg 1440w, https://cloud.funda.nl/valentina_media/173/725/234_180x120.jpg 180w, https://cloud.funda.nl/valentina_media/173/725/234_360x240.jpg 360w, https://cloud.funda.nl/valentina_media/173/725/234_720x480.jpg 720w, https://cloud.funda.nl/valentina_media/173/725/234_1080x720.jpg 1080w, https://cloud.funda.nl/valentina_media/173/725/234_2160x1440.jpg 2160w, https://cloud.funda.nl/valentina_media/173/725/236_1440x960.jpg 1440w, https://cloud.funda.nl/valentina_media/173/725/236_180x120.jpg 180w, https://cloud.funda.nl/valentina_media/173/725/236_360x240.jpg 360w, https://cloud.funda.nl/valentina_media/173/725/236_720x480.jpg 720w, https://cloud.funda.nl/valentina_media/173/725/236_1080x720.jpg 1080w, https://cloud.funda.nl/valentina_media/173/725/236_2160x1440.jpg 2160w, https://cloud.funda.nl/valentina_media/173/725/237_1440x960.jpg 1440w, https://cloud.funda.nl/valentina_media/173/725/237_180x120.jpg 180w, https://cloud.funda.nl/valentina_media/173/725/237_360x240.jpg 360w, https://cloud.funda.nl/valentina_media/173/725/237_720x480.jpg 720w, https://cloud.funda.nl/valentina_media/173/725/237_1080x720.jpg 1080w, https://cloud.funda.nl/valentina_media/173/725/237_2160x1440.jpg 2160w, https://cloud.funda.nl/valentina_media/173/725/238_1440x960.jpg 1440w, https://cloud.funda.nl/valentina_media/173/725/238_180x120.jpg 180w, https://cloud.funda.nl/valentina_media/173/725/238_360x240.jpg 360w, https://cloud.funda.nl/valentina_media/173/725/238_720x480.jpg 720w, https://cloud.funda.nl/valentina_media/173/725/238_1080x720.jpg 1080w, https://cloud.funda.nl/valentina_media/173/725/238_2160x1440.jpg 2160w, https://cloud.funda.nl/valentina_media/173/725/239_1440x960.jpg 1440w, https://cloud.funda.nl/valentina_media/173/725/239_180x120.jpg 180w, https://cloud.funda.nl/valentina_media/173/725/239_360x240.jpg 360w, https://cloud.funda.nl/valentina_media/173/725/239_720x480.jpg 720w, https://cloud.funda.nl/valentina_media/173/725/239_1080x720.jpg 1080w, https://cloud.funda.nl/valentina_media/173/725/239_2160x1440.jpg 2160w, https://cloud.funda.nl/valentina_media/173/725/241_1440x960.jpg 1440w, https://cloud.funda.nl/valentina_media/173/725/241_180x120.jpg 180w, https://cloud.funda.nl/valentina_media/173/725/241_360x240.jpg 360w, https://cloud.funda.nl/valentina_media/173/725/241_720x480.jpg 720w, https://cloud.funda.nl/valentina_media/173/725/241_1080x720.jpg 1080w, https://cloud.funda.nl/valentina_media/173/725/241_2160x1440.jpg 2160w, https://cloud.funda.nl/valentina_media/173/725/242_1440x960.jpg 1440w, https://cloud.funda.nl/valentina_media/173/725/242_180x120.jpg 180w, https://cloud.funda.nl/valentina_media/173/725/242_360x240.jpg 360w, https://cloud.funda.nl/valentina_media/173/725/242_720x480.jpg 720w, https://cloud.funda.nl/valentina_media/173/725/242_1080x720.jpg 1080w, https://cloud.funda.nl/valentina_media/173/725/242_2160x1440.jpg 2160w, https://cloud.funda.nl/valentina_media/173/725/240_1440x960.jpg 1440w, https://cloud.funda.nl/valentina_media/173/725/240_180x120.jpg 180w, https://cloud.funda.nl/valentina_media/173/725/240_360x240.jpg 360w, https://cloud.funda.nl/valentina_media/173/725/240_720x480.jpg 720w, https://cloud.funda.nl/valentina_media/173/725/240_1080x720.jpg 1080w, https://cloud.funda.nl/valentina_media/173/725/240_2160x1440.jpg 2160w;1651;
https://www.funda.nl/koop/melissant/huis-43557882-levensloopbestendige-woning-0-ong/;43557882;melissant;huis;Nieuwbouw;365000;3443.4;3;2;0;106;>A+;3248;Levensloopbestendige woning (Bouwnr. 1);2024;0;Voor wie op  zoek  is naar  een hoekwoning  die meegroeit met de  veranderende  levensfasen, is deze optie  ideaal.  Deze woning  is speciaal ontworpen met  een  bad- en slaapkamer  op  de begane grond, waardoor ze helemaal van deze tijd en compleet levensloopbestendig zijn. Met alle belangrijke voorzieningen gelijkvloers bieden deze woningen gemak en toegankelijkheid voor iedereen.  De woning heeft een ruime verdieping waar nog twee slaapkamers gecreëerd kunnen worden.  Voor nadere informatie omtrent de kavels in project Nollepolder kunt u contact met ons opnemen via 0187-684868 of   * Genoemde prijzen zijn Vrij Op Naam dat wil zeggen inclusief 21% B.T.W. Inclusief grond-, notaris- makelaars-, en adviseurskosten, echter exclusief financieringskosten. Aan de getoonde beelden kunnen geen rechten worden ontleend.;https://cloud.funda.nl/valentina_media/189/045/774_1440x960.jpg 1440w, https://cloud.funda.nl/valentina_media/189/045/774_180x120.jpg 180w, https://cloud.funda.nl/valentina_media/189/045/774_360x240.jpg 360w, https://cloud.funda.nl/valentina_media/189/045/774_720x480.jpg 720w, https://cloud.funda.nl/valentina_media/189/045/774_1080x720.jpg 1080w, https://cloud.funda.nl/valentina_media/189/045/774_2160x1440.jpg 2160w, https://cloud.funda.nl/valentina_media/189/045/775_1440x960.jpg 1440w, https://cloud.funda.nl/valentina_media/189/045/775_180x120.jpg 180w, https://cloud.funda.nl/valentina_media/189/045/775_360x240.jpg 360w, https://cloud.funda.nl/valentina_media/189/045/775_720x480.jpg 720w, https://cloud.funda.nl/valentina_media/189/045/775_1080x720.jpg 1080w, https://cloud.funda.nl/valentina_media/189/045/775_2160x1440.jpg 2160w;782;625.0
https://www.funda.nl/koop/melissant/huis-43556329-compacte-eengezinswoningen-0-ong/;43556329;melissant;huis;Nieuwbouw;265000;2912.1;4;3;0;91;na;3248;Compacte eengezinswoningen (Bouwnr. 14);2024;0;Deze prachtige eengezinswoningen  met  vrijstaande berging  zijn ideaal  voor starters, jonge gezinnen  of  iedereen die op zoek  is  naar  wooncomfort. Deze  woningen zijn energiezuinig,  voldoen aan  de BENG-eisen  en  bieden  een  uitstekende prijs-kwaliteitsverhouding. Met een tijdloze uitstraling en moderne voorzieningen zijn deze woningen perfect voor een stijlvol en comfortabel leven.  * Genoemde prijzen zijn Vrij Op Naam dat wil zeggen inclusief 21% B.T.W. Inclusief grond-, notaris- makelaars-, en adviseurskosten, echter exclusief financieringskosten. Aan de getoonde beelden kunnen geen rechten worden ontleend.;https://cloud.funda.nl/valentina_media/189/026/456_1440x960.jpg 1440w, https://cloud.funda.nl/valentina_media/189/026/456_180x120.jpg 180w, https://cloud.funda.nl/valentina_media/189/026/456_360x240.jpg 360w, https://cloud.funda.nl/valentina_media/189/026/456_720x480.jpg 720w, https://cloud.funda.nl/valentina_media/189/026/456_1080x720.jpg 1080w, https://cloud.funda.nl/valentina_media/189/026/456_2160x1440.jpg 2160w, https://cloud.funda.nl/valentina_media/189/026/459_1440x960.jpg 1440w, https://cloud.funda.nl/valentina_media/189/026/459_180x120.jpg 180w, https://cloud.funda.nl/valentina_media/189/026/459_360x240.jpg 360w, https://cloud.funda.nl/valentina_media/189/026/459_720x480.jpg 720w, https://cloud.funda.nl/valentina_media/189/026/459_1080x720.jpg 1080w, https://cloud.funda.nl/valentina_media/189/026/459_2160x1440.jpg 2160w, https://cloud.funda.nl/valentina_media/189/026/461_1440x960.jpg 1440w, https://cloud.funda.nl/valentina_media/189/026/461_180x120.jpg 180w, https://cloud.funda.nl/valentina_media/189/026/461_360x240.jpg 360w, https://cloud.funda.nl/valentina_media/189/026/461_720x480.jpg 720w, https://cloud.funda.nl/valentina_media/189/026/461_1080x720.jpg 1080w, https://cloud.funda.nl/valentina_media/189/026/461_2160x1440.jpg 2160w, https://cloud.funda.nl/valentina_media/189/026/463_1440x960.jpg 1440w, https://cloud.funda.nl/valentina_media/189/026/463_180x120.jpg 180w, https://cloud.funda.nl/valentina_media/189/026/463_360x240.jpg 360w, https://cloud.funda.nl/valentina_media/189/026/463_720x480.jpg 720w, https://cloud.funda.nl/valentina_media/189/026/463_1080x720.jpg 1080w, https://cloud.funda.nl/valentina_media/189/026/463_2160x1440.jpg 2160w;1582;
https://www.funda.nl/koop/melissant/huis-43557880-levensloopbestendige-woning-0-ong/;43557880;melissant;huis;Nieuwbouw;340000;3207.5;3;2;0;106;>A+;3248;Levensloopbestendige woning (Bouwnr. 6);2024;0;Voor wie op  zoek  is naar  een tussenwoning  die meegroeit met de  veranderende  levensfasen, is deze optie ideaal. Deze woning  is  speciaal ontworpen met  een bad- en slaapkamer  op de  begane  grond,  waardoor ze helemaal van deze tijd en compleet levensloopbestendig zijn. Met alle belangrijke voorzieningen gelijkvloers bieden deze woningen gemak en toegankelijkheid voor iedereen.  De woning heeft een ruime verdieping waar nog twee slaapkamers gecreëerd kunnen worden.  Voor nadere informatie omtrent de kavels in project Nollepolder kunt u contact met ons opnemen via 0187-684868 of   * Genoemde prijzen zijn Vrij Op Naam dat wil zeggen inclusief 21% B.T.W. Inclusief grond-, notaris- makelaars-, en adviseurskosten, echter exclusief financieringskosten. Aan de getoonde beelden kunnen geen rechten worden ontleend.;https://cloud.funda.nl/valentina_media/189/045/828_1440x960.jpg 1440w, https://cloud.funda.nl/valentina_media/189/045/828_180x120.jpg 180w, https://cloud.funda.nl/valentina_media/189/045/828_360x240.jpg 360w, https://cloud.funda.nl/valentina_media/189/045/828_720x480.jpg 720w, https://cloud.funda.nl/valentina_media/189/045/828_1080x720.jpg 1080w, https://cloud.funda.nl/valentina_media/189/045/828_2160x1440.jpg 2160w, https://cloud.funda.nl/valentina_media/189/045/864_1440x960.jpg 1440w, https://cloud.funda.nl/valentina_media/189/045/864_180x120.jpg 180w, https://cloud.funda.nl/valentina_media/189/045/864_360x240.jpg 360w, https://cloud.funda.nl/valentina_media/189/045/864_720x480.jpg 720w, https://cloud.funda.nl/valentina_media/189/045/864_1080x720.jpg 1080w, https://cloud.funda.nl/valentina_media/189/045/864_2160x1440.jpg 2160w;1300;180.0
https://www.funda.nl/koop/melissant/huis-43430539-royale-eengezinswoning-0-ong/;43430539;melissant;huis;Nieuwbouw;330000;2750.0;5;4;0;120;>A+;3248;Royale eengezinswoning (Bouwnr. 20);2024;0;"Met groot genoegen  presenteren  wij de  nieuwe woonwijk  ""Nollepolder"" in Melissant. Een  uniek  project met maar liefst 49  woningen  (12 bouwkavels,  26 koopwoningen en  11 huurwoningen).  Gelegen  aan de groene  buitenrand  van  Melissant.  Nollepolder vormt een mix van grotere en kleinere eengezinswoningen en levensloopbestendige woningen. Stuk voor stuk woningen met een uitstekende prijs-kwaliteitsverhouding. Natuurlijk is er veel aandacht voor duurzaamheid en energiezuinigheid.  Ben jij op zoek naar een royale eengezinswoning? Deze woningen hebben drie slaapkamers op de 1e verdieping en een 2e verdieping waar nog slaapkamers gecreëerd kunnen worden. Tevens is er een ruime berging in de tuin.  * Genoemde prijzen zijn Vrij Op Naam dat wil zeggen inclusief 21% B.T.W. Inclusief grond-, notaris- makelaars-, en adviseurskosten, echter exclusief financieringskosten. Aan de getoonde beelden kunnen geen rechten worden ontleend.";https://cloud.funda.nl/valentina_media/188/342/604_1440x960.jpg 1440w, https://cloud.funda.nl/valentina_media/188/342/604_180x120.jpg 180w, https://cloud.funda.nl/valentina_media/188/342/604_360x240.jpg 360w, https://cloud.funda.nl/valentina_media/188/342/604_720x480.jpg 720w, https://cloud.funda.nl/valentina_media/188/342/604_1080x720.jpg 1080w, https://cloud.funda.nl/valentina_media/188/342/604_2160x1440.jpg 2160w, https://cloud.funda.nl/valentina_media/188/342/605_1440x960.jpg 1440w, https://cloud.funda.nl/valentina_media/188/342/605_180x120.jpg 180w, https://cloud.funda.nl/valentina_media/188/342/605_360x240.jpg 360w, https://cloud.funda.nl/valentina_media/188/342/605_720x480.jpg 720w, https://cloud.funda.nl/valentina_media/188/342/605_1080x720.jpg 1080w, https://cloud.funda.nl/valentina_media/188/342/605_2160x1440.jpg 2160w, https://cloud.funda.nl/valentina_media/188/342/606_1440x960.jpg 1440w, https://cloud.funda.nl/valentina_media/188/342/606_180x120.jpg 180w, https://cloud.funda.nl/valentina_media/188/342/606_360x240.jpg 360w, https://cloud.funda.nl/valentina_media/188/342/606_720x480.jpg 720w, https://cloud.funda.nl/valentina_media/188/342/606_1080x720.jpg 1080w, https://cloud.funda.nl/valentina_media/188/342/606_2160x1440.jpg 2160w, https://cloud.funda.nl/valentina_media/188/342/607_1440x960.jpg 1440w, https://cloud.funda.nl/valentina_media/188/342/607_180x120.jpg 180w, https://cloud.funda.nl/valentina_media/188/342/607_360x240.jpg 360w, https://cloud.funda.nl/valentina_media/188/342/607_720x480.jpg 720w, https://cloud.funda.nl/valentina_media/188/342/607_1080x720.jpg 1080w, https://cloud.funda.nl/valentina_media/188/342/607_2160x1440.jpg 2160w;1381;288.0
https://www.funda.nl/koop/melissant/huis-43556318-compacte-eengezinswoningen-0-ong/;43556318;melissant;huis;Nieuwbouw;265000;2912.1;4;3;0;91;>A+;3248;Compacte eengezinswoningen (Bouwnr. 12);2024;0;Deze prachtige eengezinswoningen  met  vrijstaande berging  zijn ideaal  voor starters, jonge gezinnen  of  iedereen die op zoek is  naar  wooncomfort. Deze  woningen zijn energiezuinig,  voldoen  aan de BENG-eisen en  bieden een  uitstekende  prijs-kwaliteitsverhouding. Met een tijdloze uitstraling en moderne voorzieningen zijn deze woningen perfect voor een stijlvol en comfortabel leven.  * Genoemde prijzen zijn Vrij Op Naam dat wil zeggen inclusief 21% B.T.W. Inclusief grond-, notaris- makelaars-, en adviseurskosten, echter exclusief financieringskosten. Aan de getoonde beelden kunnen geen rechten worden ontleend.;https://cloud.funda.nl/valentina_media/189/026/448_1440x960.jpg 1440w, https://cloud.funda.nl/valentina_media/189/026/448_180x120.jpg 180w, https://cloud.funda.nl/valentina_media/189/026/448_360x240.jpg 360w, https://cloud.funda.nl/valentina_media/189/026/448_720x480.jpg 720w, https://cloud.funda.nl/valentina_media/189/026/448_1080x720.jpg 1080w, https://cloud.funda.nl/valentina_media/189/026/448_2160x1440.jpg 2160w, https://cloud.funda.nl/valentina_media/189/026/449_1440x960.jpg 1440w, https://cloud.funda.nl/valentina_media/189/026/449_180x120.jpg 180w, https://cloud.funda.nl/valentina_media/189/026/449_360x240.jpg 360w, https://cloud.funda.nl/valentina_media/189/026/449_720x480.jpg 720w, https://cloud.funda.nl/valentina_media/189/026/449_1080x720.jpg 1080w, https://cloud.funda.nl/valentina_media/189/026/449_2160x1440.jpg 2160w, https://cloud.funda.nl/valentina_media/189/026/451_1440x960.jpg 1440w, https://cloud.funda.nl/valentina_media/189/026/451_180x120.jpg 180w, https://cloud.funda.nl/valentina_media/189/026/451_360x240.jpg 360w, https://cloud.funda.nl/valentina_media/189/026/451_720x480.jpg 720w, https://cloud.funda.nl/valentina_media/189/026/451_1080x720.jpg 1080w, https://cloud.funda.nl/valentina_media/189/026/451_2160x1440.jpg 2160w, https://cloud.funda.nl/valentina_media/189/026/450_1440x960.jpg 1440w, https://cloud.funda.nl/valentina_media/189/026/450_180x120.jpg 180w, https://cloud.funda.nl/valentina_media/189/026/450_360x240.jpg 360w, https://cloud.funda.nl/valentina_media/189/026/450_720x480.jpg 720w, https://cloud.funda.nl/valentina_media/189/026/450_1080x720.jpg 1080w, https://cloud.funda.nl/valentina_media/189/026/450_2160x1440.jpg 2160w;1359;227.0
https://www.funda.nl/koop/melissant/huis-43557607-royale-eengezinswoning-0-ong/;43557607;melissant;huis;Nieuwbouw;330000;2750.0;5;4;0;120;>A+;3248;Royale eengezinswoning (Bouwnr. 21);2024;0;Ben jij op  zoek  naar een  royale eengezinswoning?  Deze woningen hebben drie  slaapkamers  op de 1e verdieping  en een  2e verdieping waar nog slaapkamers  gecreëerd  kunnen worden. Tevens  is er  een ruime berging in de tuin.  * Genoemde prijzen zijn Vrij Op Naam dat wil zeggen inclusief 21% B.T.W. Inclusief grond-, notaris- makelaars-, en adviseurskosten, echter exclusief financieringskosten. Aan de getoonde beelden kunnen geen rechten worden ontleend.;https://cloud.funda.nl/valentina_media/189/039/373_1440x960.jpg 1440w, https://cloud.funda.nl/valentina_media/189/039/373_180x120.jpg 180w, https://cloud.funda.nl/valentina_media/189/039/373_360x240.jpg 360w, https://cloud.funda.nl/valentina_media/189/039/373_720x480.jpg 720w, https://cloud.funda.nl/valentina_media/189/039/373_1080x720.jpg 1080w, https://cloud.funda.nl/valentina_media/189/039/373_2160x1440.jpg 2160w, https://cloud.funda.nl/valentina_media/189/039/375_1440x960.jpg 1440w, https://cloud.funda.nl/valentina_media/189/039/375_180x120.jpg 180w, https://cloud.funda.nl/valentina_media/189/039/375_360x240.jpg 360w, https://cloud.funda.nl/valentina_media/189/039/375_720x480.jpg 720w, https://cloud.funda.nl/valentina_media/189/039/375_1080x720.jpg 1080w, https://cloud.funda.nl/valentina_media/189/039/375_2160x1440.jpg 2160w, https://cloud.funda.nl/valentina_media/189/039/374_1440x960.jpg 1440w, https://cloud.funda.nl/valentina_media/189/039/374_180x120.jpg 180w, https://cloud.funda.nl/valentina_media/189/039/374_360x240.jpg 360w, https://cloud.funda.nl/valentina_media/189/039/374_720x480.jpg 720w, https://cloud.funda.nl/valentina_media/189/039/374_1080x720.jpg 1080w, https://cloud.funda.nl/valentina_media/189/039/374_2160x1440.jpg 2160w, https://cloud.funda.nl/valentina_media/189/039/376_1440x960.jpg 1440w, https://cloud.funda.nl/valentina_media/189/039/376_180x120.jpg 180w, https://cloud.funda.nl/valentina_media/189/039/376_360x240.jpg 360w, https://cloud.funda.nl/valentina_media/189/039/376_720x480.jpg 720w, https://cloud.funda.nl/valentina_media/189/039/376_1080x720.jpg 1080w, https://cloud.funda.nl/valentina_media/189/039/376_2160x1440.jpg 2160w;1729;612.0
https://www.funda.nl/koop/melissant/huis-43430531-compacte-eengezinswoningen-0-ong/;43430531;melissant;huis;Nieuwbouw;265000;3117.6;4;3;0;85;>A+;3248;Compacte eengezinswoningen (Bouwnr. 10);2024;0;"Met groot genoegen  presenteren  wij de  nieuwe woonwijk  ""Nollepolder"" in Melissant. Een  uniek  project met maar liefst 49 woningen (12  bouwkavels,  26 koopwoningen en  11 huurwoningen). Gelegen aan  de groene  buitenrand  van  Melissant.  Nollepolder vormt een mix van grotere en kleinere eengezinswoningen en levensloopbestendige woningen. Stuk voor stuk woningen met een uitstekende prijs-kwaliteitsverhouding. Natuurlijk is er veel aandacht voor duurzaamheid en energiezuinigheid.   Deze prachtige eengezinswoningen met vrijstaande berging zijn ideaal voor starters, jonge gezinnen of iedereen die op zoek is naar wooncomfort. Deze woningen zijn energiezuinig, voldoen aan de BENG-eisen en bieden een uitstekende prijs-kwaliteitsverhouding. Met een tijdloze uitstraling en moderne voorzieningen zijn deze woningen perfect voor een stijlvol en comfortabel leven.  * Genoemde prijzen zijn Vrij Op Naam dat wil zeggen inclusief 21% B.T.W. Inclusief grond-, notaris- makelaars-, en adviseurskosten, echter exclusief financieringskosten. Aan de getoonde beelden kunnen geen rechten worden ontleend.";https://cloud.funda.nl/valentina_media/188/342/599_1440x960.jpg 1440w, https://cloud.funda.nl/valentina_media/188/342/599_180x120.jpg 180w, https://cloud.funda.nl/valentina_media/188/342/599_360x240.jpg 360w, https://cloud.funda.nl/valentina_media/188/342/599_720x480.jpg 720w, https://cloud.funda.nl/valentina_media/188/342/599_1080x720.jpg 1080w, https://cloud.funda.nl/valentina_media/188/342/599_2160x1440.jpg 2160w, https://cloud.funda.nl/valentina_media/188/342/600_1440x960.jpg 1440w, https://cloud.funda.nl/valentina_media/188/342/600_180x120.jpg 180w, https://cloud.funda.nl/valentina_media/188/342/600_360x240.jpg 360w, https://cloud.funda.nl/valentina_media/188/342/600_720x480.jpg 720w, https://cloud.funda.nl/valentina_media/188/342/600_1080x720.jpg 1080w, https://cloud.funda.nl/valentina_media/188/342/600_2160x1440.jpg 2160w, https://cloud.funda.nl/valentina_media/188/342/601_1440x960.jpg 1440w, https://cloud.funda.nl/valentina_media/188/342/601_180x120.jpg 180w, https://cloud.funda.nl/valentina_media/188/342/601_360x240.jpg 360w, https://cloud.funda.nl/valentina_media/188/342/601_720x480.jpg 720w, https://cloud.funda.nl/valentina_media/188/342/601_1080x720.jpg 1080w, https://cloud.funda.nl/valentina_media/188/342/601_2160x1440.jpg 2160w, https://cloud.funda.nl/valentina_media/188/342/603_1440x960.jpg 1440w, https://cloud.funda.nl/valentina_media/188/342/603_180x120.jpg 180w, https://cloud.funda.nl/valentina_media/188/342/603_360x240.jpg 360w, https://cloud.funda.nl/valentina_media/188/342/603_720x480.jpg 720w, https://cloud.funda.nl/valentina_media/188/342/603_1080x720.jpg 1080w, https://cloud.funda.nl/valentina_media/188/342/603_2160x1440.jpg 2160w, https://cloud.funda.nl/valentina_media/188/342/602_1440x960.jpg 1440w, https://cloud.funda.nl/valentina_media/188/342/602_180x120.jpg 180w, https://cloud.funda.nl/valentina_media/188/342/602_360x240.jpg 360w, https://cloud.funda.nl/valentina_media/188/342/602_720x480.jpg 720w, https://cloud.funda.nl/valentina_media/188/342/602_1080x720.jpg 1080w, https://cloud.funda.nl/valentina_media/188/342/602_2160x1440.jpg 2160w;1566;884.0
https://www.funda.nl/koop/melissant/huis-43557888-levensloopbestendige-woning-0-ong/;43557888;melissant;huis;Nieuwbouw;350000;3301.9;3;2;0;106;>A+;3248;Levensloopbestendige woning (Bouwnr. 7);2024;0;Voor wie op  zoek  is naar  een hoekwoning  die meegroeit met de  veranderende  levensfasen, is deze optie  ideaal.  Deze  woning is  speciaal ontworpen met  een bad-  en slaapkamer  op  de  begane  grond, waardoor ze helemaal van deze tijd en compleet levensloopbestendig zijn. Met alle belangrijke voorzieningen gelijkvloers bieden deze woningen gemak en toegankelijkheid voor iedereen.  De woning heeft een ruime verdieping waar nog twee slaapkamers gecreëerd kunnen worden.  Voor nadere informatie omtrent de kavels in project Nollepolder kunt u contact met ons opnemen via 0187-684868 of   * Genoemde prijzen zijn Vrij Op Naam dat wil zeggen inclusief 21% B.T.W. Inclusief grond-, notaris- makelaars-, en adviseurskosten, echter exclusief financieringskosten. Aan de getoonde beelden kunnen geen rechten worden ontleend.;https://cloud.funda.nl/valentina_media/189/045/865_1440x960.jpg 1440w, https://cloud.funda.nl/valentina_media/189/045/865_180x120.jpg 180w, https://cloud.funda.nl/valentina_media/189/045/865_360x240.jpg 360w, https://cloud.funda.nl/valentina_media/189/045/865_720x480.jpg 720w, https://cloud.funda.nl/valentina_media/189/045/865_1080x720.jpg 1080w, https://cloud.funda.nl/valentina_media/189/045/865_2160x1440.jpg 2160w, https://cloud.funda.nl/valentina_media/189/045/871_1440x960.jpg 1440w, https://cloud.funda.nl/valentina_media/189/045/871_180x120.jpg 180w, https://cloud.funda.nl/valentina_media/189/045/871_360x240.jpg 360w, https://cloud.funda.nl/valentina_media/189/045/871_720x480.jpg 720w, https://cloud.funda.nl/valentina_media/189/045/871_1080x720.jpg 1080w, https://cloud.funda.nl/valentina_media/189/045/871_2160x1440.jpg 2160w;1245;1028.0
