url;house_id;city;house_type;building_type;price;price_m2;room;bedroom;bathroom;living_area;energy_label;zip;address;year_built;house_age;descrip;photo;m3_gasverbruik_per_jaar;kwh_stroomvebruik_per_jaar
https://www.funda.nl/huur/den-burg/huis-43411469-marsweg-0-ong/;43411469;den-burg;huis;Nieuwbouw;1150;14.7;3;2;1;78;>A+;1791;Marsweg;2024;0;"BINNENKORT (medio april)  START  VERHUUR!  De woningen  zijn bestemd voor mensen  die  maatschappelijk en/of economisch verbonden  zijn  aan  Texel. Van  gezinnen tot singles,  van starters  tot senioren.  Voldoe  jij  hieraan  en wil jij hier wonen? Lees dan snel verder....    Texelwende Rabo SmartBuilds start met de bouw van middenhuurwoningen op Texel. De locatie waar deze woningen worden gerealiseerd is aan de Marsweg, direct naast Buurtskap de Tuunen, aan de nieuwe straat Kolibrievlinder in Den Burg. Het project wordt gefaseerd opgeleverd; prognose is dat in de loop van het 2e/ begin 3e kwartaal de woningen worden opgeleverd.  Rabo SmartBuilds  Rabobank wil met de start-up Rabo SmartBuilds in tien jaar tijd 12.000 modulaire middenhuurwoningen in heel Nederland bouwen. De woningen die Rabo SmartBuilds wil plaatsen, zijn innovatief, duurzaam én verplaatsbaar. Hiermee biedt Rabo SmartBuilds een oplossing voor de dringende woningbehoefte in ons land.  Rabo SmartBuilds: woningtekort duurzaam terugdringen  Nederland zit in een wooncrisis. We hebben te maken met hoge huizenprijzen, weinig aanbod, geen doorstroming op de woningmarkt en soms slechte woonomstandigheden. Slechts 8% van de huidige Nederlandse woningvoorraad is vrije huursector, de rest is koop en sociale huur. Dit is een klein percentage voor de relatief grote groep mensen die gebruik wil maken van woningen in de vrije sector.  Wat voor soort woningen zijn Rabo SmartBuilds?  Rabo SmartBuilds zijn modulaire woningen in verschillende soorten en maten. Dit zijn zowel appartementen als grondgebonden woningen. Het zijn volwaardige woningen en in veel opzichten vergelijkbaar met reguliere woningen. Het grootste verschil is dat ze voor een groot deel in de fabriek worden gemaakt en dus snel op locatie gemonteerd kunnen worden. Dankzij deze modulaire bouw zijn de woningen op termijn ook weer relatief eenvoudig te verplaatsen.  Het zijn woningen die een gegarandeerde levensduur van tenminste 50 jaar hebben, maar makkelijk voor een eeuwigheid mee kunnen gaan.  De woningen worden conform de BENG-normen en het permanente bouwbesluit geproduceerd. Rabo SmartBuilds streeft naar toepassing van 100% recyclebare materialen.  Kenmerken van de woningen op Texel  - Een mix van tweelaagse woningen en bungalows. - Een woonoppervlakte tussen de 62 en 78 vierkante meter. - Drie en vier kamer woningen. - Voldoen aan de eisen van het bouwbesluit voor permanente woningen. - Bijna energieneutraal (BENG): dus erg duurzaam en energiezuinig (Label A+++). - Grondgebonden middenhuurwoningen. - Maandhuren tussen de € 880 euro en € 1.150,- euro per maand. - Alleen beschikbaar voor kandidaten met maatschappelijke beroepen en economische- en sociale binding met Texel. - Huurvoorwaarden van toepassing; er geldt een minimaal- en maximaal inkomen. - Geen kortlopende flexibele huurcontracten.  Kenmerken type Comforthof  - Circa 78 m² woonoppervlakte - 3 kamer woning (bungalow) - Buitenruimte (terras) van circa 10 m² - Keuken in rechte opstelling voorzien van o.a. inductiekookplaat, combioven, afzuigkap, koelkast met vriesvak en vaatwasmachine - Badkamer met (inloop)douche en 2e toilet - Separaat vrij hangend toilet - Inpandige berging met wasmachineaansluiting  Geïnteresseerd? Schrijf u in voor dit project via de projectwebsite en wij houden u op de hoogte van alle ontwikkelingen.  Let op: inschrijving voor dit project houdt in dat u uw interesse kenbaar maakt. Het is geen formele inschrijving om in aanmerking te komen voor een woning. Hoewel de inhoud van deze aanmelding met de grootst mogelijke zorgvuldigheid is samengesteld kunnen hieraan geen rechten worden ontleend. Wij verwijzen u voor de meest actuele ontwikkelingen naar de projectwebsite. Oplevering geprognotiseerd vanaf zomer 2024.";https://cloud.funda.nl/valentina_media/188/831/777_1440x960.jpg 1440w, https://cloud.funda.nl/valentina_media/188/831/777_180x120.jpg 180w, https://cloud.funda.nl/valentina_media/188/831/777_360x240.jpg 360w, https://cloud.funda.nl/valentina_media/188/831/777_720x480.jpg 720w, https://cloud.funda.nl/valentina_media/188/831/777_1080x720.jpg 1080w, https://cloud.funda.nl/valentina_media/188/831/777_2160x1440.jpg 2160w, https://cloud.funda.nl/valentina_media/188/831/778_1440x960.jpg 1440w, https://cloud.funda.nl/valentina_media/188/831/778_180x120.jpg 180w, https://cloud.funda.nl/valentina_media/188/831/778_360x240.jpg 360w, https://cloud.funda.nl/valentina_media/188/831/778_720x480.jpg 720w, https://cloud.funda.nl/valentina_media/188/831/778_1080x720.jpg 1080w, https://cloud.funda.nl/valentina_media/188/831/778_2160x1440.jpg 2160w, https://cloud.funda.nl/valentina_media/188/831/779_1440x960.jpg 1440w, https://cloud.funda.nl/valentina_media/188/831/779_180x120.jpg 180w, https://cloud.funda.nl/valentina_media/188/831/779_360x240.jpg 360w, https://cloud.funda.nl/valentina_media/188/831/779_720x480.jpg 720w, https://cloud.funda.nl/valentina_media/188/831/779_1080x720.jpg 1080w, https://cloud.funda.nl/valentina_media/188/831/779_2160x1440.jpg 2160w, https://cloud.funda.nl/valentina_media/188/831/782_1440x960.jpg 1440w, https://cloud.funda.nl/valentina_media/188/831/782_180x120.jpg 180w, https://cloud.funda.nl/valentina_media/188/831/782_360x240.jpg 360w, https://cloud.funda.nl/valentina_media/188/831/782_720x480.jpg 720w, https://cloud.funda.nl/valentina_media/188/831/782_1080x720.jpg 1080w, https://cloud.funda.nl/valentina_media/188/831/782_2160x1440.jpg 2160w;1147;1404
https://www.funda.nl/huur/den-burg/appartement-43489242-groeneplaats-2-b/;43489242;den-burg;appartement;Bestaande bouw;1500;19.7;3;2;1;76;A;1791;Groeneplaats 2 b;2020;4;"TE HUUR Centraal  gelegen  appartement in  Den Burg!   Laat je verrassen  door  dit prachtige appartement dat in  2020 werd  gebouwd  en nu te  huur  staat.  Gelegen  aan  de bruisende Groeneplaats, bevindt  deze woning zich op een steenworp afstand van winkels, gezellige cafés, heerlijke restaurants en alle andere voorzieningen die het centrum te bieden heeft. Ook is het appartement voorzien van een eigen privé berging voor het opstallen van onder andere een fiets. En om de kosten te drukken liggen er ook nog 6 zonnepanelen op het dak.  Bij binnenkomst in dit keurige appartement tref je direct aan je linkerhand de meterkast en vervolgens de badkamer. Welke is uitgevoerd met douche, wastafel en toilet. Aan het einde van de gang tref je de eerste slaapkamer. Vanuit de hal stap je de woonkamer binnen waar een dakkapel is geplaatst waardoor je hier fijn daglicht heb. De open keuken is in een rechte opstelling geplaatst en voorzien van kookplaat, afzuigkap, oven, vaatwasser en koel-vriescombinatie. Via een schuifpui kom je op het heerlijke balkon, een privéplekje waar je kunt ontspannen met een fijn uitzicht op het centrum. De leefruimte biedt toegang tot een tweede slaapkamer, en vanuit de keuken stap je zo de handige wasruimte binnen.   Bijzonderheden: - Beschikbaar in overleg indicatie april; - Uw bruto maandinkomen dient minimaal € 4500 te zijn om voor dit appartement in aanmerking te komen; - Servicekosten € 50,- per maand;  - Roken en huisdieren niet toegestaan; - Gasloos wonen; - Gemeubileerd; - Exclusief water en elektra - Permante bewoning, minimale periode 1 jaar; - Waarborgsom bedraagt 2 maanden huur.  Ben je geïnteresseerd in het huren van dit keurige appartement? Neem dan snel contact op met Kuin Makelaardij voor meer informatie.";https://cloud.funda.nl/valentina_media/186/269/725_1440x960.jpg 1440w, https://cloud.funda.nl/valentina_media/186/269/725_180x120.jpg 180w, https://cloud.funda.nl/valentina_media/186/269/725_360x240.jpg 360w, https://cloud.funda.nl/valentina_media/186/269/725_720x480.jpg 720w, https://cloud.funda.nl/valentina_media/186/269/725_1080x720.jpg 1080w, https://cloud.funda.nl/valentina_media/186/269/725_2160x1440.jpg 2160w, https://cloud.funda.nl/valentina_media/186/269/723_1440x960.jpg 1440w, https://cloud.funda.nl/valentina_media/186/269/723_180x120.jpg 180w, https://cloud.funda.nl/valentina_media/186/269/723_360x240.jpg 360w, https://cloud.funda.nl/valentina_media/186/269/723_720x480.jpg 720w, https://cloud.funda.nl/valentina_media/186/269/723_1080x720.jpg 1080w, https://cloud.funda.nl/valentina_media/186/269/723_2160x1440.jpg 2160w, https://cloud.funda.nl/valentina_media/186/269/724_1440x960.jpg 1440w, https://cloud.funda.nl/valentina_media/186/269/724_180x120.jpg 180w, https://cloud.funda.nl/valentina_media/186/269/724_360x240.jpg 360w, https://cloud.funda.nl/valentina_media/186/269/724_720x480.jpg 720w, https://cloud.funda.nl/valentina_media/186/269/724_1080x720.jpg 1080w, https://cloud.funda.nl/valentina_media/186/269/724_2160x1440.jpg 2160w, https://cloud.funda.nl/valentina_media/186/269/726_1440x960.jpg 1440w, https://cloud.funda.nl/valentina_media/186/269/726_180x120.jpg 180w, https://cloud.funda.nl/valentina_media/186/269/726_360x240.jpg 360w, https://cloud.funda.nl/valentina_media/186/269/726_720x480.jpg 720w, https://cloud.funda.nl/valentina_media/186/269/726_1080x720.jpg 1080w, https://cloud.funda.nl/valentina_media/186/269/726_2160x1440.jpg 2160w, https://cloud.funda.nl/valentina_media/186/269/727_1440x960.jpg 1440w, https://cloud.funda.nl/valentina_media/186/269/727_180x120.jpg 180w, https://cloud.funda.nl/valentina_media/186/269/727_360x240.jpg 360w, https://cloud.funda.nl/valentina_media/186/269/727_720x480.jpg 720w, https://cloud.funda.nl/valentina_media/186/269/727_1080x720.jpg 1080w, https://cloud.funda.nl/valentina_media/186/269/727_2160x1440.jpg 2160w, https://cloud.funda.nl/valentina_media/186/269/730_1440x960.jpg 1440w, https://cloud.funda.nl/valentina_media/186/269/730_180x120.jpg 180w, https://cloud.funda.nl/valentina_media/186/269/730_360x240.jpg 360w, https://cloud.funda.nl/valentina_media/186/269/730_720x480.jpg 720w, https://cloud.funda.nl/valentina_media/186/269/730_1080x720.jpg 1080w, https://cloud.funda.nl/valentina_media/186/269/730_2160x1440.jpg 2160w, https://cloud.funda.nl/valentina_media/186/269/732_1440x960.jpg 1440w, https://cloud.funda.nl/valentina_media/186/269/732_180x120.jpg 180w, https://cloud.funda.nl/valentina_media/186/269/732_360x240.jpg 360w, https://cloud.funda.nl/valentina_media/186/269/732_720x480.jpg 720w, https://cloud.funda.nl/valentina_media/186/269/732_1080x720.jpg 1080w, https://cloud.funda.nl/valentina_media/186/269/732_2160x1440.jpg 2160w, https://cloud.funda.nl/valentina_media/186/269/728_1440x960.jpg 1440w, https://cloud.funda.nl/valentina_media/186/269/728_180x120.jpg 180w, https://cloud.funda.nl/valentina_media/186/269/728_360x240.jpg 360w, https://cloud.funda.nl/valentina_media/186/269/728_720x480.jpg 720w, https://cloud.funda.nl/valentina_media/186/269/728_1080x720.jpg 1080w, https://cloud.funda.nl/valentina_media/186/269/728_2160x1440.jpg 2160w, https://cloud.funda.nl/valentina_media/186/269/729_1440x960.jpg 1440w, https://cloud.funda.nl/valentina_media/186/269/729_180x120.jpg 180w, https://cloud.funda.nl/valentina_media/186/269/729_360x240.jpg 360w, https://cloud.funda.nl/valentina_media/186/269/729_720x480.jpg 720w, https://cloud.funda.nl/valentina_media/186/269/729_1080x720.jpg 1080w, https://cloud.funda.nl/valentina_media/186/269/729_2160x1440.jpg 2160w, https://cloud.funda.nl/valentina_media/186/269/733_1440x960.jpg 1440w, https://cloud.funda.nl/valentina_media/186/269/733_180x120.jpg 180w, https://cloud.funda.nl/valentina_media/186/269/733_360x240.jpg 360w, https://cloud.funda.nl/valentina_media/186/269/733_720x480.jpg 720w, https://cloud.funda.nl/valentina_media/186/269/733_1080x720.jpg 1080w, https://cloud.funda.nl/valentina_media/186/269/733_2160x1440.jpg 2160w, https://cloud.funda.nl/valentina_media/186/269/731_1440x960.jpg 1440w, https://cloud.funda.nl/valentina_media/186/269/731_180x120.jpg 180w, https://cloud.funda.nl/valentina_media/186/269/731_360x240.jpg 360w, https://cloud.funda.nl/valentina_media/186/269/731_720x480.jpg 720w, https://cloud.funda.nl/valentina_media/186/269/731_1080x720.jpg 1080w, https://cloud.funda.nl/valentina_media/186/269/731_2160x1440.jpg 2160w, https://cloud.funda.nl/valentina_media/186/269/734_1440x960.jpg 1440w, https://cloud.funda.nl/valentina_media/186/269/734_180x120.jpg 180w, https://cloud.funda.nl/valentina_media/186/269/734_360x240.jpg 360w, https://cloud.funda.nl/valentina_media/186/269/734_720x480.jpg 720w, https://cloud.funda.nl/valentina_media/186/269/734_1080x720.jpg 1080w, https://cloud.funda.nl/valentina_media/186/269/734_2160x1440.jpg 2160w, https://cloud.funda.nl/valentina_media/186/269/735_1440x960.jpg 1440w, https://cloud.funda.nl/valentina_media/186/269/735_180x120.jpg 180w, https://cloud.funda.nl/valentina_media/186/269/735_360x240.jpg 360w, https://cloud.funda.nl/valentina_media/186/269/735_720x480.jpg 720w, https://cloud.funda.nl/valentina_media/186/269/735_1080x720.jpg 1080w, https://cloud.funda.nl/valentina_media/186/269/735_2160x1440.jpg 2160w;956;9576
https://www.funda.nl/huur/den-burg/huis-43411462-marsweg-0-ong/;43411462;den-burg;huis;Nieuwbouw;950;15.3;3;2;1;62;>A+;1791;Marsweg;2024;0;"BINNENKORT (medio april)  START  VERHUUR!  De woningen  zijn bestemd voor mensen  die  maatschappelijk en/of economisch verbonden zijn  aan Texel.  Van  gezinnen tot singles,  van  starters  tot  senioren.  Voldoe jij hieraan en  wil jij hier wonen? Lees dan snel verder....    Texelwende Rabo SmartBuilds start met de bouw van 70 middenhuurwoningen op Texel. De locatie waar deze woningen worden gerealiseerd is aan de Marsweg, direct naast Buurtskap de Tuunen, aan de nieuwe straat Kolibrievlinder in Den Burg. Het project wordt gefaseerd opgeleverd; prognose is dat in de loop van het 2e/ begin 3e kwartaal de eerste woningen worden opgeleverd.   Rabo SmartBuilds  Rabobank wil met de start-up Rabo SmartBuilds in tien jaar tijd 12.000 modulaire middenhuurwoningen in heel Nederland bouwen. De woningen die Rabo SmartBuilds wil plaatsen, zijn innovatief, duurzaam én verplaatsbaar. Hiermee biedt Rabo SmartBuilds een oplossing voor de dringende woningbehoefte in ons land.  Rabo SmartBuilds: woningtekort duurzaam terugdringen  Nederland zit in een wooncrisis. We hebben te maken met hoge huizenprijzen, weinig aanbod, geen doorstroming op de woningmarkt en soms slechte woonomstandigheden. Slechts 8% van de huidige Nederlandse woningvoorraad is vrije huursector, de rest is koop en sociale huur. Dit is een klein percentage voor de relatief grote groep mensen die gebruik wil maken van woningen in de vrije sector.  Wat voor soort woningen zijn Rabo SmartBuilds?  Rabo SmartBuilds zijn modulaire woningen in verschillende soorten en maten. Dit zijn zowel appartementen als grondgebonden woningen. Het zijn volwaardige woningen en in veel opzichten vergelijkbaar met reguliere woningen. Het grootste verschil is dat ze voor een groot deel in de fabriek worden gemaakt en dus snel op locatie gemonteerd kunnen worden. Dankzij deze modulaire bouw zijn de woningen op termijn ook weer relatief eenvoudig te verplaatsen.  Het zijn woningen die een gegarandeerde levensduur van tenminste 50 jaar hebben, maar makkelijk voor een eeuwigheid mee kunnen gaan.  De woningen worden conform de BENG-normen en het permanente bouwbesluit geproduceerd. Rabo SmartBuilds streeft naar toepassing van 100% recyclebare materialen.  Kenmerken van de woningen op Texel  - Een mix van tweelaagse woningen (60 woningen) en gelijkvloerse bungalows (10 woningen). - Een woonoppervlakte tussen de 62 en 78 vierkante meter. - Drie- en vier kamer woningen. - Voldoen aan de eisen van het bouwbesluit voor permanente woningen. - Bijna energieneutraal (BENG): dus erg duurzaam en energiezuinig (Label A+++). - Grondgebonden middenhuurwoningen. - Maandhuren tussen de € 880 euro en € 1.150,- euro per maand. - Alleen beschikbaar voor kandidaten met maatschappelijke beroepen en economische- en sociale binding met Texel. - Huurvoorwaarden van toepassing; er geldt een minimaal- en maximaal inkomen.  - Geen kortlopende flexibele huurcontracten.  Kenmerken type Compacthuis:  - Circa 62 m² woonoppervlakte - 3 kamer woning verdeeld over 2 woonlagen - Buitenruimte (terras) van circa 9 m² - Keuken in rechte opstelling voorzien van o.a. inductiekookplaat, combioven, afzuigkap, koelkast met vriesvak en vaatwasmachine - Badkamer met (inloop)douche - Separaat vrij hangend toilet - Inpandige berging met wasmachineaansluiting  Geïnteresseerd? Schrijf u in voor dit project via de projectwebsite en wij houden u op de hoogte van alle ontwikkelingen.  Let op: inschrijving voor dit project houdt in dat u uw interesse kenbaar maakt. Het is geen formele inschrijving om in aanmerking te komen voor een woning. Hoewel de inhoud van deze aanmelding met de grootst mogelijke zorgvuldigheid is samengesteld kunnen hieraan geen rechten worden ontleend. Wij verwijzen u voor de meest actuele ontwikkelingen naar de projectwebsite. Oplevering geprognotiseerd vanaf zomer 2024.";https://cloud.funda.nl/valentina_media/188/831/791_1440x960.jpg 1440w, https://cloud.funda.nl/valentina_media/188/831/791_180x120.jpg 180w, https://cloud.funda.nl/valentina_media/188/831/791_360x240.jpg 360w, https://cloud.funda.nl/valentina_media/188/831/791_720x480.jpg 720w, https://cloud.funda.nl/valentina_media/188/831/791_1080x720.jpg 1080w, https://cloud.funda.nl/valentina_media/188/831/791_2160x1440.jpg 2160w, https://cloud.funda.nl/valentina_media/188/831/795_1440x960.jpg 1440w, https://cloud.funda.nl/valentina_media/188/831/795_180x120.jpg 180w, https://cloud.funda.nl/valentina_media/188/831/795_360x240.jpg 360w, https://cloud.funda.nl/valentina_media/188/831/795_720x480.jpg 720w, https://cloud.funda.nl/valentina_media/188/831/795_1080x720.jpg 1080w, https://cloud.funda.nl/valentina_media/188/831/795_2160x1440.jpg 2160w, https://cloud.funda.nl/valentina_media/188/831/809_1440x960.jpg 1440w, https://cloud.funda.nl/valentina_media/188/831/809_180x120.jpg 180w, https://cloud.funda.nl/valentina_media/188/831/809_360x240.jpg 360w, https://cloud.funda.nl/valentina_media/188/831/809_720x480.jpg 720w, https://cloud.funda.nl/valentina_media/188/831/809_1080x720.jpg 1080w, https://cloud.funda.nl/valentina_media/188/831/809_2160x1440.jpg 2160w, https://cloud.funda.nl/valentina_media/188/831/815_1440x960.jpg 1440w, https://cloud.funda.nl/valentina_media/188/831/815_180x120.jpg 180w, https://cloud.funda.nl/valentina_media/188/831/815_360x240.jpg 360w, https://cloud.funda.nl/valentina_media/188/831/815_720x480.jpg 720w, https://cloud.funda.nl/valentina_media/188/831/815_1080x720.jpg 1080w, https://cloud.funda.nl/valentina_media/188/831/815_2160x1440.jpg 2160w;771;1364
https://www.funda.nl/huur/den-burg/huis-43410350-marsweg-0-ong/;43410350;den-burg;huis;Nieuwbouw;1150;14.7;4;3;1;78;>A+;1791;Marsweg;2024;0;"BINNENKORT (medio april)  START  VERHUUR!  De woningen  zijn bestemd voor mensen  die  maatschappelijk en/of economisch verbonden  zijn  aan  Texel. Van  gezinnen tot singles,  van starters  tot senioren.  Voldoe  jij  hieraan  en wil jij hier wonen? Lees dan snel verder....    Texelwende Rabo SmartBuilds start met de bouw van 70 middenhuurwoningen op Texel. De locatie waar deze woningen worden gerealiseerd is aan de Marsweg, direct naast Buurtskap de Tuunen, aan de nieuwe straat Kolibrievlinder in Den Burg. Het project wordt gefaseerd opgeleverd; prognose is dat in de loop van het 2e/ begin 3e kwartaal de eerste woningen worden opgeleverd.   Rabo SmartBuilds  Rabobank wil met de start-up Rabo SmartBuilds in tien jaar tijd 12.000 modulaire middenhuurwoningen in heel Nederland bouwen. De woningen die Rabo SmartBuilds wil plaatsen, zijn innovatief, duurzaam én verplaatsbaar. Hiermee biedt Rabo SmartBuilds een oplossing voor de dringende woningbehoefte in ons land.  Rabo SmartBuilds: woningtekort duurzaam terugdringen  Nederland zit in een wooncrisis. We hebben te maken met hoge huizenprijzen, weinig aanbod, geen doorstroming op de woningmarkt en soms slechte woonomstandigheden. Slechts 8% van de huidige Nederlandse woningvoorraad is vrije huursector, de rest is koop en sociale huur. Dit is een klein percentage voor de relatief grote groep mensen die gebruik wil maken van woningen in de vrije sector.  Wat voor soort woningen zijn Rabo SmartBuilds?  Rabo SmartBuilds zijn modulaire woningen in verschillende soorten en maten. Dit zijn zowel appartementen als grondgebonden woningen. Het zijn volwaardige woningen en in veel opzichten vergelijkbaar met reguliere woningen. Het grootste verschil is dat ze voor een groot deel in de fabriek worden gemaakt en dus snel op locatie gemonteerd kunnen worden. Dankzij deze modulaire bouw zijn de woningen op termijn ook weer relatief eenvoudig te verplaatsen.  Het zijn woningen die een gegarandeerde levensduur van tenminste 50 jaar hebben, maar makkelijk voor een eeuwigheid mee kunnen gaan.  De woningen worden conform de BENG-normen en het permanente bouwbesluit geproduceerd. Rabo SmartBuilds streeft naar toepassing van 100% recyclebare materialen.  Kenmerken van de woningen op Texel  - Een mix van tweelaagse woningen (60 woningen) en gelijkvloerse bungalows (10 woningen). - Een woonoppervlakte tussen de 62 en 78 vierkante meter. - Drie- en vier kamer woningen. - Voldoen aan de eisen van het bouwbesluit voor permanente woningen. - Bijna energieneutraal (BENG): dus erg duurzaam en energiezuinig (Label A+++). - Grondgebonden middenhuurwoningen. - Maandhuren tussen de € 880 euro en € 1.150,- euro per maand. - Alleen beschikbaar voor kandidaten met maatschappelijke beroepen en economische- en sociale binding met Texel. - Huurvoorwaarden van toepassing; er geldt een minimaal- en maximaal inkomen.  - Geen kortlopende flexibele huurcontracten.  Kenmerken type Familiehaven:  - Circa 78 m² woonoppervlakte - 4 kamer woning verdeeld over 2 woonlagen - Buitenruimte (terras) van circa 13 m² - Keuken in rechte opstelling voorzien van o.a. inductiekookplaat, combioven, afzuigkap, koelkast met vriesvak en vaatwasmachine - Badkamer met (inloop)douche en 2e toilet - Separaat vrij hangend toilet - Inpandige berging met wasmachineaansluiting  Geïnteresseerd? Schrijf u in voor dit project via de projectwebsite en wij houden u op de hoogte van alle ontwikkelingen.  Let op: inschrijving voor dit project houdt in dat u uw interesse kenbaar maakt. Het is geen formele inschrijving om in aanmerking te komen voor een woning. Hoewel de inhoud van deze aanmelding met de grootst mogelijke zorgvuldigheid is samengesteld kunnen hieraan geen rechten worden ontleend. Wij verwijzen u voor de meest actuele ontwikkelingen naar de projectwebsite. Oplevering geprognotiseerd vanaf zomer 2024.";https://cloud.funda.nl/valentina_media/188/831/825_1440x960.jpg 1440w, https://cloud.funda.nl/valentina_media/188/831/825_180x120.jpg 180w, https://cloud.funda.nl/valentina_media/188/831/825_360x240.jpg 360w, https://cloud.funda.nl/valentina_media/188/831/825_720x480.jpg 720w, https://cloud.funda.nl/valentina_media/188/831/825_1080x720.jpg 1080w, https://cloud.funda.nl/valentina_media/188/831/825_2160x1440.jpg 2160w, https://cloud.funda.nl/valentina_media/188/831/831_1440x960.jpg 1440w, https://cloud.funda.nl/valentina_media/188/831/831_180x120.jpg 180w, https://cloud.funda.nl/valentina_media/188/831/831_360x240.jpg 360w, https://cloud.funda.nl/valentina_media/188/831/831_720x480.jpg 720w, https://cloud.funda.nl/valentina_media/188/831/831_1080x720.jpg 1080w, https://cloud.funda.nl/valentina_media/188/831/831_2160x1440.jpg 2160w, https://cloud.funda.nl/valentina_media/188/831/845_1440x960.jpg 1440w, https://cloud.funda.nl/valentina_media/188/831/845_180x120.jpg 180w, https://cloud.funda.nl/valentina_media/188/831/845_360x240.jpg 360w, https://cloud.funda.nl/valentina_media/188/831/845_720x480.jpg 720w, https://cloud.funda.nl/valentina_media/188/831/845_1080x720.jpg 1080w, https://cloud.funda.nl/valentina_media/188/831/845_2160x1440.jpg 2160w, https://cloud.funda.nl/valentina_media/188/831/865_1440x960.jpg 1440w, https://cloud.funda.nl/valentina_media/188/831/865_180x120.jpg 180w, https://cloud.funda.nl/valentina_media/188/831/865_360x240.jpg 360w, https://cloud.funda.nl/valentina_media/188/831/865_720x480.jpg 720w, https://cloud.funda.nl/valentina_media/188/831/865_1080x720.jpg 1080w, https://cloud.funda.nl/valentina_media/188/831/865_2160x1440.jpg 2160w;1275;2418
