url;house_id;city;house_type;building_type;price;price_m2;room;bedroom;bathroom;living_area;energy_label;zip;address;year_built;house_age;descrip;photo;m3_gasverbruik_per_jaar;kwh_stroomvebruik_per_jaar
https://www.funda.nl/huur/enschede/appartement-42361465-de-veldmaat-10-844/;42361465;enschede;appartement;Bestaande bouw;635;30.2;1;0;0;21;C;7522;De Veldmaat 10 844;1971;53;STUDENTENWONING - BESCHIKBAAR  PER  24 OKTOBER  2023  Ben jij op zoek  naar  een gemeubileerde studio op loofafstand  van  de je  faculteit? Wij hebben  per  direct studio’s beschikbaar in  het hoofdgebouw  ‘De Schijf’ aan de Veldmaat 10 in Enschede. Gelegen in een rustige omgeving, maar wel op loopafstand van openbaar vervoer. De studio is alleen beschikbaar voor studenten. De studio’s zijn erg in trek, dus wees er snel bij! Het betreft een tijdelijk contract er zijn appartementen met een contract tot en met 31/08 en appartementen met een contract max 2 jaar.  Hoe ziet de studio eruit? • Volledige gemeubileerd en gestoffeerd studio inclusief bed en kledingkast • Eigen badkamer en toilet • Eigen keuken voorzien van een elektrische kookplaat met afzuigkap en combimagnetron • Ingebouwde bureau / studiehoek • Studio is voorzien van gordijnen en hoge kwaliteit laminaatvloer  Welke voorzieningen zijn er? • Supersnelle WIFI in het hele gebouw • Fietsenstalling • Parkeerplaatsen voor het gebouw • Gedeelde wasruimte met strijkplank en strijkbout • Bioscoopruimte • Dakterras • Studieruimte • Gameruimte • Loungeruimte  Welke voorzieningen in de omgeving zijn er (loopafstand en fietsafstand)? • COOP-supermarkt • Meerdere bushaltes • Meerdere faculteiten • Pinautomaat • Subway restaurant • Starbucks café  Huurkosten: All-in huurprijs € 965,15 Eenmalige kosten € 15,-  Onderhoudscontract € 11,15  Borg € 1.250,-  Zie jij jezelf hier al wonen? Meld je aan en verhuis z.s.m. naar jouw nieuwe stek.;https://cloud.funda.nl/valentina_media/181/410/954_1440x960.jpg 1440w, https://cloud.funda.nl/valentina_media/181/410/954_180x120.jpg 180w, https://cloud.funda.nl/valentina_media/181/410/954_360x240.jpg 360w, https://cloud.funda.nl/valentina_media/181/410/954_720x480.jpg 720w, https://cloud.funda.nl/valentina_media/181/410/954_1080x720.jpg 1080w, https://cloud.funda.nl/valentina_media/181/410/954_2160x1440.jpg 2160w, https://cloud.funda.nl/valentina_media/181/410/947_1440x960.jpg 1440w, https://cloud.funda.nl/valentina_media/181/410/947_180x120.jpg 180w, https://cloud.funda.nl/valentina_media/181/410/947_360x240.jpg 360w, https://cloud.funda.nl/valentina_media/181/410/947_720x480.jpg 720w, https://cloud.funda.nl/valentina_media/181/410/947_1080x720.jpg 1080w, https://cloud.funda.nl/valentina_media/181/410/947_2160x1440.jpg 2160w, https://cloud.funda.nl/valentina_media/181/410/956_1440x960.jpg 1440w, https://cloud.funda.nl/valentina_media/181/410/956_180x120.jpg 180w, https://cloud.funda.nl/valentina_media/181/410/956_360x240.jpg 360w, https://cloud.funda.nl/valentina_media/181/410/956_720x480.jpg 720w, https://cloud.funda.nl/valentina_media/181/410/956_1080x720.jpg 1080w, https://cloud.funda.nl/valentina_media/181/410/956_2160x1440.jpg 2160w, https://cloud.funda.nl/valentina_media/181/410/952_1440x960.jpg 1440w, https://cloud.funda.nl/valentina_media/181/410/952_180x120.jpg 180w, https://cloud.funda.nl/valentina_media/181/410/952_360x240.jpg 360w, https://cloud.funda.nl/valentina_media/181/410/952_720x480.jpg 720w, https://cloud.funda.nl/valentina_media/181/410/952_1080x720.jpg 1080w, https://cloud.funda.nl/valentina_media/181/410/952_2160x1440.jpg 2160w, https://cloud.funda.nl/valentina_media/181/410/950_1440x960.jpg 1440w, https://cloud.funda.nl/valentina_media/181/410/950_180x120.jpg 180w, https://cloud.funda.nl/valentina_media/181/410/950_360x240.jpg 360w, https://cloud.funda.nl/valentina_media/181/410/950_720x480.jpg 720w, https://cloud.funda.nl/valentina_media/181/410/950_1080x720.jpg 1080w, https://cloud.funda.nl/valentina_media/181/410/950_2160x1440.jpg 2160w, https://cloud.funda.nl/valentina_media/181/410/955_1440x960.jpg 1440w, https://cloud.funda.nl/valentina_media/181/410/955_180x120.jpg 180w, https://cloud.funda.nl/valentina_media/181/410/955_360x240.jpg 360w, https://cloud.funda.nl/valentina_media/181/410/955_720x480.jpg 720w, https://cloud.funda.nl/valentina_media/181/410/955_1080x720.jpg 1080w, https://cloud.funda.nl/valentina_media/181/410/955_2160x1440.jpg 2160w, https://cloud.funda.nl/valentina_media/181/410/949_1440x960.jpg 1440w, https://cloud.funda.nl/valentina_media/181/410/949_180x120.jpg 180w, https://cloud.funda.nl/valentina_media/181/410/949_360x240.jpg 360w, https://cloud.funda.nl/valentina_media/181/410/949_720x480.jpg 720w, https://cloud.funda.nl/valentina_media/181/410/949_1080x720.jpg 1080w, https://cloud.funda.nl/valentina_media/181/410/949_2160x1440.jpg 2160w, https://cloud.funda.nl/valentina_media/181/410/948_1440x960.jpg 1440w, https://cloud.funda.nl/valentina_media/181/410/948_180x120.jpg 180w, https://cloud.funda.nl/valentina_media/181/410/948_360x240.jpg 360w, https://cloud.funda.nl/valentina_media/181/410/948_720x480.jpg 720w, https://cloud.funda.nl/valentina_media/181/410/948_1080x720.jpg 1080w, https://cloud.funda.nl/valentina_media/181/410/948_2160x1440.jpg 2160w, https://cloud.funda.nl/valentina_media/181/410/951_1440x960.jpg 1440w, https://cloud.funda.nl/valentina_media/181/410/951_180x120.jpg 180w, https://cloud.funda.nl/valentina_media/181/410/951_360x240.jpg 360w, https://cloud.funda.nl/valentina_media/181/410/951_720x480.jpg 720w, https://cloud.funda.nl/valentina_media/181/410/951_1080x720.jpg 1080w, https://cloud.funda.nl/valentina_media/181/410/951_2160x1440.jpg 2160w, https://cloud.funda.nl/valentina_media/181/410/953_1440x960.jpg 1440w, https://cloud.funda.nl/valentina_media/181/410/953_180x120.jpg 180w, https://cloud.funda.nl/valentina_media/181/410/953_360x240.jpg 360w, https://cloud.funda.nl/valentina_media/181/410/953_720x480.jpg 720w, https://cloud.funda.nl/valentina_media/181/410/953_1080x720.jpg 1080w, https://cloud.funda.nl/valentina_media/181/410/953_2160x1440.jpg 2160w, https://cloud.funda.nl/valentina_media/181/410/964_1440x960.jpg 1440w, https://cloud.funda.nl/valentina_media/181/410/964_180x120.jpg 180w, https://cloud.funda.nl/valentina_media/181/410/964_360x240.jpg 360w, https://cloud.funda.nl/valentina_media/181/410/964_720x480.jpg 720w, https://cloud.funda.nl/valentina_media/181/410/964_1080x720.jpg 1080w, https://cloud.funda.nl/valentina_media/181/410/964_2160x1440.jpg 2160w, https://cloud.funda.nl/valentina_media/181/410/958_1440x960.jpg 1440w, https://cloud.funda.nl/valentina_media/181/410/958_180x120.jpg 180w, https://cloud.funda.nl/valentina_media/181/410/958_360x240.jpg 360w, https://cloud.funda.nl/valentina_media/181/410/958_720x480.jpg 720w, https://cloud.funda.nl/valentina_media/181/410/958_1080x720.jpg 1080w, https://cloud.funda.nl/valentina_media/181/410/958_2160x1440.jpg 2160w, https://cloud.funda.nl/valentina_media/181/410/959_1440x960.jpg 1440w, https://cloud.funda.nl/valentina_media/181/410/959_180x120.jpg 180w, https://cloud.funda.nl/valentina_media/181/410/959_360x240.jpg 360w, https://cloud.funda.nl/valentina_media/181/410/959_720x480.jpg 720w, https://cloud.funda.nl/valentina_media/181/410/959_1080x720.jpg 1080w, https://cloud.funda.nl/valentina_media/181/410/959_2160x1440.jpg 2160w, https://cloud.funda.nl/valentina_media/181/410/967_1440x960.jpg 1440w, https://cloud.funda.nl/valentina_media/181/410/967_180x120.jpg 180w, https://cloud.funda.nl/valentina_media/181/410/967_360x240.jpg 360w, https://cloud.funda.nl/valentina_media/181/410/967_720x480.jpg 720w, https://cloud.funda.nl/valentina_media/181/410/967_1080x720.jpg 1080w, https://cloud.funda.nl/valentina_media/181/410/967_2160x1440.jpg 2160w, https://cloud.funda.nl/valentina_media/181/410/974_1440x960.jpg 1440w, https://cloud.funda.nl/valentina_media/181/410/974_180x120.jpg 180w, https://cloud.funda.nl/valentina_media/181/410/974_360x240.jpg 360w, https://cloud.funda.nl/valentina_media/181/410/974_720x480.jpg 720w, https://cloud.funda.nl/valentina_media/181/410/974_1080x720.jpg 1080w, https://cloud.funda.nl/valentina_media/181/410/974_2160x1440.jpg 2160w, https://cloud.funda.nl/valentina_media/181/410/972_1440x960.jpg 1440w, https://cloud.funda.nl/valentina_media/181/410/972_180x120.jpg 180w, https://cloud.funda.nl/valentina_media/181/410/972_360x240.jpg 360w, https://cloud.funda.nl/valentina_media/181/410/972_720x480.jpg 720w, https://cloud.funda.nl/valentina_media/181/410/972_1080x720.jpg 1080w, https://cloud.funda.nl/valentina_media/181/410/972_2160x1440.jpg 2160w, https://cloud.funda.nl/valentina_media/181/410/983_1440x960.jpg 1440w, https://cloud.funda.nl/valentina_media/181/410/983_180x120.jpg 180w, https://cloud.funda.nl/valentina_media/181/410/983_360x240.jpg 360w, https://cloud.funda.nl/valentina_media/181/410/983_720x480.jpg 720w, https://cloud.funda.nl/valentina_media/181/410/983_1080x720.jpg 1080w, https://cloud.funda.nl/valentina_media/181/410/983_2160x1440.jpg 2160w, https://cloud.funda.nl/valentina_media/181/410/969_1440x960.jpg 1440w, https://cloud.funda.nl/valentina_media/181/410/969_180x120.jpg 180w, https://cloud.funda.nl/valentina_media/181/410/969_360x240.jpg 360w, https://cloud.funda.nl/valentina_media/181/410/969_720x480.jpg 720w, https://cloud.funda.nl/valentina_media/181/410/969_1080x720.jpg 1080w, https://cloud.funda.nl/valentina_media/181/410/969_2160x1440.jpg 2160w;;4704.0
https://www.funda.nl/huur/enschede/appartement-43587250-boddenkampsingel-80-06/;43587250;enschede;appartement;Bestaande bouw;1450;13.7;3;2;1;106;B;7514;Boddenkampsingel 80 06;2019;5;*** niet bestemd  voor  studenten bewoning  of woningdelers  *** not intended for  student  residence or house sharing ***   Wonen  aan  misschien wel de  mooiste  singel van Enschede in  een  karakteristiek  en beeldbepalend schoolgebouw. Dat is wonen in de voormalige Ambachtsschool! Het geheel gerenoveerde schoolgebouw telt 70 unieke stadsappartementen met authentieke elementen als granito vloeren, glas in lood, oude klaslokaaldeuren en hoge plafonds. De ligging tussen de moderne woonwijken Het Roombeek en de Boddenkamp, op korte afstand van het stadscentrum, het Centraal Station, het winkelcentrum Op de Brouwerij (Roombeek) en De Melkhal (Boddenkamp) is ideaal. En daarnaast kun je het fraaie G.J. van Heekpark als je achtertuin beschouwen. Dit alles maakt dit tot een fijne plek om te wonen!  Het 3-kamerappartement is gelegen op de begane grond. Ook behoort een eigen parkeerplaats op het afgesloten binnenterrein en een eigen berging bij het appartement. Momenteel wordt het appartement nog bewoond en om die reden zijn op dit moment alleen enkele sfeerbeelden beschikbaar.   Alle appartementen zijn gasloos en uitgevoerd met vloerverwarming welke is aangesloten op het stadsverwarmingsnetwerk. De Ambachtsschool uit 1922, naar een ontwerp van de Enschedese architect Arend G. Beltman, biedt een uiteenlopende mix van huurappartementen. Aan de beide zijden van het gebouw zijn twee nieuwe liften geplaatst die ervoor zorgen dat, naast de indrukwekkende hoofdentree, twee nieuwe entrees zijn gerealiseerd voor de ontsluiting van het gebouw. Eenmaal in de appartementen ervaar je nog steeds de historische sfeer maar ook direct het comfortabele wooncomfort. Grote raampartijen zorgen voor veel lichtinval en voor een behaaglijk binnenklimaat door het toepassen van isolatieglas. Het hoogwaardige opleveringsniveau van de appartementen wordt onder andere zichtbaar in de keuze voor de afwerking van de keuken en het sanitair. Al met al een unieke woonomgeving!  Indeling o.a.: Via de indrukwekkende entree kom je in de ruime hal welke toegang geeft tot de woonkamer met open keuken voorzien van koelkast, kookplaat, afzuigkap, vaatwasser en combi-magnetron. De keuken geeft tevens toegang tot de bergruimte voorzien van wasmachineaansluiting. Vanuit de hal bereik je tevens  de twee ruime slaapkamers, badkamer voorzien van inloopdouche en wastafel en separaat toilet met fontein.   Bijzonderheden: - Aanvaarding per direct. - De huurprijs is € 1.450,- per maand exclusief servicekosten. - Energielabel B. - De huurprijs is exclusief gas, water, elektra, televisie/internet en gemeentelijke belastingen.  Voorwaarden: - Eenmalige waarborgsom van één maandhuur van toepassing - Huurovereenkomst voor bepaalde tijd met een maximale duur van 24 maanden - Het minimale (bruto) inkomen van de huurder(s) dient € 5.800,- per maand te bedragen.Voor huren met een partner geldt, dat het partnerinkomen voor de helft meetelt. Het inkomen dient uit werk/arbeid te komen, een garantsteller of een huurder die de woning niet zelf zal gaan bewonen is niet toegestaan. - Het appartement is niet bestemd voor studenten bewoning of woningdelers.  Om voor het huren van dit appartement in aanmerking te komen ontvangen wij graag een ingevuld aanvraagformulier dat je na de bezichtiging ontvangt, aangevuld met:  - Veilige kopie van een geldig legitimatiebewijs - Recent opgemaakte werkgeversverklaring - 3 recente loonstroken - Kopie salarisstorting overeenkomend met de loonstroken - Verklaring huidige verhuurder/beheerder, eigenaar of hypotheekhouder - Kopie/screenshot registraties Bureau Krediet Registratie (BKR) - In het geval van een koopwoning een kopie van de eigendomsakte of een getekende koopovereenkomst + afschrift actuele hypotheekschuld  Raadpleeg onze website onder 'Wonen'>'Huis huren' met betrekking tot onze werkwijze en de selectieprocedure.  Deze presentatie is informatief en geheel vrijblijvend. Aan eventuele onjuistheden kunnen geen rechten worden ontleend.;https://cloud.funda.nl/valentina_media/189/922/351_1440x960.jpg 1440w, https://cloud.funda.nl/valentina_media/189/922/351_180x120.jpg 180w, https://cloud.funda.nl/valentina_media/189/922/351_360x240.jpg 360w, https://cloud.funda.nl/valentina_media/189/922/351_720x480.jpg 720w, https://cloud.funda.nl/valentina_media/189/922/351_1080x720.jpg 1080w, https://cloud.funda.nl/valentina_media/189/922/351_2160x1440.jpg 2160w, https://cloud.funda.nl/valentina_media/189/922/355_1440x960.jpg 1440w, https://cloud.funda.nl/valentina_media/189/922/355_180x120.jpg 180w, https://cloud.funda.nl/valentina_media/189/922/355_360x240.jpg 360w, https://cloud.funda.nl/valentina_media/189/922/355_720x480.jpg 720w, https://cloud.funda.nl/valentina_media/189/922/355_1080x720.jpg 1080w, https://cloud.funda.nl/valentina_media/189/922/355_2160x1440.jpg 2160w, https://cloud.funda.nl/valentina_media/189/922/357_1440x960.jpg 1440w, https://cloud.funda.nl/valentina_media/189/922/357_180x120.jpg 180w, https://cloud.funda.nl/valentina_media/189/922/357_360x240.jpg 360w, https://cloud.funda.nl/valentina_media/189/922/357_720x480.jpg 720w, https://cloud.funda.nl/valentina_media/189/922/357_1080x720.jpg 1080w, https://cloud.funda.nl/valentina_media/189/922/357_2160x1440.jpg 2160w, https://cloud.funda.nl/valentina_media/189/922/354_1440x960.jpg 1440w, https://cloud.funda.nl/valentina_media/189/922/354_180x120.jpg 180w, https://cloud.funda.nl/valentina_media/189/922/354_360x240.jpg 360w, https://cloud.funda.nl/valentina_media/189/922/354_720x480.jpg 720w, https://cloud.funda.nl/valentina_media/189/922/354_1080x720.jpg 1080w, https://cloud.funda.nl/valentina_media/189/922/354_2160x1440.jpg 2160w, https://cloud.funda.nl/valentina_media/189/922/361_1440x960.jpg 1440w, https://cloud.funda.nl/valentina_media/189/922/361_180x120.jpg 180w, https://cloud.funda.nl/valentina_media/189/922/361_360x240.jpg 360w, https://cloud.funda.nl/valentina_media/189/922/361_720x480.jpg 720w, https://cloud.funda.nl/valentina_media/189/922/361_1080x720.jpg 1080w, https://cloud.funda.nl/valentina_media/189/922/361_2160x1440.jpg 2160w, https://cloud.funda.nl/valentina_media/189/922/359_1440x960.jpg 1440w, https://cloud.funda.nl/valentina_media/189/922/359_180x120.jpg 180w, https://cloud.funda.nl/valentina_media/189/922/359_360x240.jpg 360w, https://cloud.funda.nl/valentina_media/189/922/359_720x480.jpg 720w, https://cloud.funda.nl/valentina_media/189/922/359_1080x720.jpg 1080w, https://cloud.funda.nl/valentina_media/189/922/359_2160x1440.jpg 2160w, https://cloud.funda.nl/valentina_media/189/922/360_1440x960.jpg 1440w, https://cloud.funda.nl/valentina_media/189/922/360_180x120.jpg 180w, https://cloud.funda.nl/valentina_media/189/922/360_360x240.jpg 360w, https://cloud.funda.nl/valentina_media/189/922/360_720x480.jpg 720w, https://cloud.funda.nl/valentina_media/189/922/360_1080x720.jpg 1080w, https://cloud.funda.nl/valentina_media/189/922/360_2160x1440.jpg 2160w, https://cloud.funda.nl/valentina_media/189/922/363_1440x960.jpg 1440w, https://cloud.funda.nl/valentina_media/189/922/363_180x120.jpg 180w, https://cloud.funda.nl/valentina_media/189/922/363_360x240.jpg 360w, https://cloud.funda.nl/valentina_media/189/922/363_720x480.jpg 720w, https://cloud.funda.nl/valentina_media/189/922/363_1080x720.jpg 1080w, https://cloud.funda.nl/valentina_media/189/922/363_2160x1440.jpg 2160w, https://cloud.funda.nl/valentina_media/189/922/364_1440x960.jpg 1440w, https://cloud.funda.nl/valentina_media/189/922/364_180x120.jpg 180w, https://cloud.funda.nl/valentina_media/189/922/364_360x240.jpg 360w, https://cloud.funda.nl/valentina_media/189/922/364_720x480.jpg 720w, https://cloud.funda.nl/valentina_media/189/922/364_1080x720.jpg 1080w, https://cloud.funda.nl/valentina_media/189/922/364_2160x1440.jpg 2160w, https://cloud.funda.nl/valentina_media/189/922/397_1440x960.jpg 1440w, https://cloud.funda.nl/valentina_media/189/922/397_180x120.jpg 180w, https://cloud.funda.nl/valentina_media/189/922/397_360x240.jpg 360w, https://cloud.funda.nl/valentina_media/189/922/397_720x480.jpg 720w, https://cloud.funda.nl/valentina_media/189/922/397_1080x720.jpg 1080w, https://cloud.funda.nl/valentina_media/189/922/397_2160x1440.jpg 2160w, https://cloud.funda.nl/valentina_media/189/922/396_1440x960.jpg 1440w, https://cloud.funda.nl/valentina_media/189/922/396_180x120.jpg 180w, https://cloud.funda.nl/valentina_media/189/922/396_360x240.jpg 360w, https://cloud.funda.nl/valentina_media/189/922/396_720x480.jpg 720w, https://cloud.funda.nl/valentina_media/189/922/396_1080x720.jpg 1080w, https://cloud.funda.nl/valentina_media/189/922/396_2160x1440.jpg 2160w, https://cloud.funda.nl/valentina_media/189/922/395_1440x960.jpg 1440w, https://cloud.funda.nl/valentina_media/189/922/395_180x120.jpg 180w, https://cloud.funda.nl/valentina_media/189/922/395_360x240.jpg 360w, https://cloud.funda.nl/valentina_media/189/922/395_720x480.jpg 720w, https://cloud.funda.nl/valentina_media/189/922/395_1080x720.jpg 1080w, https://cloud.funda.nl/valentina_media/189/922/395_2160x1440.jpg 2160w, https://cloud.funda.nl/valentina_media/189/922/399_1440x960.jpg 1440w, https://cloud.funda.nl/valentina_media/189/922/399_180x120.jpg 180w, https://cloud.funda.nl/valentina_media/189/922/399_360x240.jpg 360w, https://cloud.funda.nl/valentina_media/189/922/399_720x480.jpg 720w, https://cloud.funda.nl/valentina_media/189/922/399_1080x720.jpg 1080w, https://cloud.funda.nl/valentina_media/189/922/399_2160x1440.jpg 2160w, https://cloud.funda.nl/valentina_media/189/922/400_1440x960.jpg 1440w, https://cloud.funda.nl/valentina_media/189/922/400_180x120.jpg 180w, https://cloud.funda.nl/valentina_media/189/922/400_360x240.jpg 360w, https://cloud.funda.nl/valentina_media/189/922/400_720x480.jpg 720w, https://cloud.funda.nl/valentina_media/189/922/400_1080x720.jpg 1080w, https://cloud.funda.nl/valentina_media/189/922/400_2160x1440.jpg 2160w, https://cloud.funda.nl/valentina_media/189/922/402_1440x960.jpg 1440w, https://cloud.funda.nl/valentina_media/189/922/402_180x120.jpg 180w, https://cloud.funda.nl/valentina_media/189/922/402_360x240.jpg 360w, https://cloud.funda.nl/valentina_media/189/922/402_720x480.jpg 720w, https://cloud.funda.nl/valentina_media/189/922/402_1080x720.jpg 1080w, https://cloud.funda.nl/valentina_media/189/922/402_2160x1440.jpg 2160w;952.0;17808.0
https://www.funda.nl/huur/enschede/appartement-43579266-espoortstraat-257-212/;43579266;enschede;appartement;Bestaande bouw;605;10.8;2;1;0;56;na;7511;Espoortstraat 257 212;1964;60;"Per 1 JUNI  a.s.  te huur,  Espoortstraat 257  212. Dit appartement is  gelegen  in een complex fraai gelegen in groene omgeving  aan de rand  van de binnenstad  van Enschede.   2-kamer  appartement  voorzien van gesloten/half open keuken (afhankelijk van type woning), woonkamer, balkon, doucheruimte, toilet, 1 slaapkamer en inpandige berging.  Het voorschot servicekosten bedraagt € 55,- per maand. Het voorschot stookkosten bedraagt € 70,- per maand.  Geen verhuur aan studenten.   Voorwaarden:  - Om in aanmerking te komen voor deze woning dient u een bruto inkomen te overleggen    van minimaal 4 maal de maandhuur;  - Huurder dient eenmalig een waarborgsom af te geven bij verhuurder a € 700,-;   Bijzonderheden:  - De huurprijs is exclusief gas, water en elektra;  - Uitsluitend bestemd voor maximaal 2 personen;  - Minimale huurperiode is 1 jaar.   Interesse in deze woning? Schrijft u zich kosteloos en vrijblijvend in op onze website nmgwonen.nl. Vervolgens kunt u bij de woning klikken op de knop [REAGEER]: u geeft hiermee aan dat u interesse hebt in de woning. Indien er meerdere kandidaten gereageerd hebben, wordt de woning aangeboden aan de best passende kandidaat, waarbij wij de kandidaten beoordelen op volgorde van binnenkomst.  Indien u zich inschrijft via onze website nmgwonen.nl, zullen wij u op basis van de verstrekte informatie automatisch per e-mail informeren over de woningen die beschikbaar komen en voldoen aan uw woonwensen.   Alle informatie is met de grootst mogelijke zorg samengesteld. Helaas kunnen wij niet altijd voorkomen dat de informatie enigszins afwijkt van de werkelijkheid. In sommige gevallen worden foto’s gebruikt van een soortgelijke woning of appartement en dienen als impressie. Aan de teksten, plattegronden, foto’s en maatvoeringen kunnen geen rechten worden ontleend.";https://cloud.funda.nl/valentina_media/189/570/195_1440x960.jpg 1440w, https://cloud.funda.nl/valentina_media/189/570/195_180x120.jpg 180w, https://cloud.funda.nl/valentina_media/189/570/195_360x240.jpg 360w, https://cloud.funda.nl/valentina_media/189/570/195_720x480.jpg 720w, https://cloud.funda.nl/valentina_media/189/570/195_1080x720.jpg 1080w, https://cloud.funda.nl/valentina_media/189/570/195_2160x1440.jpg 2160w, https://cloud.funda.nl/valentina_media/189/570/185_1440x960.jpg 1440w, https://cloud.funda.nl/valentina_media/189/570/185_180x120.jpg 180w, https://cloud.funda.nl/valentina_media/189/570/185_360x240.jpg 360w, https://cloud.funda.nl/valentina_media/189/570/185_720x480.jpg 720w, https://cloud.funda.nl/valentina_media/189/570/185_1080x720.jpg 1080w, https://cloud.funda.nl/valentina_media/189/570/185_2160x1440.jpg 2160w, https://cloud.funda.nl/valentina_media/189/570/189_1440x960.jpg 1440w, https://cloud.funda.nl/valentina_media/189/570/189_180x120.jpg 180w, https://cloud.funda.nl/valentina_media/189/570/189_360x240.jpg 360w, https://cloud.funda.nl/valentina_media/189/570/189_720x480.jpg 720w, https://cloud.funda.nl/valentina_media/189/570/189_1080x720.jpg 1080w, https://cloud.funda.nl/valentina_media/189/570/189_2160x1440.jpg 2160w, https://cloud.funda.nl/valentina_media/189/570/192_1440x960.jpg 1440w, https://cloud.funda.nl/valentina_media/189/570/192_180x120.jpg 180w, https://cloud.funda.nl/valentina_media/189/570/192_360x240.jpg 360w, https://cloud.funda.nl/valentina_media/189/570/192_720x480.jpg 720w, https://cloud.funda.nl/valentina_media/189/570/192_1080x720.jpg 1080w, https://cloud.funda.nl/valentina_media/189/570/192_2160x1440.jpg 2160w, https://cloud.funda.nl/valentina_media/189/570/194_1440x960.jpg 1440w, https://cloud.funda.nl/valentina_media/189/570/194_180x120.jpg 180w, https://cloud.funda.nl/valentina_media/189/570/194_360x240.jpg 360w, https://cloud.funda.nl/valentina_media/189/570/194_720x480.jpg 720w, https://cloud.funda.nl/valentina_media/189/570/194_1080x720.jpg 1080w, https://cloud.funda.nl/valentina_media/189/570/194_2160x1440.jpg 2160w;937.0;
